"2014 Reviewers List,"""",,""IEEE Transactions on Parallel and Distributed Systems"",""9 Dec 2014"",""2015"",""26"",""1"",""282"",""290"",""Lists the reviewers who contributed to IEEE Transactions on Parallel and Distributed Systems in 2014."",""1558-2183"","""",""10.1109/TPDS.2014.2368792"","""",""https://ieeexplore.ieee.org/stamp/stamp.jsp?arnumber=6979387"","""",""IEEE publishing"","""","""","""","""",""IEEE"",""9 Dec 2014"","""","""",""IEEE"",""IEEE Journals""";;;;;;;;;;;;;;;;;;;;;;;;;;;;;;;;;;;;;;;;
"Parallel Processing of Dynamic Continuous Queries over Streaming Data Flows,""Z. Deng"; X. Wu; L. Wang; X. Chen; R. Ranjan; A. Zomaya;" D. Chen"",""School of Computer Science, China University of Geosciences, Wuhan, P.R.China"; School of Computer Science, China University of Geosciences, Wuhan, P.R.China; School of Computer Science, China University of Geosciences, Wuhan, P.R.China; School of Computer Science, China University of Geosciences, Wuhan, P.R.China; ICT Centre, CSIRO, Australia; School of Information Technologies, The University of Sydney, Sydney, Australia;" School of Computer Science, China University of Geosciences, Wuhan, P.R.China"",""IEEE Transactions on Parallel and Distributed Systems"",""9 Feb 2015"",""2015"",""26"",""3"",""834"",""846"",""More and more real-time applications need to handle dynamic continuous queries over streaming data of high density. Conventional data and query indexing approaches generally do not apply for excessive costs in either maintenance or space. Aiming at these problems, this study first proposes a new indexing structure by fusing an adaptive cell and KDB-tree, namely CKDB-tree. A cell-tree indexing approach has been developed on the basis of the CKDB-tree that supports dynamic continuous queries. The approach significantly reduces the space costs and scales well with the increasing data size. Towards providing a scalable solution to filtering massive steaming data, this study has explored the feasibility to utilize the contemporary general-purpose computing on the graphics processing unit (GPGPU). The CKDB-tree-based approach has been extended to operate on both the CPU (host) and the GPU (device). The GPGPU-aided approach performs query indexing on the host while perform streaming data filtering on the device in a massively parallel manner. The two heterogeneous tasks execute in parallel and the latency of streaming data transfer between the host and the device is hidden. The experimental results indicate that (1) CKDB-tree can reduce the space cost comparing to the cell-based indexing structure by 60 percent on average, (2) the approach upon the CKDB-tree outperforms the traditional counterparts upon the KDB-tree by 66, 75 and 79 percent in average for uniform, skewed and hyper-skewed data in terms of update costs, and (3) the GPGPU-aided approach greatly improves the approach upon the CKDB-tree with the support of only a single Kepler GPU, and it provides real-time filtering of streaming data with 2.5M data tuples per second. The massively parallel computing technology exhibits great potentials in streaming data monitoring."",""1558-2183"","""",""10.1109/TPDS.2014.2311811"","""",""https://ieeexplore.ieee.org/stamp/stamp.jsp?arnumber=6767134"",""Streaming data";cell-tree query indexing structure;KDB-Tree;big data computing;data-intensive computing;"GPGPU"",""Indexing";Graphics processing units;Monitoring;Maintenance engineering;Computer architecture;"Real-time systems"","""",""30"","""",""33"",""EU"",""14 Mar 2014"","""","""",""IEEE"",""IEEE Journals""";;;;;;;;;;;;;;;;;;
"Parallel Simulation of Complex Evacuation Scenarios with Adaptive Agent Models,""D. Chen"; L. Wang; A. Y. Zomaya; M. Dou; J. Chen; Z. Deng;" S. Hariri"",""School of Computer, Wuhan University, Wuhan, Hubei, China"; School of Computer Science, China University of Geosciences, Wuhan, Hubei, China; School of Information Technologies, The University of Sydney, Sydney, NSW, Australia; School of Computer Science, China University of Geosciences, Wuhan, Hubei, China; National Engineering Center for E-Learning, Central China Normal University, Wuhan, Hubei; School of Computer Science, China University of Geosciences, Wuhan, Hubei, China;" Department of Electrical and Computer Engineering, The University of Arizona, Tucson, AZ"",""IEEE Transactions on Parallel and Distributed Systems"",""9 Feb 2015"",""2015"",""26"",""3"",""847"",""857"",""Simulation study on evacuation scenarios has gained tremendous attention in recent years. Two major research challenges remain along this direction: (1) how to portray the effect of individuals' adaptive behaviors under various situations in the evacuation procedures and (2) how to simulate complex evacuation scenarios involving huge crowds at the individual level due to the ultrahigh complexity of these scenarios. In this study, a simulation framework for general evacuation scenarios has been developed. Each individual in the scenario is modeled as an adaptable and autonomous agent driven by a weight-based decision-making mechanism. The simulation is intended to characterize the individuals' adaptable behaviors, the interactions among individuals, among small groups of individuals, and between the individuals and the environment. To handle the second challenge, this study adopts GPGPU to sustain massively parallel modeling and simulation of an evacuation scenario. An efficient scheme has been proposed to minimize the overhead to access the global system state of the simulation process maintained by the GPU platform. The simulation results indicate that the “adaptability” in individual behaviors has a significant influence on the evacuation procedure. The experimental results also exhibit the proposed approach's capability to sustain complex scenarios involving a huge crowd consisting of tens of thousands of individuals."",""1558-2183"","""",""10.1109/TPDS.2014.2311805"","""",""https://ieeexplore.ieee.org/stamp/stamp.jsp?arnumber=6774442"",""Adaptive agents";parallel modeling and simulation;evacuation;crowd behavior;"general-purpose computation on graphics processing units"",""Adaptation models";Computational modeling;Graphics processing units;Decision making;Educational institutions;Adaptive systems;"Context modeling"","""",""42"","""",""26"",""IEEE"",""17 Mar 2014"","""","""",""IEEE"",""IEEE Journals""";;;;;;;;;;;;;;;;;;
"Parallelization Hints via Code Skeletonization,""C. Aguston"; Y. B. Asher;" G. Haber"",""Department of Computer Science, University of Haifa, Haifa, Israel"; Department of Computer Science, University of Haifa, Haifa, Israel;" Intel IDC, Haifa, Israel"",""IEEE Transactions on Parallel and Distributed Systems"",""7 Oct 2015"",""2015"",""26"",""11"",""3099"",""3107"",""Tools that provide optimization hints for program developers are facing severe obstacles and often unable to provide meaningful guidance on how to parallelize real-life applications. The main reason is due to the high code complexity and its large size when considering commercially valuable code. Such code is often rich with pointers, heavily nested conditional statements, nested while-based loops, function calls, etc. These constructs prevent existing compiler analysis from extracting the full parallelization potential. We propose a new paradigm to overcome this issue by automatically transforming the code' into a much simpler skeleton-like form that is more conductive for auto-parallelization. We then apply existing tools of source-level automatic parallelization on the skeletonized code in order to expose possible parallelization patterns. The skeleton code, along with the parallelized version, are then provided to the programmer in the form of an Integrated Development Environment (IDE) recommendation. The proposed skeletonization algorithm replaces pointers by integer indexes and C-struct references by references to multi-dimensional arrays. For example, the loop while(p ≠ NULL) {p → val + +"; p = p → next;} will be skeletonized to: for(Ip = 0; Ip <; N; Ip + +){Aval[Ip] + +;"} where Aval[] holds the embedding of the original list. Consequently, the main goal of the skeletonization process is to embed pointer-based data structures into arrays. Though the skeletonized code is not semantically equivalent to the original code, it suggests a possible parallelization pattern for the selected code segment and can be used as an effective parallelization hint to the programmer. We applied the method on the SPEC CPU benchmarks and the skeletonization process detected 27 percent additional loops that can be parallelized/vectorized on top of the compiler auto-parallelizer/vectorizer. A performance gain of up to 45 percent was measured for benchmarks that were manually parallelized based on the generated skeleton code."",""1558-2183"","""",""10.1109/TPDS.2014.2371463"","""",""https://ieeexplore.ieee.org/stamp/stamp.jsp?arnumber=6987337"",""Program skeletons, parallelization, parallel programming"",""Arrays";Indexes;Skeleton;Shape;Optimization;"Parallel processing"","""",""1"","""",""22"",""IEEE"",""18 Dec 2014"","""","""",""IEEE"",""IEEE Journals""";;;;;;;;;;;;;;;;;;;;;;;;;
"Patient Infusion Pattern based Access Control Schemes for Wireless Insulin Pump System,""X. Hei"; X. Du; S. Lin; I. Lee;" O. Sokolsky"",""Department of Computer Science and Information Technologies, Frostburg State University, Frostburg, MD, USA"; Department of Computer and Information Sciences, Temple University, Philadelphia, PA, USA; Department of Electrical and Computer Engineering, Stony Brook University, Stony Brook, NY, USA; Department of Computer and Information Science, University of Pennsylvania, Philadelphia, PA, USA;" Department of Computer and Information Science, University of Pennsylvania, Philadelphia, PA, USA"",""IEEE Transactions on Parallel and Distributed Systems"",""7 Oct 2015"",""2015"",""26"",""11"",""3108"",""3121"",""Wireless insulin pumps have been widely deployed in hospitals and home healthcare systems. Most of them have limited security mechanisms embedded to protect them from malicious attacks. In this paper, two attacks against insulin pump systems via wireless links are investigated: a single acute overdose with a significant amount of medication and a chronic overdose with a small amount of extra medication over a long time period. They can be launched unobtrusively and may jeopardize patients' lives. It is very urgent to protect patients from these attacks. We propose a novel personalized patient infusion pattern based access control scheme (PIPAC) for wireless insulin pumps. This scheme employs supervised learning approaches to learn normal patient infusion patterns in terms of the dosage amount, rate, and time of infusion, which are automatically recorded in insulin pump logs. The generated regression models are used to dynamically configure a safe infusion range for abnormal infusion identification. This model includes two sub models for bolus (one type of insulin) abnormal dosage detection and basal abnormal rate detection. The proposed algorithms are evaluated with real insulin pump. The evaluation results demonstrate that our scheme is able to detect the two attacks with a very high success rate."",""1558-2183"","""",""10.1109/TPDS.2014.2370045"",""US NSF(grant numbers:CNS-0963578,CNS-1022552,CNS-1065444,IIS-1231680,CNS-1239108,CNS-1035715)";" "",""https://ieeexplore.ieee.org/stamp/stamp.jsp?arnumber=6954561"",""wireless insulin pump";implantable medical devices;access control;infusion pattern;patient safety;Wireless insulin pump;implantable medical devices;access control;infusion pattern;"patient safety"",""Insulin";Wireless communication;Communication system security;Wireless sensor networks;Diabetes;Access control;"Universal Serial Bus"","""",""37"","""",""37"",""IEEE"",""12 Nov 2014"","""","""",""IEEE"",""IEEE Journals""";;;;;;;;;;;;;;;;
"PCFTL: A Plane-Centric Flash Translation Layer Utilizing Copy-Back Operations,""W. Wang";" T. Xie"",""Computational Science Research Center, San Diego State University, San Diego, CA";" Department of Computer Science, San Diego State University, San Diego, CA"",""IEEE Transactions on Parallel and Distributed Systems"",""10 Nov 2015"",""2015"",""26"",""12"",""3420"",""3432"",""A software module named flash translation layer (FTL) running in the controller of a flash SSD exposes the linear flash memory to the system as a block storage device. The effectiveness of an FTL significantly impacts the performance and durability of a flash SSD. In this research, we propose a new FTL called PCFTL (Plane-Centric FTL), which fully exploits plane-level parallelism supported by modern flash SSDs. Its basic idea is to allocate updates onto the same plane where their associated original data resides on so that the write distribution among planes is balanced. Furthermore, it utilizes fast intra-plane copy-back operations to transfer valid pages of a victim block when a garbage collection occurs. We largely extend a validated simulation environment called SSDsim to implement PCFTL. Comprehensive experiments using realistic enterprise-scale workloads are performed to evaluate its performance with respect to mean response time and durability in terms of standard deviation of writes per plane. Experimental results demonstrate that compared with the well-known DFTL, PCFTL improves performance and durability by up to 47 and 80 percent, respectively. Compared with its earlier version (called DLOOP), PCFTL enhances durability by up to 74 percent while delivering a similar I/O performance."",""1558-2183"","""",""10.1109/TPDS.2014.2371022"",""U.S. National Science Foundation"; CNS(grant numbers:0845105,CNS-1320738);" "",""https://ieeexplore.ieee.org/stamp/stamp.jsp?arnumber=6957592"",""flash translation layer";copy-back;merge operations;solid state disk;garbage collection;Flash translation layer;copy-back;merge operations;solid state disk;"garbage collection"",""Parallel processing";Servers;Random access memory;Memory management;Performance evaluation;Time factors;"Solid state circuits"","""",""15"",""1"",""21"",""IEEE"",""14 Nov 2014"","""","""",""IEEE"",""IEEE Journals""";;;;;;;;;;;;;;;;;;;;;
"Performance Analysis and Optimization for SpMV on GPU Using Probabilistic Modeling,""K. Li"; W. Yang;" K. Li"",""College of Information Science and Engineering, Hunan University, Changsha, Hunan, P.R. China"; College of Information Science and Engineering, Hunan University, Changsha, Hunan, P.R. China;" College of Information Science and Engineering, Hunan University, Changsha, Hunan, P.R. China"",""IEEE Transactions on Parallel and Distributed Systems"",""9 Dec 2014"",""2015"",""26"",""1"",""196"",""205"",""This paper presents a unique method of performance analysis and optimization for sparse matrix-vector multiplication (SpMV) on GPU. This method has wide adaptability for different types of sparse matrices and is different from existing methods which only adapt to some particular sparse matrices. In addition, our method does not need additional benchmarks to get optimized parameters, which are calculated directly through the probability mass function (PMF). We make the following contributions. (1) We present a PMF to analyze precisely the distribution pattern of non-zero elements in a sparse matrix. The PMF can provide theoretical basis for the compression of a sparse matrix. (2) Compression efficiency of COO, CSR, ELL, and HYB can be analyzed precisely through the PMF, and combined with the hardware parameters of GPU, the performance of SpMV based on COO, CSR, ELL, and HYB can be estimated. Furthermore, the most appropriate format for SpMV can be selected according to estimated value of the performance. Experiments prove that the theoretical estimated values and the tested values have high consistency. (3) For HYB, the optimal segmentation threshold can be found through the PMF to achieve the optimal performance for SpMV. Our performance modeling and analysis are very accurate. The order of magnitude of the estimated speedup and that of the tested speedup for each of the ten tested sparse matrices based on the three formats COO, CSR, and ELL are the same. The percentage of relative difference between an estimated value and a tested value is less than 20 percent for over 80 percent cases. The performance improvement of our algorithm is also effective. The average performance improvement of the optimal solution for HYB is over 15 percent compared with that of the automatic solution provided by CUSPARSE lib."",""1558-2183"","""",""10.1109/TPDS.2014.2308221"","""",""https://ieeexplore.ieee.org/stamp/stamp.jsp?arnumber=6748055"",""GPU";performance modeling;probability mass function;"sparse matrix-vector multiplication"",""Sparse matrices";Silicon;Graphics processing units;Instruction sets;Vectors;Arrays;"Performance analysis"","""",""178"","""",""35"",""IEEE"",""25 Feb 2014"","""","""",""IEEE"",""IEEE Journals""";;;;;;;;;;;;;;;;;;;;;;;;;;;
"Performance Evaluation and Optimization of Communication Infrastructure for the Next Generation Air Transportation System,""P. Park";" C. Tomlin"",""Electronics and Telecommunications Research Institute, Korea";" Department of Electrical Engineering and Computer Science, University of California at Berkeley, Berkeley, CA"",""IEEE Transactions on Parallel and Distributed Systems"",""10 Mar 2015"",""2015"",""26"",""4"",""1106"",""1116"",""Automatic dependent surveillance-broadcast (ADS-B) is one of the fundamental surveillance technologies to improve the safety, capacity, and efficiency of the national airspace system. ADS-B shares its frequency band with current radar systems that use the same 1,090 MHz band. The coexistence of radar systems and ADS-B systems is a key issue to detect and resolve conflicts in the next generation air transportation system (NextGen). This paper focuses on the performance evaluation of ADS-B with existing radar systems and performance optimization of ADS-B systems to improve the safety and efficiency of conflict detection and resolution in NextGen. We have developed a simulation environment which models the complex interplay among the air traffic load, the radar systems, the ADS-B systems, and the wireless channel. A simple model is used to derive an analytical expression for a performance metric of ADS-B. This model is then used to design an adaptive ADS-B protocol for maximizing the information coverage while guaranteeing reliable and timely communication in air traffic surveillance networks. Simulation results show that the effect of ADS-B interference on the current radar system is negligible. The operational ability of ADS-B meets the performance requirements of conflict detection and resolution in air traffic control. However, upgrades are required in the current radar system for operation within an ADS-B environment since the current radars can significantly degrade the ADS-B performance. Numerical results indicate that the proposed adaptive protocol has the potential to improve the performance of conflict detection and resolution in air traffic control."",""1558-2183"","""",""10.1109/TPDS.2014.2317720"",""National Science Foundation(grant numbers:CNS-931843)"; ONR(grant numbers:N0014-08-0696); SMARTS(grant numbers:N00014-09-1-1051); MURIs(grant numbers:N00014-12-1-0609); AFOSR(grant numbers:FA9550-10-1-0567);" "",""https://ieeexplore.ieee.org/stamp/stamp.jsp?arnumber=6799224"",""Cyber-physical systems";air traffic surveillance network;performance evaluation;"distributed adaptation"",""Aircraft";Atmospheric modeling;Surveillance;Interference;Airborne radar;"Load modeling"","""",""8"","""",""28"",""IEEE"",""16 Apr 2014"","""","""",""IEEE"",""IEEE Journals""";;;;;;;;;;;;;;;;;;;;;;;;;
"Performance Optimization for Managing Massive Numbers of Small Files in Distributed File Systems,""S. Fu"; L. He; C. Huang; X. Liao;" K. Li"",""College of Polytechnic, Hunan Normal University, Changsha, China"; School of Information Science and Engineering, Hunan University, Changsha, China; School of Computer Science, National University of Defense Technology, Changsha, China; School of Computer Science, National University of Defense Technology, Changsha, China;" School of Information Science and Engineering, Hunan University, Changsha, China"",""IEEE Transactions on Parallel and Distributed Systems"",""10 Nov 2015"",""2015"",""26"",""12"",""3433"",""3448"",""The processing of massive numbers of small files is a challenge in the design of distributed file systems. Currently, the combined-block-storage approach is prevalent. However, the approach employs the traditional file systems such as ExtFS and may cause inefficiency when accessing small files randomly located in the disk. This paper focuses on optimizing the performance of data servers in accessing massive numbers of small files. We present a Flat Lightweight File System (iFlatLFS) to manage small files, which is based on a simple metadata scheme and a flat storage architecture. iFlatLFS is designed to substitute the traditional file system on data servers and can be deployed underneath distributed file systems that store massive numbers of small files. iFlatLFS can greatly simplify the original data access procedure. The new metadata proposed in this paper occupies only a fraction of the metadata size based on traditional file systems. We have implemented iFlatLFS in CentOS 5.5 and integrated it into an open source Distributed File System (DFS), called Taobao FileSystem (TFS), which is developed by a top B2C service provider, Alibaba, in China and is managing over 28.6 billion small photos. We have conducted extensive experiments to verify the performance of iFlatLFS. The results show that when the file size ranges from 1 to 64 KB, iFlatLFS is faster than Ext4 by 48 and 54 percent on average for random read and write in the DFS environment, respectively. Moreover, after iFlatLFS is integrated into TFS, iFlatLFS-based TFS is faster than the existing Ext4-based TFS by 45 and 49 percent on average for random read access and hybrid access (the mix of read and write accesses), respectively."",""1558-2183"","""",""10.1109/TPDS.2014.2377720"",""China HGJ Project(grant numbers:2013ZX01040-002)"; Leverhulme Trust(grant numbers:RPG-101); Key Program of National Natural Science Foundation of China(grant numbers:61133005,61432005);" "",""https://ieeexplore.ieee.org/stamp/stamp.jsp?arnumber=6977977"",""Distributed File System";Data Server;Small File;Performance Optimization;Distributed file system;data server;small file;"performance optimization"",""Servers";File systems;Distributed databases;Performance evaluation;Optimization;"Data models"","""",""24"","""",""45"",""EU"",""5 Dec 2014"","""","""",""IEEE"",""IEEE Journals""";;;;;;;;;;;;;;;;;
"Performance-Oriented Partitioning for Task Scheduling of Parallel Reconfigurable Architectures,""C. -C. Kao"",""National University of Tainan, Tainan, TW"",""IEEE Transactions on Parallel and Distributed Systems"",""9 Feb 2015"",""2015"",""26"",""3"",""858"",""867"",""Dynamic reconfiguration is important for reconfigurable platforms. Parallel reconfigurable computing (PRC) architecture consists of multiple dynamic reconfigurable computing (DRC) units. Thus, for a circuit to be implemented on a parallel reconfiguration system, it needs to be partitioned such that each sub-circuit can be executed to the DRC units in a PRC system. For high performance, this paper proposes a greedy algorithm that maximizes data parallelism for task scheduling of parallel reconfigurable architectures with unlimited resources. The proposed algorithm generates an optimal solution in polynomial time $O(n^{3})$ , where  $n$ is the total number of the tasks. After obtaining a depth optimal solution, we reduce the resources without decreasing performance by the duplication packing operations whose time complexity is $O(n^{3})$ . To demonstrate the performance of the proposed algorithm, we not only compare the existing methods with standard benchmarks but also implement on physical systems, like DSP, FIR, and JPEG. The experimental results show that the proposed algorithms satisfy the requirements of the performance-oriented systems with limited resources. Hence, we have sufficient reason to believe that the runtime must be reasonable for general applications."",""1558-2183"","""",""10.1109/TPDS.2014.2312924"","""",""https://ieeexplore.ieee.org/stamp/stamp.jsp?arnumber=6777320"",""Dynamic reconfiguration";optimization;performance;parallel;"and task scheduling"",""Partitioning algorithms";Floors;Computer architecture;Hardware;Scheduling;"Processor scheduling"","""",""17"","""",""48"",""IEEE"",""21 Mar 2014"","""","""",""IEEE"",""IEEE Journals""";;;;;;;;;;;;;;;;;;;;;;;;;;;;;;;
