"2014 Reviewers List,"""",,""IEEE Transactions on Parallel and Distributed Systems"",""9 Dec 2014"",""2015"",""26"",""1"",""282"",""290"",""Lists the reviewers who contributed to IEEE Transactions on Parallel and Distributed Systems in 2014."",""1558-2183"","""",""10.1109/TPDS.2014.2368792"","""",""https://ieeexplore.ieee.org/stamp/stamp.jsp?arnumber=6979387"","""",""IEEE publishing"","""","""","""","""",""IEEE"",""9 Dec 2014"","""","""",""IEEE"",""IEEE Journals""";;;;;;;;;;;;;;;;;;;;;;;;;;;;;;;;;;;;;;;;
"Computation Offloading for Service Workflow in Mobile Cloud Computing,""S. Deng"; L. Huang; J. Taheri;" A. Y. Zomaya"",""College of Computer Science and Technology, Zhejiang University"; College of Computer Science and Technology, Zhejiang University; School of Information Technologies, The University of Sydney;" School of Information Technologies, The University of Sydney"",""IEEE Transactions on Parallel and Distributed Systems"",""10 Nov 2015"",""2015"",""26"",""12"",""3317"",""3329"",""The development of cloud computing and virtualization techniques enables mobile devices to overcome the severity of scarce resource constrained by allowing them to offload computation and migrate several computation parts of an application to powerful cloud servers. A mobile device should judiciously determine whether to offload computation as well as what portion of an application should be offloaded to the cloud. This paper considers a mobile computation offloading problem where multiple mobile services in workflows can be invoked to fulfill their complex requirements and makes decision on whether the services of a workflow should be offloaded. Due to the mobility of portable devices, unstable connectivity of mobile networks can impact the offloading decision. To address this issue, we propose a novel offloading system to design robust offloading decisions for mobile services. Our approach considers the dependency relations among component services and aims to optimize execution time and energy consumption of executing mobile services. To this end, we also introduce a mobility model and a trade-off fault-tolerance mechanism for the offloading system. A genetic algorithm (GA) based offloading method is then designed and implemented after carefully modifying parts of a generic GA to match our special needs for the stated problem. Experimental results are promising and show nearoptimal solutions for all of our studied cases with almost linear algorithmic complexity with respect to the problem size."",""1558-2183"","""",""10.1109/TPDS.2014.2381640"",""National Natural Science Foundation of China(grant numbers:61170033)"; National High-Tech Research and Development Plan of China(grant numbers:2013BAD19B10);" "",""https://ieeexplore.ieee.org/stamp/stamp.jsp?arnumber=6987330"",""Mobile Cloud Computing";Service Workflow;Computation Offloading;Service Composition;Mobile cloud computing;service workflow;computation offloading;"service composition"",""Mobile communication";Mobile handsets;Cloud computing;Servers;Mobile computing;Energy consumption;"Computational modeling"","""",""220"",""1"",""32"",""IEEE"",""18 Dec 2014"","""","""",""IEEE"",""IEEE Journals""";;;;;;;;;;;;;;;;;;;
"Consistency-Aware Zone Mapping and Client Assignment in Multi-Server Distributed Virtual Environments,""Y. Li";" W. Cai"",""School of Computer Engineering, Nanyang Technological University, Nanyang Avenue 50, Singapore";" School of Computer Engineering, Nanyang Technological University, Nanyang Avenue 50, Singapore"",""IEEE Transactions on Parallel and Distributed Systems"",""12 May 2015"",""2015"",""26"",""6"",""1570"",""1579"",""In Distributed Virtual Environments (DVEs), the primary task is to maintain a consistent view of the virtual world among all users. Multi-server architecture has been shown to have good scalability to support a large population of users in DVEs. In the zone-based Multi-server Distributed Virtual Environment (MSDVE), zone mapping and client assignment are two key issues in the design of an efficient and scalable MSDVE. Most of the existing work on the zone mapping and client assignment issues in MSDVE aims to either balance workload among servers, reduce inter-server communication, and/or reduce transmission delay. In this paper, we study the zone mapping and client assignment issues from a new perspective aiming to reduce the inconsistency of a DVE. Using the time-space inconsistency metric, we formally formulate the problem as a mix integer programming problem. The zone mapping and client assignment strategy is proposed which consists of a centralized algorithm for initialization and a distributed adaptive tuning algorithm for running system. Extensive experiments were conducted both by simulation and real system for evaluating the performance of the proposed solutions and results are reported in the paper."",""1558-2183"","""",""10.1109/TPDS.2014.2323261"","""",""https://ieeexplore.ieee.org/stamp/stamp.jsp?arnumber=6814946"",""Distributed virtual environment";Multi-server architecture;time-space consistency;partitioning;"alternating optimization"",""Servers";Avatars;Bandwidth;Optimization;Delays;Virtual environments;"Games"","""",""5"","""",""24"",""IEEE"",""13 May 2014"","""","""",""IEEE"",""IEEE Journals""";;;;;;;;;;;;;;;;;;;;;;;;;;;;
"Containing Byzantine Failures with Control Zones,""A. Maurer";" S. Tixeuil"",""UPMC Sorbonne Universités, Paris, France";" UPMC Sorbonne Universités, Paris, France"",""IEEE Transactions on Parallel and Distributed Systems"",""14 Jan 2015"",""2015"",""26"",""2"",""362"",""370"",""We consider the problem of reliably broadcasting messages in a network where some nodes are likely to fail. We consider the most general failure model: the Byzantine model, where the failing nodes have an arbitrary behavior, and may actively try to destabilize the network. We focus on totally decentralized solutions. Most existing solutions require high network connectivity, and are not adapted to sparsely connected networks. A typical example is the grid, where each node has at most four neighbors. In this paper, we propose a new broadcast protocol adapted to such networks. This protocol is based on interconnected subsets called control zones, that filter the diffusion of false messages. We give a methodology to determine a set of nodes that always communicate reliably, depending on the placement of Byzantine nodes. We then use this methodology to perform an experimental evaluation on square and hexagonal grids, in the presence of randomly distributed Byzantine failures. We show that our protocol significantly improves the communication probability, compared to existing solutions."",""1558-2183"","""",""10.1109/TPDS.2014.2308190"","""",""https://ieeexplore.ieee.org/stamp/stamp.jsp?arnumber=6748070"",""Byzantine failures";multihop networks;asynchronous networks;reliable broadcast;fault tolerance;distributed computing;protocol;"random failures"",""Protocols";Peer-to-peer computing;Authorization;Topology;Standards;"Reliability theory"","""",""8"","""",""26"",""IEEE"",""25 Feb 2014"","""","""",""IEEE"",""IEEE Journals""";;;;;;;;;;;;;;;;;;;;;;;;;;
"Contention Aware Energy Efficient Scheduling on Heterogeneous Multiprocessors,""J. Singh"; S. Betha; B. Mangipudi;" N. Auluck"",""Department of Computer Science & Engineering, Indian Institute of Technology Ropar, Rupnagar, India"; R&D Department, Arista Networks India Pvt. Ltd, Banguluru, India; R&D Department, Microsoft India Pvt. Ltd, Hyderabad, India;" Department of Computer Science & Engineering, Indian Institute of Technology Ropar, Rupnagar, India"",""IEEE Transactions on Parallel and Distributed Systems"",""7 Apr 2015"",""2015"",""26"",""5"",""1251"",""1264"",""Energy efficiency along with enhanced performance are two important goals of scheduling on multiprocessors. This paper proposes a Contention-aware, Energy Efficient, Duplication based Mixed Integer Programming (CEEDMIP) formulation for scheduling task graphs on heterogeneous multiprocessors, interconnected in a distributed system or a network on chip architecture. The effect of duplication is studied with respect to minimizing: the makespan, the total energy for processing tasks and messages on processors and network resources respectively and the tardiness of tasks with respect to their deadlines. Optimizing the use of duplication with MIP provides both energy efficiency and performance by reducing the communication energy consumption and the communication latency. The contention awareness gives a more accurate estimation of the energy consumption. We also propose a corner case that allows the scheduling of a parent task copy after a copy of the child task which may lead to efficient schedules. It has been observed that the proposed MIP with a clustering based heuristic provides scalability and gives 10-30 percent improvement in energy with improved makespan and accuracy when compared with other duplication based energy aware algorithms."",""1558-2183"","""",""10.1109/TPDS.2014.2322354"",""DST";" "",""https://ieeexplore.ieee.org/stamp/stamp.jsp?arnumber=6811172"",""MIP";energy;duplication;scheduling;heterogeneous;"DAG"",""Program processors";Schedules;Processor scheduling;Energy consumption;Switches;Energy efficiency;"Linear programming"","""",""29"","""",""33"",""IEEE"",""7 May 2014"","""","""",""IEEE"",""IEEE Journals""";;;;;;;;;;;;;;;;;;;;;;
"Contention-Aware Energy Management Scheme for NoC-Based Multicore Real-Time Systems,""J. -J. Han"; M. Lin; D. Zhu;" L. T. Yang"",""School of Computer Science and Technology, Huazhong University of Science and Technology, Wuhan, China"; Computer Science Department, St. Francis Xavier University, Anitgonish, NS, Canada; Computer Science Department, University of Texas at San Antonio, San Antonio, TX;" Department of Computer Science, St. Francis Xavier University, Antigonish, NS, Canada"",""IEEE Transactions on Parallel and Distributed Systems"",""10 Feb 2015"",""2015"",""26"",""3"",""691"",""701"",""Network-on-Chip (NoC) has emerged as interconnect paradigm in state-of-the-art multi/many core architectures. Voltage and frequency island (VFI) was recently adopted as an effective energy management technique for large scale multicore chip designs. Focusing on NoCand VFI-based multi/many core real-time systems with Dynamic Voltage and Frequency Scaling (DVFS) capability, we study both static and dynamic contention-aware energy management schemes for task set with precedence relationships and a common deadline. First, our static schemes utilize two approaches with contention awareness to obtain the mapping of tasks to cores together with scheduling of communications on NoC for minimizing makespan, and thus can potentially lower uniform scaled frequency for cores and links while meeting the timeliness. Next, different from other existing schemes, by incorporating the latency due to network congestions into the analysis, our dynamic contention-aware energy management schemes perform the allocation of feasible slack to tasks and communications simultaneously for further energy savings, subject to common voltage and frequency limitations of VFI and timing constraints of task set. The results through extensive simulations and case studies show that, compared to heuristicbased and INLP-based task mapping solutions (with pessimistic estimation of communication contention), our static scheme can obtain better energy savings (e.g., 25 percent more). The results also show that our dynamic scheme can save up to 45 percent more energy compared to our static scheme under deadline guarantee, while the online scheme ignoring the traffic congestions in NoC can result in serious deadline violation and usually more energy consumption (e.g., 15 percent more)."",""1558-2183"","""",""10.1109/TPDS.2014.2307866"","""",""https://ieeexplore.ieee.org/stamp/stamp.jsp?arnumber=6774493"",""Real-time systems";energy savings;multi/many core processors;Network-on-Chip (NoC);communication contention;voltage frequency island (VFI);"dynamic voltage/frequency scaling (DVFS)"",""Multicore processing";Energy management;Real-time systems;Routing;Program processors;"Optical switches"","""",""27"","""",""37"",""IEEE"",""17 Mar 2014"","""","""",""IEEE"",""IEEE Journals""";;;;;;;;;;;;;;;;;;;;;;;
"Cooperative Coverage Extension for Relay-Union Networks,""Y. Cui"; X. Ma; X. Cheng; M. Li; J. Liu; T. Ma; Y. Guo;" B. Chen"",""Department of Computer Science and Technology, Tsinghua University, Beijing, P.R. China"; Department of Computer Science and Technology, Tsinghua University, Beijing, P.R. China; Department of Computer Science, The George Washington University, Washington, DC; Department of Computer Science, City University of Hong Kong, Hong Kong; School of Computing Science, Simon Fraser University, British Columbia, Canada; Department of Computer Science and Technology, Tsinghua University, Beijing, P.R. China; Department of Computer Science and Technology, Tsinghua University, Beijing, P.R. China;" Department of Computer Information Science, university of Macau, Macau, P.R. China"",""IEEE Transactions on Parallel and Distributed Systems"",""15 Jan 2015"",""2015"",""26"",""2"",""371"",""381"",""Multi-hop coverage extension can be utilized as a feasible approach to facilitating uncovered users to get Internet service in public area WLANs. In this paper we introduce a relay-union network (RUN), which refers to a public area WLAN in which users often wander in the same area and have the ability to provide data forwarding services for others. We develop a RUN framework to model the cost of providing forwarding services and the utility obtained by gaining services. The objective of the RUN is to maximize the total Quality of Cooperation (QoC) of users in the RUN. Two optimal bandwidth allocation schemes are proposed for both free and dynamic bandwidth demand models. To make our scheme more pragmatic, we then consider a more practical scenario in which the bandwidth capacity of the relays and the minimum demand of the clients are bounded. We prove that the problems under both the single relay and the multi-relay scenario are NP-hard. Three heuristic algorithms are proposed to deal with bandwidth allocation and relay-client association. We also propose a distributed signaling protocol and divide the centralized MRMC algorithm into three distributed ones to better adapt for real network environment. Finally, extensive simulations demonstrate that our RUN framework can significantly improve the efficiency of cooperation in the long term."",""1558-2183"","""",""10.1109/TPDS.2014.2308201"","""",""https://ieeexplore.ieee.org/stamp/stamp.jsp?arnumber=6748021"",""Coverage extension";relay-union network;bandwidth allocation;association;"cooperative"",""Bandwidth";Relays;Channel allocation;Cost function;Mathematical model;"Heuristic algorithms"","""",""4"","""",""20"",""IEEE"",""25 Feb 2014"","""","""",""IEEE"",""IEEE Journals""";;;;;;;;;;;;;;;;;
"Cooperative Positioning and Tracking in Disruption Tolerant Networks,""W. Li"; Y. Hu; X. Fu; S. Lu;" D. Chen"",""State Key Laboratory for Novel Software Technology, Nanjing University, Nanjing, China"; State Key Laboratory for Novel Software Technology, Nanjing University, Nanjing, China; Institute of Computer Science, University of Goettingen, Goettingen, Germany; State Key Laboratory for Novel Software Technology, Nanjing University, Nanjing, China;" State Key Laboratory for Novel Software Technology, Nanjing University, Nanjing, China"",""IEEE Transactions on Parallel and Distributed Systems"",""14 Jan 2015"",""2015"",""26"",""2"",""382"",""391"",""With the increasing number of location-dependent applications, positioning and tracking a mobile device becomes more and more important to enable pervasive and context-aware service. While extensive research has been performed in physical localization and logical localization for satellite, GSM and WiFi communication networks where fixed reference points are densely-deployed, positioning and tracking techniques in a sparse disruption tolerant network (DTN) have not been well addressed. In this paper, we propose a decentralized cooperative method called PulseCounting for DTN localization and a probabilistic tracking method called ProbTracking to confront this challenge. PulseCounting evaluates the user walking steps and movement orientations using accelerometer and electronic compass equipped in cellphones. It estimates user location by accumulating the walking segments, and improves the estimation accuracy by exploiting the encounters of mobile nodes. Several methods to refine the location estimation are discussed, which include the adjustment of trajectory based on reference points and the mutual refinement of location estimation for encountering nodes based on maximum-likelihood. To track user movement, the proposed ProbTracking method uses Markov chain to describe movement patterns and determines the most possible user walking trajectories without full record of user locations. We implemented the positioning and tracking system in Android phones and deployed a testbed in the campus of Nanjing University. Extensive experiments are conducted to evaluate the effectiveness and accuracy of the proposed methods, which show an average deviation of 9m in our system compared to GPS."",""1558-2183"","""",""10.1109/TPDS.2014.2310471"","""",""https://ieeexplore.ieee.org/stamp/stamp.jsp?arnumber=6763003"",""Disruption tolerant network";positioning;tracking;"cooperation"",""Estimation";Trajectory;Legged locomotion;Compass;Accelerometers;IEEE 802.11 Standards;"Global Positioning System"","""",""19"","""",""24"",""IEEE"",""11 Mar 2014"","""","""",""IEEE"",""IEEE Journals""";;;;;;;;;;;;;;;;;;;;;;;
"Cooperative Web Caching Using Dynamic Interest-Tagged Filtered Bloom Filters,""H. Alexander"; I. Khalil; C. Cameron; Z. Tari;" A. Zomaya"",""NA"; School of Computer Science & IT, RMIT University, Melbourne, VIC, Australia; School of Computer Science & IT, RMIT University, Melbourne, VIC, Australia; School of Computer Science & IT, RMIT University, Melbourne, VIC, Australia;" School of Information Technologies, University of Sydney, Sydney, Australia"",""IEEE Transactions on Parallel and Distributed Systems"",""7 Oct 2015"",""2015"",""26"",""11"",""2956"",""2969"",""Although cooperative Web caching has been widely researched, comparatively little has been done to reduce inter-proxy network overhead whilst allowing for a high percentage of requested documents to be retrieved from the cache. Alleviating these issues can substantially reduce Web traffic, increase scalability and enhance a user's browsing experience. This paper introduces a novel cache sharing system employing data structures called Dynamic Interest-Tagged Filtered Bloom Filters (DITFBFs). DITFBFs are capable of representing the cache content of a proxy in a compact form, which is then shared with other proxies in the cooperative Web caching system. What distinguishes the proposed system from others is that DITFBFs only represent the portion of a proxy's cache content that will be of interest to another proxy. This then results in a reduction of inter-proxy overhead. Experimental simulations indicate that, when compared with existing protocols, the proposed system is capable of multiple improvements. Namely, lowering the number of remote cache search messages by at least 60 percent, decreasing user-perceived latency by at least 65 percent and appreciably reducing the overall inter-proxy network overhead. The proposed system accomplishes this whilst maintaining a cache hit ratio as high as the other protocols."",""1558-2183"","""",""10.1109/TPDS.2014.2363458"","""",""https://ieeexplore.ieee.org/stamp/stamp.jsp?arnumber=6926845"",""Web Caching";Cooperative Caching;Bloom Filters;Summary Cache;Peer-to-Peer;Cache Performance;Web caching;cooperative caching;bloom filters;summary cache;peer-to-peer;"cache performance"",""Protocols";Information filters;Servers;Scalability;Educational institutions;"Arrays"","""",""10"","""",""31"",""IEEE"",""16 Oct 2014"","""","""",""IEEE"",""IEEE Journals""";;;;;;;;;;;;;;;;
"CoreTSAR: Core Task-Size Adapting Runtime,""T. R. W. Scogland"; W. -C. Feng; B. Rountree;" B. R. de Supinski"",""Department of Computer Science, Virginia Tech, Blacksburg, VA"; Department of Computer Science, Virginia Tech, Blacksburg, VA; Center for Applied Scientific Computing, Lawrence Livermore National Laboratory, Livermore, CA;" Center for Applied Scientific Computing, Lawrence Livermore National Laboratory, Livermore, CA"",""IEEE Transactions on Parallel and Distributed Systems"",""7 Oct 2015"",""2015"",""26"",""11"",""2970"",""2983"",""Heterogeneity continues to increase at all levels of computing, with the rise of accelerators such as GPUs, FPGAs, and other co-processors into everything from desktops to supercomputers. As a consequence, efficiently managing such disparate resources has become increasingly complex. CoreTSAR seeks to reduce this complexity by adaptively worksharing parallel-loop regions across compute resources without requiring any transformation of the code within the loop. Our results show performance improvements of up to three-fold over a current state-of-the-art heterogeneous task scheduler as well as linear performance scaling from a single GPU to four GPUs for many codes. In addition, CoreTSAR demonstrates a robust ability to adapt to both a variety of workloads and underlying system configurations."",""1558-2183"","""",""10.1109/TPDS.2014.2365192"",""US Department of Energy’s Lawrence Livermore National Laboratory"; Office of Science(grant numbers:DE-AC52-07NA27344); Office of Advanced Scientific Computing Research(grant numbers:LLNL-JRNL-662817); Air Force Office of Scientific Research; Computational Mathematics Program(grant numbers:FA9550-12-1-0442); NSF(grant numbers:I/UCRC IIP-1266245); NSF Center for High-Performance Reconfigurable Computing; DoD National Defense Science & Engineering Graduate Fellowship;" "",""https://ieeexplore.ieee.org/stamp/stamp.jsp?arnumber=6936921"",""Heterogeneous, OpenMP, OpenACC, GPU, coscheduling";"Heterogeneous, OpenMP, OpenACC, GPU, coscheduling"",""Schedules";Acceleration;Graphics processing units;Memory management;Computational modeling;Runtime;"Programming"","""",""9"","""",""22"",""IEEE"",""27 Oct 2014"","""","""",""IEEE"",""IEEE Journals""";;;;;;;;;;;;;;;;;;;
"Cost-Aware SEcure Routing (CASER) Protocol Design for Wireless Sensor Networks,""D. Tang"; T. Li; J. Ren;" J. Wu"",""D. Tang, T. Li, and J. Ren are with the Department of Electrical and Computer Engineering, Michigan State University, East Lansing, MI"; D. Tang, T. Li, and J. Ren are with the Department of Electrical and Computer Engineering, Michigan State University, East Lansing, MI; D. Tang, T. Li, and J. Ren are with the Department of Electrical and Computer Engineering, Michigan State University, East Lansing, MI;" J. Wu is with the Department of Computer and Information Sciences, Temple University, Philadelphia, 19122. E-mail: jiewu@temple.edu."",""IEEE Transactions on Parallel and Distributed Systems"",""10 Mar 2015"",""2015"",""26"",""4"",""960"",""973"",""Lifetime optimization and security are two conflicting design issues for multi-hop wireless sensor networks (WSNs) with non-replenishable energy resources. In this paper, we first propose a novel secure and efficient Cost-Aware SEcure Routing (CASER) protocol to address these two conflicting issues through two adjustable parameters: energy balance control (EBC) and probabilistic-based random walking. We then discover that the energy consumption is severely disproportional to the uniform energy deployment for the given network topology, which greatly reduces the lifetime of the sensor networks. To solve this problem, we propose an efficient non-uniform energy deployment strategy to optimize the lifetime and message delivery ratio under the same energy resource and security requirement. We also provide a quantitative security analysis on the proposed routing protocol. Our theoretical analysis and OPNET simulation results demonstrate that the proposed CASER protocol can provide an excellent tradeoff between routing efficiency and energy balance, and can significantly extend the lifetime of the sensor networks in all scenarios. For the non-uniform energy deployment, our analysis shows that we can increase the lifetime and the total number of messages that can be delivered by more than four times under the same assumption. We also demonstrate that the proposed CASER protocol can achieve a high message delivery ratio while preventing routing traceback attacks."",""1558-2183"","""",""10.1109/TPDS.2014.2318296"",""US National Science Foundation(grant numbers:CNS-0845812,CNS-0746811,CNS-1217206,CCSS-1232109)";" "",""https://ieeexplore.ieee.org/stamp/stamp.jsp?arnumber=6800079"",""Routing";security;energy efficiency;energy balance;delivery ratio;deployment;"simulation"",""Routing";Wireless sensor networks;Energy states;Routing protocols;Security;"Energy consumption"","""",""45"","""",""25"",""IEEE"",""17 Apr 2014"","""","""",""IEEE"",""IEEE Journals""";;;;;;;;;;;;;;;;;;;;;;
