"2014 Reviewers List,"""",,""IEEE Transactions on Parallel and Distributed Systems"",""9 Dec 2014"",""2015"",""26"",""1"",""282"",""290"",""Lists the reviewers who contributed to IEEE Transactions on Parallel and Distributed Systems in 2014."",""1558-2183"","""",""10.1109/TPDS.2014.2368792"","""",""https://ieeexplore.ieee.org/stamp/stamp.jsp?arnumber=6979387"","""",""IEEE publishing"","""","""","""","""",""IEEE"",""9 Dec 2014"","""","""",""IEEE"",""IEEE Journals""";;;;;;;;;;;;;;;;;;;;;;;;;;;;;;;;;;;;;;;;
"FPS: A Fair-Progress Process Scheduling Policy on Shared-Memory Multiprocessors,""C. Wu"; J. Li; D. Xu; P. -C. Yew; J. Li;" Z. Wang"",""State Key Laboratory of Computer Architecture, Chinese Academy of Sciences, Beijing, P.R.China"; State Key Laboratory of Computer Architecture, Chinese Academy of Sciences, Beijing, P.R.China; IBM Research-China, Beijing, China; Department of Computer Science and Engineering, University of Minnesota at Twin-Cities, Minnesota, MN; University of Chinese Academy of Sciences, Beijing, P.R. China;" State Key Laboratory of Computer Architecture, Chinese Academy of Sciences, Beijing, P.R.China"",""IEEE Transactions on Parallel and Distributed Systems"",""14 Jan 2015"",""2015"",""26"",""2"",""444"",""454"",""Competition for shared memory resources on multiprocessors is the dominant cause for slowing down applications and making their performance varies unpredictably. It exacerbates the need for Quality of Service (QoS) on such systems. In this paper, we propose a fair-progress process scheduling (FPS) policy to improve system fairness. The strategy is to force the equally-weighted applications to bear the same amount of slowdown when they run concurrently. When we find an application suffered more slowdown and accumulated less effective work than others, we allocate more CPU time to give it a better parity. This policy can also be applied to threads with different weights. Evaluation results show that FPS can significantly improve system fairness at the expense of a slight loss in throughput. We can also keep the performance information of an application to guide process scheduling when it runs again later on. When FPS uses such performance information from previous runs, fairness can be maintained without the overhead of the training periods required in FPS. Throughput can thus be enhanced."",""1558-2183"","""",""10.1109/TPDS.2014.2306411"","""",""https://ieeexplore.ieee.org/stamp/stamp.jsp?arnumber=6766707"",""Cross-run optimization";memory bandwidth;process scheduling;"performance fairness."",""Training";Throughput;Bandwidth;Degradation;Optimization;Phasor measurement units;"Computers"","""",""8"","""",""29"",""IEEE"",""13 Mar 2014"","""","""",""IEEE"",""IEEE Journals""";;;;;;;;;;;;;;;;;;;;;
"FreeRider: Non-Local Adaptive Network-on-Chip Routing with Packet-Carried Propagation of Congestion Information,""S. Liu"; T. Chen; L. Li; X. Li; M. Zhang; C. Wang; H. Meng; X. Zhou;" Y. Chen"",""State Key Laboratory of Computer Architecture, Institute of Computing Technology, Chinese Academy of Sciences, Beijing, China"; State Key Laboratory of Computer Architecture, Institute of Computing Technology, Chinese Academy of Sciences, Beijing, China; Institute of Automation, Chinese Academy of Sciences, Beijing, China; School of Computer Science and Technology, Hefei, Anhui, China; State Key Laboratory of Computer Architecture, Institute of Computing Technology, Chinese Academy of Sciences, Beijing, China; School of Computer Science and Technology, Hefei, Anhui, China; State Key Laboratory of Computer Architecture, Institute of Computing Technology, Chinese Academy of Sciences, Beijing, China; School of Computer Science and Technology, Hefei, Anhui, China;" State Key Laboratory of Computer Architecture, Institute of Computing Technology, Chinese Academy of Sciences, Beijing, China"",""IEEE Transactions on Parallel and Distributed Systems"",""13 Jul 2015"",""2015"",""26"",""8"",""2272"",""2285"",""Non-local adaptive routing techniques, which utilize statuses of both local and distant links to make routing decisions, have recently been shown to be effective solutions for promoting the performance of Network-on-Chip (NoC). The essence of non-local adaptive routing was an additional network dedicated to propagate congestion information of distant links on the NoC. While the dedicated Congestion Propagation Network (CPN) helps routers to make promising routing decisions, it incurs additional wiring and power costs and becomes an unnecessary decoration when the load of NoC is light. Moreover, the CPN has to be extended if one would utilize more sophisticated congestion information to enhance the performance of NoC, bringing in even larger wiring and power costs. This paper proposes an innovative non-local adaptive routing technique called FreeRider, which does not use a dedicated CPN but instead leverages free bits in head flits of existing packets to carry and propagate rich congestion information without introducing additional wires or flits. In order to balance the network load, FreeRider adopts a novel three-stage strategy of output link selection, which adequately utilizes the propagated information to make routing decisions. Experimental results on both synthetic traffic patterns and application traces show that FreeRider achieves better throughput, shorter latency, and smaller power consumption than a state-of-the-art adaptive routing technique with dedicated CPN."",""1558-2183"","""",""10.1109/TPDS.2014.2345065"",""National Science Foundation of China(grant numbers:61100163,61133004,61222204,61221062,61303158)"; 863 Program of China(grant numbers:2012AA012202); Strategic Priority Research Program of the CAS(grant numbers:XDA06010403); Internatioanl Collaboration Key Program of the CAS(grant numbers:171111KYSB20130002);" "",""https://ieeexplore.ieee.org/stamp/stamp.jsp?arnumber=6871425"",""Networks-on-chip";routing algorithm;"congestion awareness"",""Routing";Adaptive systems;Throughput;Heuristic algorithms;Solids;Wiring;"Wires"","""",""19"","""",""49"",""IEEE"",""5 Aug 2014"","""","""",""IEEE"",""IEEE Journals""";;;;;;;;;;;;
"Goodput-Aware Load Distribution for Real-Time Traffic over Multipath Networks,""J. Wu"; C. Yuen; B. Cheng; Y. Shang;" J. Chen"",""State Key Laboratory of Networking and Switching Technology, Beijing University of Posts and Telecommunications, Beijing, P.R., China"; SUTD-MIT International Design Center, Singapore University of Technology and Design, 20 Dover Drive, Singapore; State Key Laboratory of Networking and Switching Technology, Beijing University of Posts and Telecommunications, Beijing, P.R. China; State Key Laboratory of Networking and Switching Technology, Beijing University of Posts and Telecommunications, Beijing, P.R. China;" State Key Laboratory of Networking and Switching Technology, Beijing University of Posts and Telecommunications, Beijing, P.R. China"",""IEEE Transactions on Parallel and Distributed Systems"",""13 Jul 2015"",""2015"",""26"",""8"",""2286"",""2299"",""Load distribution is a key research issue in deploying the limited network resources available to support traffic transmissions. Developing an effective solution is critical for enhancing traffic performance and network utilization. In this paper, we investigate the problem of load distribution for real-time traffic over multipath networks. Due to the path diversity and unreliability in heterogeneous overlay networks, large end-to-end delay and consecutive packet losses can significantly degrade the traffic flow's goodput, whereas existing studies mainlyfocus on the delay or throughput performance. To address the challenging problems, we propose a Goodput-Aware Load distribuTiON (GALTON) model that includes three phases: (1) path status estimation to accurately sense the quality of each transport link, (2) flow rate assignment to optimize the aggregate goodput of input traffic, and (3) deadline-constrained packet interleaving to mitigate consecutive losses. We present a mathematical formulation for multipath load distribution and derive the solution based on utility theory. The performance of the proposed model is evaluated through semi-physical emulations in Exata involving both real Internet traffic traces and H.264 video streaming. Experimental results show that GALTON outperforms existing traffic distribution models in terms of goodput, video Peak Signal-to-Noise Ratio (PSNR), end-to-end delay, and aggregate loss rate."",""1558-2183"","""",""10.1109/TPDS.2014.2347031"",""Singapore National Research Foundation"; National Grand Fundamental Research 973 Program of China(grant numbers:2011CB302506,2013CB329102,2012CB315802); National High-tech R&D Program of China(grant numbers:2013AA102301); National Natural Science Foundation of China(grant numbers:61132001); Program for New Century Excellent Talents in University(grant numbers:NCET-11-0592);" "",""https://ieeexplore.ieee.org/stamp/stamp.jsp?arnumber=6876149"",""Load distribution";goodput;multipath networks;real-time traffic;"multihoming"",""Delays";Load modeling;Real-time systems;Radio frequency;Bandwidth;Aggregates;"Packet loss"","""",""73"",""1"",""55"",""IEEE"",""12 Aug 2014"","""","""",""IEEE"",""IEEE Journals""";;;;;;;;;;;;;;;;;
"GPU Acceleration for Simulating Massively Parallel Many-Core Platforms,""S. Raghav"; M. Ruggiero; A. Marongiu; C. Pinto; D. Atienza;" L. Benini"",""Embedded Systems Laboratory, École Polytechnique Fédérale De Lausanne, Lausanne 1015, Vaud, Switzerland"; Embedded Systems Laboratory, École Polytechnique Fédérale De Lausanne, Lausanne 1015, Vaud, Switzerland; Department of Electrical, Electronic and Information Engineering, University of Bologna, Bologna 40136, Emilia Romagna, Italy; Department of Electrical, Electronic and Information Engineering, University of Bologna, Bologna 40136, Emilia Romagna, Italy; Embedded Systems Laboratory, École Polytechnique Fédérale De Lausanne, Lausanne 1015, Vaud, Switzerland;" Department of Electrical, Electronic and Information Engineering, University of Bologna, Bologna 40136, Emilia Romagna, Italy"",""IEEE Transactions on Parallel and Distributed Systems"",""7 Apr 2015"",""2015"",""26"",""5"",""1336"",""1349"",""Emerging massively parallel architectures such as a general-purpose processor plus many-core programmable accelerators are creating an increasing demand for novel methods to perform their architectural simulation. Most state-of-the-art simulation technologies are exceedingly slow and the need to model full system many-core architectures adds further to the complexity issues. This paper presents a fast, scalable and parallel simulator, which uses a novel methodology to accelerate the simulation of a many-core coprocessor using GPU platforms. The main idea is to use. The target architecture of the associated. Simulation of many target nodes is mapped to the many hardware-threads available on highly parallel GPU platforms. This paper presents a novel methodology to accelerate the simulation of many-core coprocessors using GPU platforms. We demonstrate the challenges, feasibility and benefits of our idea to use heterogeneous system (CPU and GPU) to simulate future architecture of many-core heterogeneous platforms. The target architecture selected to evaluate our methodology consists of an ARM general purpose CPU coupled with many-core coprocessor with thousands of simple in-order cores connected in a tile network. This work presents optimization techniques used to parallelize the simulation specifically for acceleration on GPUs. We partition the full system simulation between CPU and GPU, where the target general purpose CPU is simulated on the host CPU, whereas the many-core coprocessor is simulated on the NVIDIA Tesla 2070 GPU platform. Our experiments show performance of up to 50 MIPS when simulating the entire heterogeneous chip, and high scalability with increasing cores on coprocessor."",""1558-2183"","""",""10.1109/TPDS.2014.2319092"",""FP7(grant numbers:323872)"; FP7(grant numbers:291125); FP7(grant numbers:609000); YINS(grant numbers:20NA21_150939); Swiss National Science Foundation;" "",""https://ieeexplore.ieee.org/stamp/stamp.jsp?arnumber=6803951"",""Parallel simulation";heterogeneous architectures;many-core processors;accelerators;GPGPU;CUDA;"QEMU"",""Graphics processing units";Coprocessors;Computational modeling;Computer architecture;Synchronization;Instruction sets;"Scalability"","""",""13"","""",""37"",""IEEE"",""22 Apr 2014"","""","""",""IEEE"",""IEEE Journals""";;;;;;;;;;;;;
"GPU-Accelerated Sparse LU Factorization for Circuit Simulation with Performance Modeling,""X. Chen"; L. Ren; Y. Wang;" H. Yang"",""Department of Electronic Engineering, Tsinghua University, Beijing, China"; Department of Electrical Engineering and Computer Science, Massachusetts Institute of Technology, Cambridge, MA; Department of Electronic Engineering, Tsinghua University, Beijing, China;" Department of Electronic Engineering, Tsinghua University, Beijing, China"",""IEEE Transactions on Parallel and Distributed Systems"",""9 Feb 2015"",""2015"",""26"",""3"",""786"",""795"",""The sparse matrix solver by LU factorization is a serious bottleneck in Simulation Program with Integrated Circuit Emphasis (SPICE)-based circuit simulators. The state-of-the-art Graphics Processing Units (GPU) have numerous cores sharing the same memory, provide attractive memory bandwidth and compute capability, and support massive thread-level parallelism, so GPUs can potentially accelerate the sparse solver in circuit simulators. In this paper, an efficient GPU-based sparse solver for circuit problems is proposed. We develop a hybrid parallel LU factorization approach combining task-level and data-level parallelism on GPUs. Work partitioning, number of active thread groups, and memory access patterns are optimized based on the GPU architecture. Experiments show that the proposed LU factorization approach on NVIDIA GTX580 attains an average speedup of 7.02 $\times$ (geometric mean) compared with sequential PARDISO, and 1.55$\times$  compared with 16-threaded PARDISO. We also investigate bottlenecks of the proposed approach by a parametric performance model. The performance of the sparse LU factorization on GPUs is constrained by the global memory bandwidth, so the performance can be further improved by future GPUs with larger memory bandwidth."",""1558-2183"","""",""10.1109/TPDS.2014.2312199"","""",""https://ieeexplore.ieee.org/stamp/stamp.jsp?arnumber=6774937"",""Graphics processing unit";parallel sparse LU factorization;circuit simulation;"performance model"",""Graphics processing units";Sparse matrices;Instruction sets;Integrated circuit modeling;Parallel processing;Virtual groups;"Bandwidth"","""",""53"","""",""37"",""IEEE"",""18 Mar 2014"","""","""",""IEEE"",""IEEE Journals""";;;;;;;;;;;;;;;;;;;;;;;;;
"GPUSCAN: GPU-Based Parallel Structural Clustering Algorithm for Networks,""T. R. Stovall"; S. Kockara;" R. Avci"",""Department of Computer Science at University of Central Arkansas, Conway, AR, USA"; Department of Computer Science at University of Central Arkansas, Conway, AR, USA;" Department of Computer Science at University of Central Arkansas, Conway, AR, USA"",""IEEE Transactions on Parallel and Distributed Systems"",""11 Nov 2015"",""2015"",""26"",""12"",""3381"",""3393"",""This paper presents a massively parallel implementation of a prominent network clustering algorithm, the structural clustering algorithm for networks (SCAN), on a graphical processing unit (GPU). SCAN is a fast and efficient clustering technique for finding hidden communities and isolating hubs/outliers within a network. However, for very large networks, it still takes considerable amount of time. With the introduction of massively parallel Compute Unified Device Architecture (CUDA) by Nvidia, applications properly employing GPUs are demonstrating high speed up. In current study, GPUSCAN, a CUDA based parallel implementation of SCAN, is presented. SCAN's computation steps have been carefully redesigned to run very efficiently on the GPU by transforming SCAN into a series of highly regular and independent concurrent operations. All intermediate data structures are created in the GPU to efficiently benefit from GPU's memory hierarchy. How these structures reformed and represented in the GPU memory hierarchy are illustrated. Now, through GPUSCAN, a large network or a batch of disjoint networks can be offloaded to the GPU for very fast and equivalent structural clustering. The performance of the GPU accelerated structural clustering has been shown to be much faster than the sequential CPU implementation. Both GPUSCAN and SCAN are tested on different size artificial and real-world networks. Results indicate that network becomes larger GPUSCAN significantly over performs SCAN. In tested datasets, speed-up of over 500-fold is achieved. For instance, calculating structural similarity and clustering of 5.5 million edges of the California road network in GPUSCAN is 513-fold faster than the serial version of SCAN."",""1558-2183"","""",""10.1109/TPDS.2014.2374607"","""",""https://ieeexplore.ieee.org/stamp/stamp.jsp?arnumber=6967853"",""structural clustering for networks";GPGPU;high-performance computing;very large networks;social networks;Structural clustering for networks;GPGPU;high-performance computing;very large networks;"social networks"",""Graphics processing units";Clustering algorithms;Instruction sets;"Algorithm design and analysis"","""",""13"","""",""34"",""IEEE"",""26 Nov 2014"","""","""",""IEEE"",""IEEE Journals""";;;;;;;;;;;;;;;;;;;;;;;;
"Greening Wireless Relay Networks: An SNR-Aware Approach,""C. Gao"; J. Tang; X. Sheng; W. Zhang;" C. Wang"",""Department of Electrical Engineering and Computer Science, Syracuse University, Syracuse"; Department of Electrical Engineering and Computer Science, Syracuse University, Syracuse; Department of Electrical Engineering and Computer Science, Syracuse University, Syracuse; AT&T Labs Research, Middletown;" InterDigital Communications, King of Prussia"",""IEEE Transactions on Parallel and Distributed Systems"",""7 Oct 2015"",""2015"",""26"",""11"",""3027"",""3039"",""With the exploding popularity of wireless communication, the radio spectrum has become a scarce commodity. To further improve the network capacity, various solutions have been proposed to increase spectrum efficiency and network throughput. Small cell network is one of these new trends for next generation mobile network design. One model is using relay stations (RS) as small cell providers to achieve extended coverage, lower cost, and higher network capacity. Considering multiple related physical constraints such as channel capacity, signal to noise ratio (SNR) requirement of subscribers, relay power and network topology, this paper studies a joint signal-aware RS placement and power allocation problem with multiple base stations in wireless relay networks. We presented approximation schemes which first find a minimum number of RS, using maximum transmission power, to cover all the subscribers meeting each SNR requirement, and then ensure communications between any subscriber to a base station by adjusting the transmission power of each RS. Numerical results are presented to confirm the theoretical analysis of our schemes, and to show strong performances of our solutions."",""1558-2183"","""",""10.1109/TPDS.2014.2363099"",""National Science Foundation(grant numbers:CNS-1113398)";" "",""https://ieeexplore.ieee.org/stamp/stamp.jsp?arnumber=6924781"",""Wireless relay network";relay station placement;two tiered network;power allocation;hitting set;approximation algorithm;minimum spanning tree;Wireless relay network;relay station placement;two tiered network;power allocation;hitting set;approximation algorithm;"minimum spanning tree"",""Relays";Base stations;Distributed databases;Attenuation;"PSNR"","""",""2"","""",""18"",""IEEE"",""15 Oct 2014"","""","""",""IEEE"",""IEEE Journals""";;;;;;;;;;;;;;
"H-Tree: An Efficient Index Structurefor Event Matching in Content-BasedPublish/Subscribe Systems,""S. Qian"; J. Cao; Y. Zhu; M. Li;" J. Wang"",""Department of Computer Science and Engineering, Shanghai Jiao Tong University, Shanghai, China"; Department of Computer Science and Engineering, Shanghai Jiao Tong University, Shanghai, China; Department of Computer Science and Engineering, Shanghai Jiao Tong University, Shanghai, China; Department of Computer Science and Engineering, Shanghai Jiao Tong University, Shanghai, China;" Department of Civil and Environmental Engineering, Stanford University, Palo Alto, CA"",""IEEE Transactions on Parallel and Distributed Systems"",""12 May 2015"",""2015"",""26"",""6"",""1622"",""1632"",""Content-based publish/subscribe systems have been employed to deal with complex distributed information flows in many applications. It is well recognized that event matching is a fundamental component of such large-scale systems. Event matching searches a space which is composed of all subscriptions. As the scale and complexity of a system grows, the efficiency of event matching becomes more critical to system performance. However, most existing methods suffer significant performance degradation when the system has large numbers of both subscriptions and their component constraints. In this paper, we present Hash Tree (H-Tree), a highly efficient index structure for event matching. H-Tree is a hash table in nature that is a combination of hash lists and hash chaining. A hash list is built up on an indexed attribute by realizing novel overlapping divisions of the attribute's value domain, providing more efficient space consumption. Multiple hash lists are then combined into a hash tree. The basic idea behind H-Tree is that matching efficiencies are improved when the search space is substantially reduced by pruning most of the subscriptions that are not matched. We have implemented H-Tree and conducted extensive experiments in different settings. Experimental results demonstrate that H-Tree has better performance than its counterparts by a large margin. In particular, the matching speed is faster by three orders of magnitude than its counterparts when the numbers of both subscriptions and their component constraints are huge."",""1558-2183"","""",""10.1109/TPDS.2014.2323262"",""Morgan Stanley(grant numbers:CIP-A20110324-2)"; NSFC(grant numbers:61272438,61170238); Science and Technology Commission of Shanghai Municipality(grant numbers:12511502704); China 973 Program(grant numbers:2014CB340303); Singapore NRF(grant numbers:CREATE E2S2); National 863 Program(grant numbers:2013AA01A601); Program for Changjiang Scholars and Innovative Research Team in University(grant numbers:IRT1158);" "",""https://ieeexplore.ieee.org/stamp/stamp.jsp?arnumber=6814863"",""Content-based publish/subscribe";event matching;index structure;performance;"matching time"",""Subscriptions";Indexes;Upper bound;Memory management;Silicon;Field-flow fractionation;"Random variables"","""",""22"","""",""32"",""IEEE"",""13 May 2014"","""","""",""IEEE"",""IEEE Journals""";;;;;;;;;;;;;;;
