"Performance-based path determination for interprocessor communication in distributed computing systems,""JunSeong Kim";" D. J. Lilja"",""Department of Electrical and Computer Engineering, Minnesota Supercomputing Institute, University of Minnesota, Minneapolis, MN, USA";" Department of Electrical and Computer Engineering, Minnesota Supercomputing Institute, University of Minnesota, Minneapolis, MN, USA"",""IEEE Transactions on Parallel and Distributed Systems"",""6 Aug 2002"",""1999"",""10"",""3"",""316"",""327"",""The different types of messages used by a parallel application program executing in a distributed computing system can each have unique characteristics so that no single communication network can produce the lowest latency for all messages. For instance, short control messages may be sent with the lowest overhead on one type of network, such as Ethernet, while bulk data transfers may be better suited to a different type of network, such as Fibre Channel or HIPPI. This work investigates how to exploit multiple heterogeneous communication networks that interconnect the same set of processing nodes using a set of techniques we call performance-based path determination (PBPD). The performance-based path selection (PBPS) technique selects the best (lowest latency) network among several for each individual message to reduce the communication overhead of parallel programs. The performance-based path aggregation (PBPA) technique, on the other hand, aggregates multiple networks into a single virtual network to increase the available bandwidth. We test the PBPD techniques on a cluster of SGI multiprocessors interconnected with Ethernet, Fibre Channel, and HiPPI networks using a custom communication library built on top of the TCP/IP protocol layers. We find that PBPS can reduce communication overhead in applications compared to using either network alone, while aggregating networks into a single virtual network can reduce communication latency for bandwidth-limited applications. The performance of the PBPD techniques depends on the mix of message sizes in the application program and the relative overheads of the networks, as demonstrated in our analytical models."",""1558-2183"","""",""10.1109/71.755832"","""",""https://ieeexplore.ieee.org/stamp/stamp.jsp?arnumber=755832"","""",""Delay";Communication networks;Ethernet networks;Optical fiber communication;Distributed computing;Communication system control;Aggregates;Bandwidth;Optical fiber testing;"Libraries"","""",""6"","""",""19"",""IEEE"",""6 Aug 2002"","""","""",""IEEE"",""IEEE Journals""";;;;;;;;;;;;;;
"Periodically regular chordal rings,""B. Parhami";" Ding-Ming Kwai"",""Department of Electrical and Computer Engineering, University of California, Santa Barbara, CA, USA";" Department of Electrical and Computer Engineering, University of California, Santa Barbara, CA, USA"",""IEEE Transactions on Parallel and Distributed Systems"",""6 Aug 2002"",""1999"",""10"",""6"",""658"",""672"",""Chordal rings have been proposed in the past as networks that combine the simple routing framework of rings with the lower diameter, wider bisection, and higher resilience of other architectures. Virtually all proposed chordal ring networks are node-symmetric, i.e., all nodes have the same in/out degree and interconnection pattern. Unfortunately, such regular chordal rings are not scalable. In this paper, periodically regular chordal (PRC) ring networks are proposed as a compromise for combining low node degree with small diameter. By varying the PRC ring parameters, one can obtain architectures with significantly different characteristics (e.g., from linear to logarithmic diameter), while maintaining an elegant framework for computation and communication. In particular, a very simple and efficient routing algorithm works for the entire spectrum of PRC rings thus obtained. This flexibility has important implications for key system attributes such as architectural satiability, software portability, and fault tolerance. Our discussion is centered on unidirectional PRC rings with in/out-degree of 2. We explore the basic structure, topological properties, optimization of parameters, VLSI layout, and scalability of such networks, develop packet and wormhole routing algorithms for them, and briefly compare them to competing fixed-degree architectures such as symmetric chordal rings, meshes, tori, and cube-connected cycles."",""1558-2183"","""",""10.1109/71.774913"","""",""https://ieeexplore.ieee.org/stamp/stamp.jsp?arnumber=774913"","""",""Routing";Partial response channels;Multiprocessor interconnection networks;Computer architecture;Scalability;Resilience;Fault tolerant systems;Very large scale integration;Fault tolerance;"Parallel architectures"","""",""18"",""2"",""35"",""IEEE"",""6 Aug 2002"","""","""",""IEEE"",""IEEE Journals""";;;;;;;;;;;;;;
"Permutation realizability and fault tolerance property of the inside-out routing algorithm,""Seung-Woo Seo"; Tse-Yun Feng;" Hyoung-Il Lee"",""School of Electrical Engineering, Seoul National University, Seoul, South Korea"; Department of Computer Science and Engineering, Pennsylvania State University, University Park, PA, USA;" School of Electrical Engineering, Seoul National University, Seoul, South Korea"",""IEEE Transactions on Parallel and Distributed Systems"",""6 Aug 2002"",""1999"",""10"",""9"",""946"",""957"",""In this paper, we analyze ways of realizing permutations in a class of 2log/sub 2/N- or (2log/sub 2/N-1)-stage rearrangeable networks. The analysis is based on the newly developed inside-out routing algorithm and we derive the upper and lower bounds on the number of possible realizations of a permutation. It is shown that the algorithm can provide us with comparable degrees of freedom in realizing a given permutation as the well-known looping algorithm, while it can be more generally applied to a class of 2log/sub 2/N- or (2log/sub 2/N-1)-stage rearrangeable networks. In finding a set of complete assignments for the center-stage cycles, alternate realizations of a permutation can be obtained by changing the initial position, changing the assigning direction, or even interchanging the first-level decompositions of the permutation. We also show that these numerable alternate realizations can be utilized to make the networks tolerate some sets of faults, i.e., control faults of SEs including stuck-at-straight and stuck-at-cross. Various cases of single control faults at the center stages and other stages are examined through examples. These new approaches originate from routing outward from center stages to outer stages";" therefore, the center stages and two half networks may be treated separately."",""1558-2183"","""",""10.1109/71.798318"","""",""https://ieeexplore.ieee.org/stamp/stamp.jsp?arnumber=798318"","""",""Fault tolerance";Routing;Algorithm design and analysis;Communication switching;Fault tolerant systems;Multiprocessor interconnection networks;Bandwidth;Computer networks;Switches;"Feedback"","""",""11"","""",""18"",""IEEE"",""6 Aug 2002"","""","""",""IEEE"",""IEEE Journals""";;;;;;;;;;;
"Precedence-constrained task allocation onto point-to-point networks for pipelined execution,""S. L. Hary";" F. Ozguner"",""Air Force Research Laboratory, AFRL/IFSC, OH, USA";" Department of Electrical Engineering, Ohio State Uinversity, Columbus, OH, USA"",""IEEE Transactions on Parallel and Distributed Systems"",""6 Aug 2002"",""1999"",""10"",""8"",""838"",""851"",""The problem of scheduling directed acyclic task flow graphs to multiprocessor systems using point-to-point networks is examined. An environment where the application has a strict throughput requirement is assumed. Pipelined parallelism is used to meet the throughput requirement. Communication and computation are completely overlapped. Each task and message has a periodic rate and deadline equal to the throughput requirement. A heuristic procedure based on preclustering, recursive mincut bipartitioning, and iterative improvement is proposed to reduce the maximum contention due to communication in the network, increasing the likelihood that messages meet their deadlines. The task assignment procedure takes into account the topology of the multiprocessor system and the distance between communicating tasks."",""1558-2183"","""",""10.1109/71.790601"","""",""https://ieeexplore.ieee.org/stamp/stamp.jsp?arnumber=790601"","""",""Throughput";Pipelines;Multiprocessing systems;Processor scheduling;Flow graphs;Parallel processing;Sun;Network topology;Real time systems;"Radar signal processing"","""",""21"","""",""16"",""IEEE"",""6 Aug 2002"","""","""",""IEEE"",""IEEE Journals""";;;;;;;;;;;;;;
"Predictable threads for dynamic, hard real-time environments,""M. Humphrey";" J. A. Stankovic"",""Department of Computer Science, University of Virginia, Charlottesville, VA, USA";" Department of Computer Science, University of Virginia, Charlottesville, VA, USA"",""IEEE Transactions on Parallel and Distributed Systems"",""6 Aug 2002"",""1999"",""10"",""3"",""281"",""296"",""Next-generation, hard real-time systems will require new, flexible functionality and guaranteed, predictable performance. This paper describes the UMass Spring threads package, designed specifically for multiprocessing in dynamic, hard real-time environments. This package is unique because of its support for new thread semantics for real-time processing. Predictable creation and execution of threads is achieved because of an underlying predictable kernel, the UMass Spring kernel. Design decisions and lessons learned while implementing the threads package are presented. Measurements affirm the predictability of this implementation on a representative multiprocessor platform. The adoption of the threads package in the UMass Spring kernel results in additional performance improvements, which include reduced context switching overhead and reduced average-case memory access durations."",""1558-2183"","""",""10.1109/71.755828"","""",""https://ieeexplore.ieee.org/stamp/stamp.jsp?arnumber=755828"","""",""Packaging";Springs;Real time systems;Kernel;Operating systems;Embedded system;Processor scheduling;Performance analysis;"Aircraft"","""",""5"","""",""26"",""IEEE"",""6 Aug 2002"","""","""",""IEEE"",""IEEE Journals""";;;;;;;;;;;;;;;
"PSCR: a coherence protocol for eliminating passive sharing in shared-bus shared-memory multiprocessors,""R. Giorgi";" C. A. Prete"",""Dip. Ingegneria dell'Informatione, Università di Siena, Siena, Italy";" Dip. Ingegneria della Informazione, University di Pisa, Pisa, Italy"",""IEEE Transactions on Parallel and Distributed Systems"",""6 Aug 2002"",""1999"",""10"",""7"",""742"",""763"",""In high-performance general-purpose workstations and servers, the workload can be typically constituted of both sequential and parallel applications. Shared-bus shared-memory multiprocessor can be used to speed-up the execution of such workload. In this environment, the scheduler takes care of the load balancing by allocating a ready process on the first available processor, thus producing process migration. Process migration and the persistence of private data into different caches produce an undesired sharing, named passive sharing. The copies due to passive sharing produce useless coherence traffic on the bus and coping with such a problem may represent a challenging design problem for these machines. Many protocols use smart solutions to limit the overhead to maintain coherence among shared copies. None of these studies treats passive-sharing directly, although some indirect effect is present while dealing with the other kinds of sharing. Affinity scheduling can alleviate this problem, but this technique does not adapt to all load conditions, especially when the effects of migration are massive. We present a simple coherence protocol that eliminates passive sharing using information from the compiler that is normally available in operating system kernels. We evaluate the performance of this protocol and compare it against other solutions proposed in the literature by means of enhanced trace-driven simulation. We evaluate the complexity in terms of the number of protocol states, additional bus lines, and required software support. Our protocol further limits the coherence-maintaining overhead by using information about access patterns to shared data exhibited in parallel applications."",""1558-2183"","""",""10.1109/71.780868"","""",""https://ieeexplore.ieee.org/stamp/stamp.jsp?arnumber=780868"","""",""Access protocols";Operating systems;Scalability;Workstations;Processor scheduling;Load management;Kernel;Application software;Multiprocessor interconnection networks;"Pattern analysis"","""",""11"",""13"",""78"",""IEEE"",""6 Aug 2002"","""","""",""IEEE"",""IEEE Journals""";;;;;;;;;;;;;;
"Quasi-synchronous checkpointing: Models, characterization, and classification,""D. Manivannan";" M. Singhal"",""Computer Science Department, University of Kentucky, Lexington, KY, USA";" Department of Computer and Information Science, Ohio State Uinversity, Columbus, OH, USA"",""IEEE Transactions on Parallel and Distributed Systems"",""6 Aug 2002"",""1999"",""10"",""7"",""703"",""713"",""Checkpointing algorithms are classified as synchronous and asynchronous in the literature. In synchronous checkpointing, processes synchronize their checkpointing activities so that a globally consistent set of checkpoints is always maintained in the system. Synchronizing checkpointing activity involves message overhead and process execution may have to be suspended during the checkpointing coordination, resulting in performance degradation. In asynchronous checkpointing, processes take checkpoints without any coordination with others. Asynchronous checkpointing provides maximum autonomy for processes to take checkpoints";" however, some of the checkpoints taken may not lie on any consistent global checkpoint, thus making the checkpointing efforts useless. Asynchronous checkpointing algorithms in the literature can reduce the number of useless checkpoints by making processes take communication induced checkpoints besides asynchronous checkpoints. We call such algorithms quasi-synchronous. In this paper, we present a theoretical framework for characterizing and classifying such algorithms. The theory not only helps to classify and characterize the quasi-synchronous checkpointing algorithms, but also helps to analyze the properties and limitations of the algorithms belonging to each class. It also provides guidelines for designing and evaluating such algorithms."",""1558-2183"","""",""10.1109/71.780865"","""",""https://ieeexplore.ieee.org/stamp/stamp.jsp?arnumber=780865"","""",""Checkpointing";Distributed computing;Degradation;Algorithm design and analysis;Application software;Guidelines;Fault tolerance;Software debugging;Condition monitoring;"Computer industry"","""",""85"",""1"",""24"",""IEEE"",""6 Aug 2002"","""","""",""IEEE"",""IEEE Journals""";;;;;;;;;;;;;
"Real-time dependable channels: customizing QoS attributes for distributed systems,""M. A. Hiltunen"; R. D. Schlichting; Xiaonan Han; M. M. Cardozo;" R. Das"",""The Department of Computer Science, University of Arizona Tucson, Tucson, AZ, USA"; The Department of Computer Science, University of Arizona Tucson, Tucson, AZ, USA; MicroStrategy, Inc., Vienna, Austria; Synopsys, Inc., Cupertino, CA, USA;" The Department of Computer Science, University of Arizona Tucson, Tucson, AZ, USA"",""IEEE Transactions on Parallel and Distributed Systems"",""6 Aug 2002"",""1999"",""10"",""6"",""600"",""612"",""Communication services that provide enhanced Quality of Service (QoS) guarantees related to dependability and real time are important for many applications in distributed systems. This paper presents real-time dependable (RTD) channels, a communication-oriented abstraction that can be configured to meet the QoS requirements of a variety of distributed applications. This customization ability is based on using CactusRT, a system that supports the construction of middleware services out of software modules called micro-protocols. Each micro-protocol implements a different semantic property or property variant and interacts with other micro-protocols using an event-driven model supported by the CactusRT runtime system. In addition to RTD channels CactusRT and its implementation are described. This prototype executes on a cluster of Pentium PCs running the OpenGroup/RI MK 7.3 Mach real-time operating system and CORDS, a system for building network protocols based on the x-kernel."",""1558-2183"","""",""10.1109/71.774909"","""",""https://ieeexplore.ieee.org/stamp/stamp.jsp?arnumber=774909"","""",""Quality of service";Real time systems;Application software;Modular construction;Middleware;Software prototyping;Prototypes;Personal communication networks;Operating systems;"Protocols"","""",""43"","""",""40"",""IEEE"",""6 Aug 2002"","""","""",""IEEE"",""IEEE Journals""";;;;;;;;
"Redundant synchronization elimination for DOACROSS loops,""Ding-Kai Chen";" Pen-Chung Yew"",""Hewlett Packard Company, CA, USA";" Department of Computer Science, University of Minnesota, Minneapolis, MN, USA"",""IEEE Transactions on Parallel and Distributed Systems"",""6 Aug 2002"",""1999"",""10"",""5"",""459"",""470"",""Cross-iterations data dependences in DOACROSS loops require explicit data synchronizations to enforce them. However, the composite effect of some data synchronizations may cover the other dependences and make the enforcement of those covered dependences redundant. In this paper, we propose an efficient and general algorithm to identify redundant synchronizations in multiply nested DOACROSS loops which may have multiple statements and loop-exit control branches. Eliminating redundant synchronizations in DOACROSS loops allows more efficient execution of such loops. We also address the issues of enforcing data synchronizations in iterations near the boundary of the iteration space. Because some dependences may not exist in those boundary iterations, it adds complexity in determining the redundant synchronizations for those boundary iterations. The necessary and sufficient condition under which the synchronization is uniformly redundant is also studied. These results allow a parallelizing compiler to generate efficient data synchronization instructions for DOACROSS loops."",""1558-2183"","""",""10.1109/71.770138"","""",""https://ieeexplore.ieee.org/stamp/stamp.jsp?arnumber=770138"","""",""Sufficient conditions";Bandwidth;Delay;Multidimensional systems;"Solids"","""",""7"",""1"",""13"",""IEEE"",""6 Aug 2002"","""","""",""IEEE"",""IEEE Journals""";;;;;;;;;;;;;;;;;;;
"Resource scaling effects on MPP performance: the STAP benchmark implications,""Kai Hwang"; Choming Wang; Cho-Li Wang;" Zhiwei Xu"",""Department of Electrical Engineering-Systems, University of Southern California, Los Angeles, Los Angeles, CA, USA"; Department of Electrical Engineering-Systems, University of Southern California, Los Angeles, Los Angeles, CA, USA; Department of Computer Science and Information Systems, University of Hong Kong, Hong Kong, China;" National Center for Intelligent Computing Systems, Chinese Academy and Sciences, Beijing, China"",""IEEE Transactions on Parallel and Distributed Systems"",""6 Aug 2002"",""1999"",""10"",""5"",""509"",""527"",""Presently, massively parallel processors (MPPs) are available only in a few commercial models. A sequence of three ASCI Teraflops MPPs has appeared before the new millenium. This paper evaluates six MPP systems through STAP benchmark experiments. The STAP is a radar signal processing benchmark which exploits regularly structured SPMD data parallelism. We reveal the resource scaling effects on MPP performance along orthogonal dimensions of machine size, processor speed, memory capacity messaging latency, and network bandwidth. We show how to achieve balanced resources scaling against enlarged workload (problem size). Among three commercial MPPs, the IBM SP2 shows the highest speed and efficiency, attributed to its well-designed network with middleware support for single system image. The Cray T3D demonstrates a high network bandwidth with a good NUMA memory hierarchy. The Intel Paragon trails far behind due to slow processors used and excessive latency experienced in passing messages. Our analysis projects the lowest STAP speed on the ASCI Red, compared with the projected speed of two ASCI Blue machines. This is attributed to slow processors used in ASCI Red and the mismatch between its hardware and software. The Blue Pacific shows the highest potential to deliver scalable performance up to thousands of nodes. The Blue Mountain is designed to have the highest network bandwidth. Our results suggest a limit on the scalability of the distributed shared-memory (DSM) architecture adopted in Blue Mountain. The scaling model offers a quantitative method to match resource scaling with problem scaling to yield a truly scalable performance. The model helps MPP designers optimize the processors, memory, network, and I/O subsystems of an MPP. For MPP users, the scaling results can be applied to partition a large workload for SPMD execution or to minimize the software overhead in collective communication or remote memory update operations. Finally, our scaling model is assessed to evaluate MPPs with benchmarks other than STAP."",""1558-2183"","""",""10.1109/71.770197"","""",""https://ieeexplore.ieee.org/stamp/stamp.jsp?arnumber=770197"","""",""Bandwidth";Scalability;Radar signal processing;Delay;Hardware;Computer architecture;Application software;Middleware;Process design;"Design optimization"","""",""4"",""3"",""36"",""IEEE"",""6 Aug 2002"","""","""",""IEEE"",""IEEE Journals""";;;;;;;;;;
"Routing in wormhole-switched clustered networks with applications to fault tolerance,""V. Halwan"; F. Ozguner;" A. Dogan"",""United Technologies Research Center, Inc., East Hartford, CT, USA"; The Department of Electrical Engineering, Ohio State Uinversity, Columbus, OH, USA;" The Department of Electrical Engineering, Ohio State Uinversity, Columbus, OH, USA"",""IEEE Transactions on Parallel and Distributed Systems"",""6 Aug 2002"",""1999"",""10"",""10"",""1001"",""1011"",""This paper presents a novel technique for routing in wormhole-switched multiprocessor interconnection networks with clustered configuration. The network model used here consists of a set of clusters interfaced through a common central network. We assume that the central network and the clusters use independent algorithms to route messages between their internal nodes. A technique for deriving a global routing algorithm based on the local algorithms is presented, which allows the transfer of messages between any pair of nodes in the network. This proposed method is shown to be deadlock-free with two virtual channels. The clustered network model and the proposed routing technique can be used to enhance the fault tolerance capability of existing routing algorithms. In particular, we describe fault-tolerant routing methods for meshes, which can tolerate any arbitrary fault distribution without disabling connected healthy nodes."",""1558-2183"","""",""10.1109/71.808138"","""",""https://ieeexplore.ieee.org/stamp/stamp.jsp?arnumber=808138"","""",""Routing";Intelligent networks;Fault tolerance;Clustering algorithms;System recovery;Fault tolerant systems;Network topology;Multiprocessor interconnection networks;"Message passing"","""",""4"","""",""13"",""IEEE"",""6 Aug 2002"","""","""",""IEEE"",""IEEE Journals""";;;;;;;;;;;;;
