"Optimizing Dual-Core Execution for Power Efficiency and Transient-Fault Recovery,""Y. Ma"; H. Gao; M. Dimitrov;" H. Zhou"",""School of Electrical Engineering and Computer Science, University of Central Florida, Orlando, FL, USA"; School of Electrical Engineering and Computer Science, University of Central Florida, Orlando, FL, USA; School of Electrical Engineering and Computer Science, University of Central Florida, Orlando, FL, USA;" School of Electrical Engineering and Computer Science, University of Central Florida, Orlando, FL, USA"",""IEEE Transactions on Parallel and Distributed Systems"",""13 Aug 2007"",""2007"",""18"",""8"",""1080"",""1093"",""Dual-core execution (DCE) is an execution paradigm proposed to utilize chip multiprocessors to improve the performance of single-threaded applications. Previous research has shown that DCE provides a complexity-effective approach to building a highly scalable instruction window and achieves significant latency-hiding capabilities. In this paper, we propose to optimize DCE for power efficiency and/or transient-fault recovery. In DCE, a program is first processed (speculatively) in the front processor and then reexecuted by the back processor. Such reexecution is the key to eliminating the centralized structures that are normally associated with very large instruction windows. In this paper, we exploit the computational redundancy in DCE to improve its reliability and its power efficiency. The main contributions include: 1) DCE-based redundancy checking for transient-fault tolerance and a complexity-effective approach to achieving full redundancy coverage and 2) novel techniques to improve the power/energy efficiency of DCE-based execution paradigms. Our experimental results demonstrate that, with the proposed simple techniques, the optimized DCE can effectively achieve transient-fault tolerance or significant performance enhancement in a power/energy-efficient way. Compared to the original DCE, the optimized DCE has similar speedups (34 percent on average) over single-core processors while reducing the energy overhead from 93 percent to 31 percent."",""1558-2183"","""",""10.1109/TPDS.2007.4288106"","""",""https://ieeexplore.ieee.org/stamp/stamp.jsp?arnumber=4288106"",""Multiple data stream architectures";fault tolerance;"low-power design."",""Redundancy";Energy efficiency;Computer Society;Application software;Windows;Computer architecture;Fault tolerance;Power system reliability;Error analysis;"Throughput"","""",""6"","""",""43"",""IEEE"",""13 Aug 2007"","""","""",""IEEE"",""IEEE Journals""";;;;;;;;;;;;
"Parallel Asynchronous Watershed Algorithm-Architecture,""B. Galilee"; F. Mamalet; M. Renaudin;" P. -y. Coulon"",""France Telecom Research and Development Center, Meylan, France"; France Telecom Research and Development Center, Meylan, France; TIMA, Grenoble, France;" LIS, INPG, Grenoble, France"",""IEEE Transactions on Parallel and Distributed Systems"",""4 Dec 2006"",""2007"",""18"",""1"",""44"",""56"",""A joint algorithm-architecture study has resulted into a new version of a picture segmentation system complying with multimedia mobile terminal constraints, i.e., real-time computing, and low power consumption. Previously published watershed segmentation algorithms required at least three global synchronization points: minima detection, labeling and flooding. This paper presents a new fully asynchronous algorithm, where pixels can compute their local data in parallel and independently from one another, and which requires only a unique final global synchronization point. This paper provides a formal demonstration of the convergence and correctness of this new parallel asynchronous algorithm using a mathematical model of data propagation in a graph: the associative net formalism. We demonstrate the simplicity of implementation of this algorithm on parallel processor arrays. We explore, simulate, and validate several configurations of the algorithm-architecture using a """"SystemC"""" model. Simulations reveal an image segmentation rate up to 66,000 QCIF images/sec, i.e., a speed-up factor of more than 1,000 times compared with state of the art watershed algorithms. A fine grain processor array design using STmicroelectronics 0.18mum. CMOS technology confirms that this new approach is a breakthrough in the domain of real-time image segmentation"",""1558-2183"","""",""10.1109/TPDS.2007.253280"","""",""https://ieeexplore.ieee.org/stamp/stamp.jsp?arnumber=4020511"",""Asynchronous algorithm-architecture";image segmentation;watershed;hill-climbing;parallel processors;correctness proof;"performance evaluation."",""Image segmentation";CMOS technology;Multimedia systems;Multimedia computing;Mobile computing;Real time systems;Energy consumption;Labeling;Floods;"Concurrent computing"","""",""19"","""",""23"",""IEEE"",""4 Dec 2006"","""","""",""IEEE"",""IEEE Journals""";;;;;;;;
"pFusion: A P2P Architecture for Internet-Scale Content-Based Search and Retrieval,""D. Zeinalipour-Yazti"; V. Kalogeraki;" D. Gunopulos"",""Department of Computer Science, University of Cyprus, Nicosia, Cyprus"; Department of Computer Science and Engineering, University of California, Riverside, Riverside, CA, USA;" Department of Computer Science and Engineering, University of California, Riverside, Riverside, CA, USA"",""IEEE Transactions on Parallel and Distributed Systems"",""7 May 2007"",""2007"",""18"",""6"",""804"",""817"",""The emerging peer-to-peer (p2p) model has become a very powerful and attractive paradigm for developing Internet-scale systems for sharing resources, including files and documents. The distributed nature of these systems, where nodes are typically located across different networks and domains, inherently hinders the efficient retrieval of information. In this paper, we consider the effects of topologically aware overlay construction techniques on efficient p2p keyword search algorithms. We present the peer fusion (pFusion) architecture that aims to efficiently integrate heterogeneous information that is geographically scattered on peers of different networks. Our approach builds on work in unstructured p2p systems and uses only local knowledge. Our empirical results, using the pFusion middleware architecture and data sets from Akamai's Internet mapping infrastructure (AKAMAI), the active measurement project (NLANR), and the text retrieval conference (TREC) show that the architecture we propose is both efficient and practical"",""1558-2183"","""",""10.1109/TPDS.2007.1060"","""",""https://ieeexplore.ieee.org/stamp/stamp.jsp?arnumber=4180347"",""Information retrieval";peer-to-peer;"overlay construction algorithms."",""Internet";Content based retrieval;Peer to peer computing;Information retrieval;Keyword search;Video sharing;Power system modeling;Computer architecture;Video on demand;"Scattering"","""",""21"",""2"",""57"",""IEEE"",""7 May 2007"","""","""",""IEEE"",""IEEE Journals""";;;;;;;;;;;;;;
"Power Efficient Approaches to Redundant Multithreading,""N. Madan";" R. Balasubramonian"",""School of Computing, University of Utah, Salt Lake, UT, USA";" School of Computing, University of Utah, Salt Lake, UT, USA"",""IEEE Transactions on Parallel and Distributed Systems"",""13 Aug 2007"",""2007"",""18"",""8"",""1066"",""1079"",""Noise and radiation-induced soft errors (transient faults) in computer systems have increased significantly over the last few years and are expected to increase even more as we move towards smaller transistor sizes and lower supply voltages. Fault detection and recovery can be achieved through redundancy. The emergence of chip multiprocessors (CMPs) makes it possible to execute redundant threads on a chip and provide relatively low-cost reliability. State-of-the-art implementations execute two copies of the same program as two threads (redundant multithreading), either on the same or on separate processor cores in a CMP, and periodically check results. While this solution has favorable performance and reliability properties, every redundant instruction flows through a high-frequency complex outof- order pipeline, thereby incurring a high power consumption penalty. This paper proposes mechanisms that attempt to provide reliability at a modest power and complexity cost. When executing a redundant thread, the trailing thread benefits from the information produced by the leading thread. We take advantage of this property and comprehensively study different strategies to reduce the power overhead of the trailing core in a CMP. These strategies include dynamic frequency scaling, in-order execution, and parallelization of the trailing thread."",""1558-2183"","""",""10.1109/TPDS.2007.1090"","""",""https://ieeexplore.ieee.org/stamp/stamp.jsp?arnumber=4288105"",""Reliability";power;transient faults;soft errors;redundant multi-threading (RMT);heterogeneous chip multiprocessors;"dynamic frequency scaling"",""Multithreading";Computer errors;Voltage;Fault detection;Redundancy;Out of order;Pipelines;Energy consumption;"Costs"","""",""12"","""",""28"",""IEEE"",""13 Aug 2007"","""","""",""IEEE"",""IEEE Journals""";;;;;;;;;;;;;
"PowerTrust: A Robust and Scalable Reputation System for Trusted Peer-to-Peer Computing,""R. Zhou";" K. Hwang"",""Department of Electrical Engineering, University of Southern California, Los Angeles, CA, USA";" Department of Electrical Engineering, University of Southern California, Los Angeles, CA, USA"",""IEEE Transactions on Parallel and Distributed Systems"",""5 Mar 2007"",""2007"",""18"",""4"",""460"",""473"",""Peer-to-Peer (P2P) reputation systems are essential to evaluate the trustworthiness of participating peers and to combat the selfish, dishonest, and malicious peer behaviors. The system collects locally-generated peer feedbacks and aggregates them to yield the global reputation scores. Surprisingly, most previous work ignored the distribution of peer feedbacks. We use a trust overlay network (TON) to model the trust relationships among peers. After examining the eBay transaction trace of over 10,000 users, we discover a power-law distribution in user feedbacks. Our mathematical analysis justifies that power-law distribution is applicable to any dynamically growing P2P systems, either structured or unstructured. We develop a robust and scalable P2P reputation system, PowerTrust, to leverage the power-law feedback characteristics. The PowerTrust system dynamically selects small number of power nodes that are most reputable using a distributed ranking mechanism. By using a look-ahead random walk strategy and leveraging the power nodes, PowerTrust significantly improves in global reputation accuracy and aggregation speed. PowerTrust is adaptable to dynamics in peer joining and leaving and robust to disturbance by malicious peers. Through P2P network simulation experiments, we find significant performance gains in using PowerTrust. This power-law guided reputation system design proves to achieve high query success rate in P2P file-sharing applications. The system also reduces the total job makespan and failure rate in large-scale, parameter-sweeping P2P Grid applications."",""1558-2183"","""",""10.1109/TPDS.2007.1021"","""",""https://ieeexplore.ieee.org/stamp/stamp.jsp?arnumber=4118688"",""Peer-to-Peer system";overlay network;distributed hash table;reputation system;eBay trace data set;distributed file sharing;P2P Grids;PSA benchmark;"system scalability."",""Robustness";Peer to peer computing;Feedback;Large-scale systems;Resource management;Scalability;Computer Society;Aggregates;Power system modeling;"Mathematical analysis"","""",""514"",""20"",""25"",""IEEE"",""5 Mar 2007"","""","""",""IEEE"",""IEEE Journals""";;;;;;;;;;
"Private and Secure Service Discovery via Progressive and Probabilistic Exposure,""F. Zhu"; W. Zhu; M. W. Mutka;" L. M. Ni"",""Department of Computer Science and Engineering, Michigan State University, East Lansing, MI, USA"; Department of Computer Science and Engineering, Michigan State University, East Lansing, MI, USA; Department of Computer Science and Engineering, Michigan State University, East Lansing, MI, USA;" Department of Computer Science and Engineering, Hong Kong University of Science and Technology, Hong Kong, China"",""IEEE Transactions on Parallel and Distributed Systems"",""8 Oct 2007"",""2007"",""18"",""11"",""1565"",""1577"",""The involvement of only the necessary users and service providers for service discovery in pervasive computing environments is challenging. Without prudence, users' and service providers' requests or service information, their identities, and their presence information may be sacrificed. We identify that the problem may be as difficult as a chicken-and-egg problem, in which both users and service providers want the other parties to expose sensitive information first. In this paper, we propose a progressive and probabilistic approach to solve the problem. Users and service providers expose partial information in turn and avoid unnecessary exposure if there is any mismatch. Although 1 or 2 bits of information are exchanged in each message, we prove that the process converges and that the false-positive overhead decreases quickly. Experiments and hypothesis tests show that security properties hold. We implemented the approach and the performance measurements show that the approach runs efficiently on PDAs."",""1558-2183"","""",""10.1109/TPDS.2007.1075"","""",""https://ieeexplore.ieee.org/stamp/stamp.jsp?arnumber=4339200"",""Authentication";Pervasive Computing;Privacy;Probabilistic;"Security"",""Pervasive computing";Privacy;Information security;Testing;Measurement;Personal digital assistants;Digital audio players;"Access protocols"","""",""25"","""",""24"",""IEEE"",""8 Oct 2007"","""","""",""IEEE"",""IEEE Journals""";;;;;;;;;;;;
"Push-Pull: Deterministic Search-Based DAG Scheduling for Heterogeneous Cluster Systems,""S. C. Kim"; S. Lee;" J. Hahm"",""Embedded S/W Research Division, Electronics and Telecommunications Research Institute, Daejeon, South Korea"; Department of Electrical Engineering, Pohang University of Science and Technology, Pohang, South Korea;" Grid Computing Research Team, Korea Institute of Science and Technology, Daejeon, South Korea"",""IEEE Transactions on Parallel and Distributed Systems"",""8 Oct 2007"",""2007"",""18"",""11"",""1489"",""1502"",""Consider directed acyclic graph (DAG) scheduling for a large heterogeneous system, which consists of processors with varying processing capabilities and network links with varying bandwidths. The search space of possible task schedules for this problem is immense. One possible approach for this optimization problem, which is NP-hard, is to start with the best task schedule found by a fast deterministic task scheduling algorithm and then iteratively attempt to improve the task schedule by employing a general random guided search method. However, such an approach can lead to extremely long search times, and the solutions found are sometimes not significantly better than those found by the original deterministic task scheduling algorithm. In this paper, we propose an alternative strategy, termed Push-Pull, which starts with the best task schedule found by a fast deterministic task scheduling algorithm and then iteratively attempts to improve the current best solution using a deterministic guided search method. Our simulation results show that given similar runtimes, the Push-Pull algorithm performs well, achieving results similar to or better than all of the other algorithms being compared."",""1558-2183"","""",""10.1109/TPDS.2007.1106"","""",""https://ieeexplore.ieee.org/stamp/stamp.jsp?arnumber=4339194"",""Task Scheduling";Optimization;Heterogeneous Systems;"Cluster Systems"",""Processor scheduling";Scheduling algorithm;Iterative algorithms;Heuristic algorithms;Search methods;Clustering algorithms;Costs;Wide area networks;Bandwidth;"Optimization methods"","""",""36"","""",""21"",""IEEE"",""8 Oct 2007"","""","""",""IEEE"",""IEEE Journals""";;;;;;;;;;;;;
"Randomized Protocols for Duplicate Elimination in Peer-to-Peer Storage Systems,""R. A. Ferreira"; M. K. Ramanathan; A. Grama;" S. Jagannathan"",""Department of Computer Sciences, Purdue University, West Lafayette, IN, USA"; Department of Computer Sciences, Purdue University, West Lafayette, IN, USA; Department of Computer Sciences, Purdue University, West Lafayette, IN, USA;" Department of Computer Sciences, Purdue University, West Lafayette, IN, USA"",""IEEE Transactions on Parallel and Distributed Systems"",""23 Apr 2007"",""2007"",""18"",""5"",""686"",""696"",""Distributed peer-to-peer systems rely on voluntary participation of peers to effectively manage a storage pool. In such systems, data is generally replicated for performance and availability. If the storage associated with replication is not monitored and provisioned, the underlying benefits may not be realized. Resource constraints, performance scalability, and availability present diverse considerations. Availability and performance scalability, in terms of response time, are improved by aggressive replication, whereas resource constraints limit total storage in the network. Identification and elimination of redundant data pose fundamental problems for such systems. In this paper, we present a novel and efficient solution that addresses availability and scalability with respect to management of redundant data. Specifically, we address the problem of duplicate elimination in the context of systems connected over an unstructured peer-to-peer network in which there is no a priori binding between an object and its location. We propose two randomized protocols to solve this problem in a scalable and decentralized fashion that does not compromise the availability requirements of the application. Performance results using both large-scale simulations and a prototype built on PlanetLab demonstrate that our protocols provide high probabilistic guarantees while incurring minimal administrative overheads."",""1558-2183"","""",""10.1109/TPDS.2007.351710"","""",""https://ieeexplore.ieee.org/stamp/stamp.jsp?arnumber=4160936"",""Peer-to-peer";unstructured networks;duplicate elimination;"randomized algorithms."",""Peer to peer computing";Availability;Scalability;Monitoring;Delay;Large-scale systems;Virtual prototyping;Access protocols;Control systems;"Network topology"","""",""2"",""3"",""31"",""IEEE"",""23 Apr 2007"","""","""",""IEEE"",""IEEE Journals""";;;;;;;;;;;
"ReDAL: An Efficient and Practical Request Distribution Technique for Application Server Clusters,""K. Dutta"; A. Datta; D. VanderMeer; H. Thomas;" K. Ramamritham"",""Decision Science and Information Systems, College of Business, Florida International University, Miami, FL, USA"; School of Information Systems, Singapore Management University, Singapore; Decision Science and Information Systems, College of Business, Florida International University, Miami, FL, USA; Moab, UT, USA;" Department of Computer Science and Engineering, IIT Bombay, Mumbai, India"",""IEEE Transactions on Parallel and Distributed Systems"",""8 Oct 2007"",""2007"",""18"",""11"",""1516"",""1528"",""Modern Web-based application infrastructures are based on clustered multitiered architectures, where request distribution occurs in two sequential stages: over a cluster of Web servers and over a cluster of application servers. Much work has focused on strategies for distributing requests across a Web server cluster in order to improve the overall throughput across the cluster. The strategies applied at the application layer are the same as those at the Web server layer because it is assumed that they transfer directly. In this paper, we argue that the problem of distributing requests across an application server cluster is fundamentally different from the Web server request distribution problem due to core differences in request processing in Web and application servers. We devise an approach for distributing requests across a cluster of application servers such that the overall system throughput is enhanced, and load across the application servers is balanced."",""1558-2183"","""",""10.1109/TPDS.2007.1105"","""",""https://ieeexplore.ieee.org/stamp/stamp.jsp?arnumber=4339196"",""[H-3-4-b] Distributed systems";[H-3-5-e]Web-based services;[J-8-a] Client/server and multitier systems;[J-8-e] Electronic commerce;"[J-8-l] Middleware/business logic"",""Web server";Throughput;Business;Logic;Runtime;Java;Switches;Routing;Management information systems;"Service oriented architecture"","""",""9"",""3"",""22"",""IEEE"",""8 Oct 2007"","""","""",""IEEE"",""IEEE Journals""";;;;;;;;
"Reducing the Height of Independent Spanning Trees in Chordal Rings,""J. -S. Yang"; J. -M. Chang; S. -M. Tang;" Y. -L. Wang"",""Department of Information Management, National Taiwan University of Science and Technology, Taipei, Taiwan"; Department of Information Management, National Taipei College of Business, Taipei, Taiwan; Department of Psychology, Fu-Hsing-Kang College, Taipei, Taiwan;" Department of Computer Science and Information Engineering, National Chi Nan University, Nantou, Taiwan"",""IEEE Transactions on Parallel and Distributed Systems"",""23 Apr 2007"",""2007"",""18"",""5"",""644"",""657"",""This paper is concerned with a particular family of regular 4-connected graphs, called chordal rings. Chordal rings are a variation of ring networks. By adding two extra links (or chords) at each vertex in a ring network, the reliability and fault-tolerance of the network are enhanced. Two spanning trees on a graph are said to be independent if they are rooted at the same vertex, say, r, and for each vertex v \neq r, the two paths from r to v, one path in each tree, are internally disjoint. A set of spanning trees on a given graph is said to be independent if they are pairwise independent. Iwasaki et al. [CHECK END OF SENTENCE] proposed a linear time algorithm for finding four independent spanning trees on a chordal ring. In this paper, we give a new linear time algorithm to generate four independent spanning trees with a reduced height in each tree. Moreover, a complete analysis of our improvements on the heights of independent spanning trees is also provided."",""1558-2183"","""",""10.1109/TPDS.2007.351709"","""",""https://ieeexplore.ieee.org/stamp/stamp.jsp?arnumber=4160933"",""Chordal rings";interconnection networks;fault-tolerant broadcasting;independent spanning trees;"internally disjoint path."",""Tree graphs";Fault tolerance;Broadcasting;Routing;Multiprocessor interconnection networks;Shortest path problem;Data communication;Telecommunication network reliability;Protocols;"Algorithm design and analysis"","""",""46"","""",""15"",""IEEE"",""23 Apr 2007"","""","""",""IEEE"",""IEEE Journals""";;;;;;;;;;
"Resource-Aware Distributed Scheduling Strategies for Large-Scale Computational Cluster/Grid Systems,""S. Viswanathan"; B. Veeravalli;" T. G. Robertazzi"",""Computer Networks and Distributed Systems (CNDS) Laboratory, Department of Electrical and Computer Engineering, National University of Singapore, Singapore"; Computer Networks and Distributed Systems (CNDS) Laboratory, Department of Electrical and Computer Engineering, National University of Singapore, Singapore;" Department of Electrical and Computer Engineering, Stony Brook University, Stony Brook, NY, USA"",""IEEE Transactions on Parallel and Distributed Systems"",""17 Sep 2007"",""2007"",""18"",""10"",""1450"",""1461"",""In this paper, we propose distributed algorithms referred to as resource-aware dynamic incremental scheduling (RADIS) strategies. Our strategies are specifically designed to handle large volumes of computationally intensive arbitrarily divisible loads submitted for processing at cluster/grid systems involving multiple sources and sinks (processing nodes). We consider a real-life scenario, wherein the buffer space (memory) available at the sinks (required for holding and processing the loads) varies over time, and the loads have deadlines and propose efficient """"pull-based"""" scheduling strategies with an admission control policy that ensures that the admitted loads are processed, satisfying their deadline requirements. The design of our proposed strategies adopts the divisible load paradigm, referred to as the divisible load theory (DLT), which is shown to be efficient in handling large volume loads. We demonstrate detailed workings of the proposed algorithms via a simulation study by using real-life parameters obtained from a major physics experiment."",""1558-2183"","""",""10.1109/TPDS.2007.1073"","""",""https://ieeexplore.ieee.org/stamp/stamp.jsp?arnumber=4302731"",""Divisible loads";Grid computing;Cluster computing;buffer constraints;processing time;"deadlines"",""Processor scheduling";Large-scale systems;Distributed computing;Grid computing;Computer networks;Dynamic scheduling;Clustering algorithms;Resource management;Algorithm design and analysis;"Physics computing"","""",""59"","""",""24"",""IEEE"",""17 Sep 2007"","""","""",""IEEE"",""IEEE Journals""";;;;;;;;;;;
