"Game Theoretic Stochastic Routing for Fault Tolerance and Security in Computer Networks,""S. Bohacek"; J. Hespanha; J. Lee; C. Lim;" K. Obraczka"",""Department of Electrical and Computer Engineering, University of Delaware, Newark, DE, USA"; Department of Electrical and Computer Engineering, University of California, Santa Barbara, CA, USA; Department of Computer Science, Sookmyung Women''s University, Seoul, South Korea; Department of Computer Information and Communications, Hongik University, Chungnam, South Korea;" Computer Engineering Department, University of California, Santa Cruz, CA, USA"",""IEEE Transactions on Parallel and Distributed Systems"",""13 Aug 2007"",""2007"",""18"",""9"",""1227"",""1240"",""We introduce the game-theoretic stochastic routing (GTSR) framework, a proactive alternative to today's reactive approaches to route repair. GTSR minimizes the impact of link and router failure by 1) computing multiple paths between source and destination and 2) selecting among these paths randomly to forward packets. Besides improving fault tolerance, the fact that GTSR makes packets take random paths from source to destination also improves security. In particular, it makes connection eavesdropping attacks maximally difficult as the attacker would have to listen on all possible routes. The approaches developed are suitable for network layer routing, as well as for application layer overlay routing and multipath transport protocols such as the stream control transmission protocol (SCTP). Through simulations, we validate our theoretical results and show how the resulting routing algorithms perform in terms of the security/fault-tolerant/delay/throughput trade-off. We also show that a beneficial side effect of these algorithms is an increase in throughput, as they make use of multiple paths."",""1558-2183"","""",""10.1109/TPDS.2007.1000"","""",""https://ieeexplore.ieee.org/stamp/stamp.jsp?arnumber=4288123"",""Multi-path Routing";Stochastic Routing;Game Theory;Network Security;"Fault Tolerance"",""Game theory";Stochastic processes;Fault tolerance;Computer security;Computer networks;Routing protocols;Transport protocols;Throughput;Delay;"Cryptography"","""",""40"","""",""38"",""IEEE"",""13 Aug 2007"","""","""",""IEEE"",""IEEE Journals""";;;;;;;;
"Gradient Boundary Detection for Time Series Snapshot Construction in Sensor Networks,""J. Lian"; L. Chen; K. Naik; Y. Liu;" G. B. Agnew"",""Department of Electrical and Computer Engineering, University of Waterloo, Waterloo, ONT, Canada"; Department of Computer Science, Hong Kong University of Science and Technology, Hong Kong, China; Department of Electrical and Computer Engineering, University of Waterloo, Waterloo, ONT, Canada; Department of Computer Science, Hong Kong University of Science and Technology, Hong Kong, China;" Department of Electrical and Computer Engineering, University of Waterloo, Waterloo, ONT, Canada"",""IEEE Transactions on Parallel and Distributed Systems"",""17 Sep 2007"",""2007"",""18"",""10"",""1462"",""1475"",""In many applications of sensor networks, the sink needs to keep track of the history of sensed data of a monitored region for scientific analysis or supporting historical queries. We call these historical data a time series of value distributions or snapshots. Obviously, to build the time series snapshots by requiring all of the sensors to transmit their data to the sink periodically is not energy efficient. In this paper, we introduce the idea of gradient boundary and propose the gradient boundary detection (GBD) algorithm to construct these time series snapshots of a monitored region. In GBD, a monitored region is partitioned into a set of subregions and all sensed data in one subregion are within a predefined value range, namely, the gradient interval. Sensors located on the boundaries of the subregions are required to transmit the data to the sink and, then, the sink recovers all subregions to construct snapshots of the monitored area. In this process, only the boundary sensors transmit their data and, therefore, energy consumption is greatly reduced. The simulation results show that GBD is able to build snapshots with a comparable accuracy and has up to 40 percent energy savings compared with the existing approaches for large gradient intervals."",""1558-2183"","""",""10.1109/TPDS.2007.1057"","""",""https://ieeexplore.ieee.org/stamp/stamp.jsp?arnumber=4302732"",""Wireless sensor networks";query processing;"planar graph"",""Monitoring";Sensor phenomena and characterization;Temperature sensors;Energy efficiency;Wireless sensor networks;Partitioning algorithms;Query processing;Temperature measurement;Batteries;"History"","""",""29"",""5"",""27"",""IEEE"",""17 Sep 2007"","""","""",""IEEE"",""IEEE Journals""";;;;;;;;;;
"Handling Topology Changes in InfiniBand,""A. Bermudez"; R. Casado; F. J. Quiles;" J. Duato"",""The Department of Computer Science, Universidad de Castilla La Mancha, Albacete, Spain"; The Department of Computer Science, Universidad de Castilla La Mancha, Albacete, Spain; The Department of Computer Science, Universidad de Castilla La Mancha, Albacete, Spain;" The Department of Computer Engineering, Universidad Politécnica de Valencia, Valencia, Spain"",""IEEE Transactions on Parallel and Distributed Systems"",""8 Jan 2007"",""2007"",""18"",""2"",""172"",""185"",""InfiniBand is a high-performance switched network. Its topology may change due to devices being turned on/off, hot expansion, link remapping, and component failures. The InfiniBand specification defines a management infrastructure which is responsible for detecting and assimilating any change in the network. When a change occurs, management entities must update switch forwarding tables, in order to maintain the connectivity among end nodes. This implies the acquisition of the current topology and the computation of a new set of routes accordingly. It is desirable that the execution of this process does not affect the performance of the upper-level applications that are using the network. In previous works, we have proposed enhanced implementations for the main tasks involved in the assimilation of a change. Now, we present a detailed performance evaluation of a management mechanism which incorporates all our proposals"",""1558-2183"","""",""10.1109/TPDS.2007.26"","""",""https://ieeexplore.ieee.org/stamp/stamp.jsp?arnumber=4052570"",""High-speed LANs";network management;network topology;"routing protocols."",""Network topology";Switches;Proposals;Computer network management;System recovery;Routing protocols;Communication standards;Standards development;Availability;"Communication system control"","""",""6"","""",""26"",""IEEE"",""8 Jan 2007"","""","""",""IEEE"",""IEEE Journals""";;;;;;;;;;;
"High-Performance Reduction Circuits Using Deeply Pipelined Operators on FPGAs,""L. Zhuo"; G. R. Morris;" V. K. Prasanna"",""Department of Electrical Engineering Systems, University of Southern California, Los Angeles, CA, USA"; CEERD-IH, Vicksburg, MS, USA;" Department of Electrical Engineering Systems, University of Southern California, Los Angeles, CA, USA"",""IEEE Transactions on Parallel and Distributed Systems"",""17 Sep 2007"",""2007"",""18"",""10"",""1377"",""1392"",""Field-programmable gate arrays (FPGAs) have become an attractive option for accelerating scientific applications. Many scientific operations such as matrix-vector multiplication and dot product involve the reduction of a sequentially produced stream of values. Unfortunately, because of the pipelining in FPGA-based floating-point units, data hazards may occur during these sequential reduction operations. Improperly designed reduction circuits can adversely impact the performance, impose unrealistic buffer requirements, and consume a significant portion of the FPGA. In this paper, we identify two basic methods for designing serial reduction circuits: the tree-traversal method and the striding method. Using accumulation as an example, we analyze the design trade-offs among the number of adders, buffer size, and latency. We then propose high-performance and area-efficient designs using each method. The proposed designs reduce multiple sets of sequentially delivered floating-point values without stalling the pipeline or imposing unrealistic buffer requirements. Using a Xilinx Virtex-ll Pro FPGA as the target device, we implemented our designs and present performance and area results."",""1558-2183"","""",""10.1109/TPDS.2007.1068"","""",""https://ieeexplore.ieee.org/stamp/stamp.jsp?arnumber=4302726"",""G.1.0.g Parallel algorithms";"C.3.e Reconfigurable hardware"",""Circuits";Field programmable gate arrays;Adders;Design methodology;Parallel processing;Pipeline processing;Hazards;Delay;Clocks;"Acceleration"","""",""61"",""3"",""25"",""IEEE"",""17 Sep 2007"","""","""",""IEEE"",""IEEE Journals""";;;;;;;;;;;;;;;
"Hybrid Runtime Management of Space-Time Heterogeneity for Parallel Structured Adaptive Applications,""X. Li";" M. Parashar"",""Department of Computer Science, Oklahoma State University, Stillwater, OK, USA";" Department of Electrical and Computer Engineering, Rutgers University, Piscataway, NJ, USA"",""IEEE Transactions on Parallel and Distributed Systems"",""13 Aug 2007"",""2007"",""18"",""9"",""1202"",""1214"",""Structured adaptive mesh refinement (SAMR) techniques provide an effective means for dynamically concentrating computational effort and resources to appropriate regions in the application domain. However, due to their dynamism and space-time heterogeneity, scalable parallel implementation of SAMR applications remains a challenge. This paper investigates hybrid runtime management strategies and presents an adaptive hierarchical multipartitioner (AHMP) framework. AHMP dynamically applies multiple partitioners to different regions of the domain, in a hierarchical manner, to match the local requirements of the regions. Key components of the AHMP framework include a segmentation-based clustering algorithm (SBC) that can efficiently identify regions in the domain with relatively homogeneous partitioning requirements, mechanisms for characterizing the partitioning requirements of these regions, and a runtime system for selecting, configuring, and applying the most appropriate partitioner to each region. Further, to address dynamic resource situations for long-running applications, AHMP provides a hybrid partitioning strategy (HPS) that involves application-level pipelining, trading space for time when resources are sufficiently large and underutilized, and an application-level out-of-core strategy (ALOC), trading time for space when resources are scarce in order to enhance the survivability of applications. The AHMP framework has been implemented and experimentally evaluated on up to 1,280 processors of the IBM SP4 cluster at the San Diego Supercomputer Center."",""1558-2183"","""",""10.1109/TPDS.2007.1038"","""",""https://ieeexplore.ieee.org/stamp/stamp.jsp?arnumber=4288121"",""Parallel Computing";Structured Adaptive Mesh Refinement;Dynamic Load Balancing;Hierarchical Multi-Partitioner;"High Performance Computing"",""Runtime";Adaptive mesh refinement;Partitioning algorithms;Computational modeling;Large-scale systems;Physics computing;Application software;Resource management;Concurrent computing;"Clustering algorithms"","""",""6"",""4"",""38"",""IEEE"",""13 Aug 2007"","""","""",""IEEE"",""IEEE Journals""";;;;;;;;;;;;;;
"Hypergraph-Partitioning-Based Remapping Models for Image-Space-Parallel Direct Volume Rendering of Unstructured Grids,""B. B. Cambazoglu";" C. Aykanat"",""Computer Engineering Department, Bilkent University, Ankara, Turkey";" Computer Engineering Department, Bilkent University, Ankara, Turkey"",""IEEE Transactions on Parallel and Distributed Systems"",""4 Dec 2006"",""2007"",""18"",""1"",""3"",""16"",""In this work, image-space-parallel direct volume rendering (DVR) of unstructured grids is investigated for distributed-memory architectures. A hypergraph-partitioning-based model is proposed for the adaptive screen partitioning problem in this context. The proposed model aims to balance the rendering loads of processors while trying to minimize the amount of data replication. In the parallel DVR framework we adopted, each data primitive is statically owned by its home processor, which is responsible from replicating its primitives on other processors. Two appropriate remapping models are proposed by enhancing the above model for use within this framework. These two remapping models aim to minimize the total volume of communication in data replication while balancing the rendering loads of processors. Based on the proposed models, a parallel DVR algorithm is developed. The experiments conducted on a PC cluster show that the proposed remapping models achieve better speedup values compared to the remapping models previously suggested for image-space-parallel DVR"",""1558-2183"","""",""10.1109/TPDS.2007.253277"","""",""https://ieeexplore.ieee.org/stamp/stamp.jsp?arnumber=4020508"",""Direct volume rendering";unstructured grids;ray casting;image space parallelization;hypergraph partitioning;screen partitioning;"remapping."",""Rendering (computer graphics)";Sampling methods;Pixel;Context modeling;Clustering algorithms;Partitioning algorithms;Casting;Data analysis;Analytical models;"Acceleration"","""",""20"","""",""49"",""IEEE"",""4 Dec 2006"","""","""",""IEEE"",""IEEE Journals""";;;;;;;;;;;;
"Immucube: Scalable Fault-Tolerant Routing for k-ary n-cube Networks,""V. Puente";" J. A. Gregorio"",""ETSIIT, Universidad de Cantabria, Cantabria, Spain";" ETSIIT, Universidad de Cantabria, Cantabria, Spain"",""IEEE Transactions on Parallel and Distributed Systems"",""7 May 2007"",""2007"",""18"",""6"",""776"",""788"",""This work presents Immucube, a scalable and efficient mechanism to improve dependability of interconnection networks for parallel and distributed computers. Immucube achieves better flexibility and scalability than any other previous fault-tolerant mechanism in k-ary n-cubes. The proposal inherits from Immunet several advantages over other previous fault-tolerant routing algorithms: 1) allowing any temporal and spatial fault combination, 2) permitting automatic and application-transparent reconfiguration after any fault, and 3) requiring a negligible overhead in the absence of faults. Immucube introduces new important features, such as: 4) providing graceful performance degradation, even in very large interconnection networks, 5) tolerating transparent resource utilization after transitory faults or partial repair of faulty resources, 6) being able to deal with intermittent faults, and 7) being able to dynamically recover the original network performance when all the failed components have been repaired"",""1558-2183"","""",""10.1109/TPDS.2007.1047"","""",""https://ieeexplore.ieee.org/stamp/stamp.jsp?arnumber=4180345"",""Interconnection networks";fault-tolerant routing;"k{\hbox{-}}aryn{\hbox{-}}cubes."",""Fault tolerance";Routing;Multiprocessor interconnection networks;Computer networks;Concurrent computing;Distributed computing;Scalability;Proposals;Degradation;"Resource management"","""",""16"","""",""25"",""IEEE"",""7 May 2007"","""","""",""IEEE"",""IEEE Journals""";;;;;;;;;;;;;;;;
"Improved Methods for Divisible Load Distribution on k-Dimensional Meshes Using Multi-Installment,""Y. -K. Chang"; J. -H. Wu; C. -Y. Chen;" C. -P. Chu"",""Department of Computer Science and Information Engineering, National Cheng Kung University, Tainan, Taiwan"; Department of Computer Science and Information Engineering, National Cheng Kung University, Tainan, Taiwan; Department of Computer Science and Information Engineering, National Cheng Kung University, Tainan, Taiwan;" Department of Computer Science and Information Engineering, National Cheng Kung University, Tainan, Taiwan"",""IEEE Transactions on Parallel and Distributed Systems"",""8 Oct 2007"",""2007"",""18"",""11"",""1618"",""1629"",""In the divisible load distribution, the classic methods on linear arrays divide the computation and communication processes into multiple time intervals in a pipelined fashion. Li (2003) has proposed a set of improved algorithms for linear arrays which can be generalized to k-dimensional meshes. In this paper, we first propose the algorithm M (multi-installment) that employs the multi-installment technique to improve the best algorithm Q proposed by Li. Second, we propose the algorithm S (start-up cost) that includes the computation and communication start-up costs in the design. While the asymptotic speedups of our algorithms M and S derived from the closed-form solutions are the same as algorithm Q, our algorithms approach the optimal speedups considerably faster than algorithm Q as the number of processors increases. Finally, we combine algorithms M and S and propose the algorithm MS. While algorithm MS has the same the asymptotic performance as algorithms Q and S, it achieves a better speedup when the load to be processed is very large and the number of processors is fixed or when the load to be processed is fixed and the number of processors is small."",""1558-2183"","""",""10.1109/TPDS.2007.1103"","""",""https://ieeexplore.ieee.org/stamp/stamp.jsp?arnumber=4339204"",""Divisible load theory";linear array;k-dimensional mesh;"multi-installment"",""Costs";Circuits;Routing;Algorithm design and analysis;Mathematical model;Multimedia databases;Distributed computing;Closed-form solution;Processor scheduling;"Multiprocessing systems"","""",""25"","""",""28"",""IEEE"",""8 Oct 2007"","""","""",""IEEE"",""IEEE Journals""";;;;;;;;;;;
"Improving the Fault Resilience of Overlay Multicast for Media Streaming,""G. Tan";" S. A. Jarvis"",""Department of Computer Science, University of Warwick, Coventry, UK";" Department of Computer Science, University of Warwick, Coventry, UK"",""IEEE Transactions on Parallel and Distributed Systems"",""7 May 2007"",""2007"",""18"",""6"",""721"",""734"",""A key technical challenge for overlay multicast is that the highly dynamic multicast members can make data delivery unreliable. In this paper, we address this issue in the context of live media streaming by exploring 1) how to construct a stable multicast tree that minimizes the negative impact of frequent member departures on an existing overlay and 2) how to efficiently recover from packet errors caused by end-system or network failures. For the first problem, we identify two layout schemes for the tree nodes, namely, the bandwidth-ordered tree and the time-ordered tree, which represent two typical approaches to improving tree reliability, and conduct a stochastic analysis on their properties regarding reliability and tree depth. Based on the findings, we propose a distributed reliability-oriented switching tree (ROST) algorithm that minimizes the failure correlation among tree nodes. Compared with some commonly used distributed algorithms, the ROST algorithm significantly improves tree reliability and reduces average service delay, while incurring only a small protocol overhead";" furthermore, it features a mechanism that prevents cheating or malicious behaviors in the exchange of bandwidth/time information. For the second problem, we develop a simple cooperative error recovery (CER) protocol that helps recover from packet errors efficiently. Recognizing that a single recovery source is usually incapable of providing the timely delivery of the lost data, the protocol recovers from data outages using the residual bandwidths from multiple sources, which are identified using a minimum-loss-correlation algorithm. Extensive simulations demonstrate the effectiveness of the proposed schemes"",""1558-2183"","""",""10.1109/TPDS.2007.1054"","""",""https://ieeexplore.ieee.org/stamp/stamp.jsp?arnumber=4180341"",""Reliability";fault resilience;multicast;media streaming;peer-to-peer;"overlay."",""Streaming media";Resilience;Peer to peer computing;Bandwidth;Stochastic processes;Protocols;Distributed algorithms;Delay effects;Multicast algorithms;"Shape"","""",""13"",""2"",""32"",""IEEE"",""7 May 2007"","""","""",""IEEE"",""IEEE Journals""";;;;;;;;;;;;
"Integrated Memory Controllers with Parallel Coherence Streams,""M. Chaudhuri";" M. Heinrich"",""Department of Computer Science and Engineering, Indian Institute of Technology, Kanpur, India";" School of Computer Science, University of Central Florida, Orlando, FL, USA"",""IEEE Transactions on Parallel and Distributed Systems"",""13 Aug 2007"",""2007"",""18"",""8"",""1159"",""1173"",""Previous work in scalable hardware distributed shared memory (DSM) multiprocessors has established the critical and dominant role that protocol processing bandwidth (or its inverse, occupancy) plays in determining overall performance in architectures with standalone memory/coherence controllers. However, with recent architectural trends toward integrated (on-chip) memory controllers and the well-known fact that processor frequency is increasing more rapidly than memory systems, we must ask whether parallel coherence processing engines (either multiple integrated protocol processors/cores or multiple protocol threads) are needed in DSM machines constructed from modern processor architectures and, if so, when. We construct a useful analytical model to give the designer insight into when parallel coherence streams will improve performance and verify our model via detailed simulation on 64-threaded microbenchmarks and parallel applications and on single-node multiprogrammed workloads. Surprisingly, and contrary to related work, we find that, in these architectures, adding a second coherence engine has almost no impact on performance. Further, for less-tuned applications that suffer from hot spots (contentious requests to the same memory line), additional engines offer no benefit whatsoever. Even with double the memory bandwidth (or channels), an additional coherence processing stream yields only slight performance improvement. Only for a special class of DSM machines employing directoryless broadcast protocols over unordered interconnects does parallel """"snoop"""" processing offer reasonable performance improvement for communication-intensive applications. Overall, given the architectural trends, this is good news for DSM designers who want to minimize the resources necessary (protocol threads or integrated protocol processor cores for maintaining internode coherence, respectively) to create SMTp-based or multi-CMP-based scalable DSM machines using directory protocols."",""1558-2183"","""",""10.1109/TPDS.2007.1044"","""",""https://ieeexplore.ieee.org/stamp/stamp.jsp?arnumber=4288112"","""",""Protocols";Coherence;Engines;Bandwidth;Analytical models;Hardware;Memory architecture;System-on-a-chip;"Control systems"","""",""1"","""",""35"",""IEEE"",""13 Aug 2007"","""","""",""IEEE"",""IEEE Journals""";;;;;;;;;;;;;;;;;;;
"iPAK: An In-Situ Pairwise Key Bootstrapping Scheme for Wireless Sensor Networks,""L. Ma"; X. Cheng; F. Liu; F. An;" J. Rivera"",""Department of Computer Science, George Washington University, Washington D.C., DC, USA"; Department of Computer Science, George Washington University, Washington D.C., DC, USA; Department of Computer Science, George Washington University, Washington D.C., DC, USA; Institute of Computing Technology, Chinese Academy and Sciences, Beijing, China;" Architecture Operation Network and Space (AONS), US Army Communications-Electronics Command, USA"",""IEEE Transactions on Parallel and Distributed Systems"",""13 Aug 2007"",""2007"",""18"",""8"",""1174"",""1184"",""Wireless sensor networks (WSNs) are characterized by resource constraints and large scalability. Many applications of WSNs require secure communication, a crucial component especially in hostile environments. However, the low computational capability and small storage budget within sensors render many popular public-key-based cryptographic systems impractical. Symmetric key cryptography, on the other hand, is attractive due to its efficiency. Nevertheless, establishing a shared key for communicating parties is a challenging problem. In this paper, we propose and analyze an in situ PAirwise Key bootstrapping scheme (iPAK) for large-scale WSNs. Our theoretical analysis and simulation study demonstrate that iPAK can achieve a high key-sharing probability between neighboring sensors and a strong resilience against node-capture attacks at the cost of low storage overhead."",""1558-2183"","""",""10.1109/TPDS.2007.1063"","""",""https://ieeexplore.ieee.org/stamp/stamp.jsp?arnumber=4288113"",""Wireless sensor networks";in-situ key establishment;key pre-distribution;"Security"",""Wireless sensor networks";Large-scale systems;Cryptography;Network servers;Sensor phenomena and characterization;Scalability;Analytical models;Protocols;Information security;"Sensor systems"","""",""19"","""",""29"",""IEEE"",""13 Aug 2007"","""","""",""IEEE"",""IEEE Journals""";;;;;;;;;
