"Analysis of Parallel Algorithms for Matrix Chain Product and Matrix Powers on Distributed Memory Systems,""K. Li"",""Department of Computer Science, State University of New York, New Paltz, NY, USA"",""IEEE Transactions on Parallel and Distributed Systems"",""4 Jun 2007"",""2007"",""18"",""7"",""865"",""878"",""Given N matrices A1, A2,...,AN of size NtimesN, the matrix chain product problem is to compute A1timesA2times...timesAN. Given an NtimesN matrix A, the matrix powers problem is to calculate the first N powers of A, that is, A, A2, A3,..., AN. We solve the two problems on distributed memory systems (DMSs) with p processors that can support one-to-one communications in T(p) time. Assume that the fastest sequential matrix multiplication algorithm has time complexity O(Nalpha), where the currently best value of a is less than 2.3755. Let p be arbitrarily chosen in the range 1lesplesNalpha+1/(log N)2. We show that the two problems can be solved by a DMS with p processors in Tchain(N,p)=O((Nalpha+1/p)+T(p))((N2(2+1/alpha/p2/alpha)(log+p/N)1-2/alpha+log+((p log N)/Nalpha)) and Tpower (N,p)=O(Nalpha+1/p+T(p)((N2(1+1/alpha)/p2/alpha)(log+p/2 log N)1-2/alpha+(log N)2))) times, respectively, where the function log+ is defined as follows: log+ x=log x if xges1 and log+ x=1 if 0<x<1. We also give instantiations of the above results on several typical DMSs and show that computing matrix chain product and matrix powers are fully scalable on distributed memory parallel computers (DMPCs), highly scalable on DMSs with hypercubic networks, and not highly scalable on DMSs with mesh and torus networks."",""1558-2183"","""",""10.1109/TPDS.2007.1027"","""",""https://ieeexplore.ieee.org/stamp/stamp.jsp?arnumber=4218568"",""Cost optimality";distributed memory parallel computer;distributed memory system;dynamic processor allocation;hypercubic network;matrix chain product;matrix multiplication;matrix power;mesh;scalability;speedup;"torus."",""Algorithm design and analysis";Parallel algorithms;Distributed computing;Concurrent computing;Computer networks;Equations;Scalability;Polynomials;Eigenvalues and eigenfunctions;"Linear systems"","""",""4"","""",""35"",""IEEE"",""4 Jun 2007"","""","""",""IEEE"",""IEEE Journals""";;;;;;;;;
"Analyzing the Energy-Time Trade-Off in High-Performance Computing Applications,""V. W. Freeh"; D. K. Lowenthal; F. Pan; N. Kappiah; R. Springer; B. L. Rountree;" M. E. Femal"",""Department of Computer Science, North Carolina State University, Raleigh, NC, USA"; Department of Computer Science, University of Georgia, Athens, GA, USA; Department of Computer Science, North Carolina State University, Raleigh, NC, USA; Department of Computer Science, North Carolina State University, Raleigh, NC, USA; Department of Computer Science, University of Georgia, Athens, GA, USA; Department of Computer Science, University of Georgia, Athens, GA, USA;" Department of Computer Science, North Carolina State University, Raleigh, NC, USA"",""IEEE Transactions on Parallel and Distributed Systems"",""7 May 2007"",""2007"",""18"",""6"",""835"",""848"",""Although users of high-performance computing are most interested in raw performance both energy and power consumption has become critical concerns. One approach to lowering energy and power is to use high-performance cluster nodes that have several power-performance states so that the energy-time trade-off can be dynamically adjusted. This paper analyzes the energy-time trade-off of a wide range of applications-serial and parallel-on a power-scalable cluster. We use a cluster of frequency and voltage-scalable AMD-64 nodes, each equipped with a power meter. We study the effects of memory and communication bottlenecks via direct measurement of time and energy. We also investigate metrics that can, at runtime, predict when each type of bottleneck occurs. Our results show that, for programs that have a memory or communication bottleneck, a power-scalable cluster can save significant energy with only a small time penalty. Furthermore, we find that, for some programs, it is possible to both consume less energy and execute in less time by increasing the number of nodes while reducing the frequency-voltage setting of each node"",""1558-2183"","""",""10.1109/TPDS.2007.1026"","""",""https://ieeexplore.ieee.org/stamp/stamp.jsp?arnumber=4180349"",""High-performance computing";"power-aware computing."",""Computer applications";Frequency;Voltage;Gears;High performance computing;Energy consumption;Costs;Microprocessors;Energy measurement;"Time measurement"","""",""132"",""2"",""79"",""IEEE"",""7 May 2007"","""","""",""IEEE"",""IEEE Journals""";;;;;;;
"ASAP: An Adaptive Sampling Approach to Data Collection in Sensor Networks,""B. Gedik"; L. Liu;" P. S. Yu"",""IBM Thomas J. Watson Research Center, Hawthorne, NY, USA"; College of Computing, Georgia Institute of Technology, Atlanta, GA, USA;" IBM Thomas J. Watson Research Center, Hawthorne, NY, USA"",""IEEE Transactions on Parallel and Distributed Systems"",""5 Nov 2007"",""2007"",""18"",""12"",""1766"",""1783"",""One of the most prominent and comprehensive ways of data collection in sensor networks is to periodically extract raw sensor readings. This way of data collection enables complex analysis of data, which may not be possible with in-network aggregation or query processing. However, this flexibility in data analysis comes at the cost of power consumption. In this paper we develop ASAP − an adaptive sampling approach to energyefficient periodic data collection in sensor networks. The main idea behind ASAP is to use a dynamically changing subset of the nodes as samplers such that the sensor readings of the sampler nodes are directly collected, whereas the values of the non-sampler nodes are predicted through the use of probabilistic models that are locally and periodically constructed. ASAP can be effectively used to increase the network lifetime while keeping the quality of the collected data high, in scenarios where either the spatial density of the network deployment is superfluous relative to the required spatial resolution for data analysis or certain amount of data quality can be traded off in order to decrease the power consumption of the network. ASAP approach consists of three main mechanisms. First, sensing-driven cluster construction is used to create clusters within the network such that nodes with close sensor readings are assigned to the same clusters. Second, correlation-based sampler selection and model derivation are used to determine the sampler nodes and to calculate the parameters of the probabilistic models that capture the spatial and temporal correlations among the sensor readings. Last, adaptive data collection and model-based prediction are used to minimize the number of messages used to extract data from the network. A unique feature of ASAP is the use of in-network schemes, as opposed to the protocols requiring centralized control, to select and dynamically refine the subset of the sensor nodes serving as samplers and to adjust th"",""1558-2183"","""",""10.1109/TPDS.2007.1110"","""",""https://ieeexplore.ieee.org/stamp/stamp.jsp?arnumber=4359398"",""C.2.7.c Sensor networks";C.2.0.b Data communications;H.2.1.a Data models;C.2.7.c Sensor networks;C.2.0.b Data communications;"H.2.1.a Data models"",""Sampling methods";Data analysis;Predictive models;Data mining;Energy consumption;Query processing;Costs;Energy efficiency;Spatial resolution;"Protocols"","""",""132"",""5"",""31"",""IEEE"",""5 Nov 2007"","""","""",""IEEE"",""IEEE Journals""";;;;;;;;;;;
"Assisted Peer-to-Peer Search with Partial Indexing,""R. Zhang";" Y. C. Hu"",""School of Electrical and Computer Engineering, Purdue University, West Lafayette, IN, USA";" School of Electrical and Computer Engineering, Purdue University, West Lafayette, IN, USA"",""IEEE Transactions on Parallel and Distributed Systems"",""13 Aug 2007"",""2007"",""18"",""8"",""1146"",""1158"",""In the past few years, peer-to-peer (P2P) networks have become a promising paradigm for building a wide variety of distributed systems and applications. The most popular P2P application till today is file sharing, e.g., Gnutella, Kazza, etc. These systems are usually referred to as unstructured, and search in unstructured P2P networks usually involves flooding or random walking. On the other hand, in structured P2P networks (DHTs), search is usually performed by looking up a distributed inverted index. The efficiency of the search mechanism is the key to the scalability of a P2P content sharing system. So far, neither unstructured nor structured P2P networks alone can solve the search problem in a satisfactory way. In this paper, we propose to combine the strengths of both unstructured and structured P2P networks to achieve more efficient search. Specifically, we propose to enhance search in unstructured P2P overlay networks by building a partial index of shared data using a structured P2P network. The index maintains two types of information: the top interests of peers and globally unpopular data, both characterized by data properties. The proposed search protocol, assisted search with partial indexing, makes use of the index to improve search in three ways: first, the index assists peers to find other peers with similar interests and the unstructured search overlay is formed to reflect peer interests. Second, the index also provides search hints for those data difficult to locate by exploring peer interest locality, and these hints can be used for second-chance search. Third, the index helps to locate unpopular data items. Experiments based on a P2P file sharing trace show that the assisted search with a lightweight partial indexing service can significantly improve the success rate in locating data than Gnutella and a hit-rate-based protocol in unstructured P2P systems, while incurring low search latency and overheads."",""1558-2183"","""",""10.1109/TPDS.2007.1035"","""",""https://ieeexplore.ieee.org/stamp/stamp.jsp?arnumber=4288111"",""C.2.4 Distributed Systems";"H.3.3 Information Search and Retrieval"",""Peer to peer computing";Indexing;Protocols;Buildings;Network servers;Network topology;Legged locomotion;Scalability;Search problems;"Delay"","""",""50"","""",""45"",""IEEE"",""13 Aug 2007"","""","""",""IEEE"",""IEEE Journals""";;;;;;;;;;;;;;;;;
"Backfilling Using System-Generated Predictions Rather than User Runtime Estimates,""D. Tsafrir"; Y. Etsion;" D. G. Feitelson"",""School of Computer Science and Engineering, Hebrew University, Jerusalem, Israel"; School of Computer Science and Engineering, Hebrew University, Jerusalem, Israel;" School of Computer Science and Engineering, Hebrew University, Jerusalem, Israel"",""IEEE Transactions on Parallel and Distributed Systems"",""7 May 2007"",""2007"",""18"",""6"",""789"",""803"",""The most commonly used scheduling algorithm for parallel supercomputers is FCFS with backfilling, as originally introduced in the EASY scheduler. Backfilling means that short jobs are allowed to run ahead of their time provided they do not delay previously queued jobs (or at least the first queued job). However, predictions have not been incorporated into production schedulers, partially due to a misconception (that we resolve) claiming inaccuracy actually improves performance, but mainly because underprediction is technically unacceptable: users will not tolerate jobs being killed just because system predictions were too short. We solve this problem by divorcing kill-time from the runtime prediction and correcting predictions adaptively as needed if they are proved wrong. The end result is a surprisingly simple scheduler, which requires minimal deviations from current practices (e.g., using FCFS as the basis) and behaves exactly like EASY as far as users are concerned"; nevertheless, it achieves significant improvements in performance, predictability, and accuracy. Notably, this is based on a very simple runtime predictor that just averages the runtimes of the last two jobs by the same user;" counter intuitively, our results indicate that using recent data is more important than mining the history for similar jobs. All the techniques suggested in this paper can be used to enhance any backfilling algorithm and are not limited to EASY"",""1558-2183"","""",""10.1109/TPDS.2007.70606"","""",""https://ieeexplore.ieee.org/stamp/stamp.jsp?arnumber=4180346"",""Parallel job scheduling";backfilling;runtime estimates;system-generated predictions;history-based predictions;dynamic prediction correction;performance metrics;EASY;EASY++;"SJBF."",""Runtime";Supercomputers;History;Processor scheduling;Scheduling algorithm;Delay effects;Job production systems;Accuracy;Dynamic scheduling;"Measurement"","""",""249"",""9"",""39"",""IEEE"",""7 May 2007"","""","""",""IEEE"",""IEEE Journals""";;;;;
"Balanced Overlay Networks (BON): An Overlay Technology for Decentralized Load Balancing,""J. Bridgewater"; P. O. Boykin;" V. Roychowdhury"",""Electrical Engineering Department, University of California, Los Angeles, CA, USA"; Department of Electrical and Computer Engineering, University of Florida, Gainesville, FL, USA;" Electrical Engineering Department, University of California, Los Angeles, CA, USA"",""IEEE Transactions on Parallel and Distributed Systems"",""13 Aug 2007"",""2007"",""18"",""8"",""1122"",""1133"",""We present a novel framework, called balanced overlay networks (BON), that provides scalable, decentralized load balancing for distributed computing using large-scale pools of heterogeneous computers. Fundamentally, BON encodes the information about each node's available computational resources in the structure of the links connecting the nodes in the network. This distributed encoding is self-organized, with each node managing its in-degree and local connectivity via random-walk sampling. Assignment of incoming jobs to nodes with the most free resources is also accomplished by sampling the nodes via short random walks. Extensive simulations show that the resulting highly dynamic and self-organized graph structure can efficiently balance computational load throughout large-scale networks. These simulations cover a wide spectrum of cases, including significant heterogeneity in available computing resources and high burstiness in incoming load. Prior analytical results show BON's scalability for truly large-scale networks";" under certain ideal conditions, the network structure converges to Erdos-Renyi (ER) random graphs. Our simulation results, however, show that the algorithm does much better, and the structures seem to approach the ideal case of d-regular random graphs. We also make a connection between highly-loaded BON and the well-known ball-bin randomized load balancing framework."",""1558-2183"","""",""10.1109/TPDS.2007.1031"","""",""https://ieeexplore.ieee.org/stamp/stamp.jsp?arnumber=4288109"",""Distributed computing";random walks;load balancing;random graphs;"randomized algorithms"",""Load management";Large-scale systems;Computer networks;Computational modeling;Distributed computing;Sampling methods;Joining processes;Encoding;Scalability;"Erbium"","""",""17"","""",""27"",""IEEE"",""13 Aug 2007"","""","""",""IEEE"",""IEEE Journals""";;;;;;;;;;;
"Bandwidth Management for Supporting Differentiated Service Aware Traffic Engineering,""T. Shan";" O. Yang"",""Nortel Networks Limited, Ottawa, ONT, Canada";" School of Information Technology and Engineering, University of Ottawa, Ottawa, ONT, Canada"",""IEEE Transactions on Parallel and Distributed Systems"",""13 Aug 2007"",""2007"",""18"",""9"",""1320"",""1331"",""This paper presents a bandwidth management framework for the support of differentiated-service-aware traffic engineering (DS-TE) in multiprotocol label switching (MPLS) networks. Our bandwidth management framework contains both bandwidth allocation and preemption mechanisms in which the link bandwidth is managed in two dimensions: class type (CT) and preemption priority. We put forward a Max-Min bandwidth constraint model in which we propose a novel """"use it or lend it"""" strategy. The new model is able to guarantee a minimum bandwidth for each CT without causing resource fragmentation. Furthermore, we design three new bandwidth preemption algorithms for three bandwidth constraint models, respectively. An extensive simulation study is carried out to evaluate the effectiveness of the bandwidth constraint models and preemption algorithms. When compared with the existing constraint models and preemption rules, the proposed Max-Min constraint model and preemption algorithms improve not only bandwidth efficiency, but also robustness and fairness. They achieve significant performance improvement for the well-behaving traffic classes in terms of bandwidth utilization and bandwidth blocking and preemption probability. We also provide guidelines for selecting different DS-TE bandwidth management mechanisms."",""1558-2183"","""",""10.1109/TPDS.2007.1052"","""",""https://ieeexplore.ieee.org/stamp/stamp.jsp?arnumber=4288130"",""Resource Management";Admission Control;Differentiated Service;"Traffic Engineering"",""Bandwidth";Engineering management;Tellurium;Telecommunication traffic;Diffserv networks;Multiprotocol label switching;Quality of service;Traffic control;Admission control;"Processor scheduling"","""",""16"",""5"",""27"",""IEEE"",""13 Aug 2007"","""","""",""IEEE"",""IEEE Journals""";;;;;;;;;;;;;;;
"Bounded-Collision Memory-Mapping Schemes for Data Structures with Applications to Parallel Memories,""G. Cordasco"; V. Scarano;" A. L. Rosenberg"",""Dipartimento di Informatica ed Applicazioni R.M. Capocdelli, Università De Salerno, Fisciano, Salerno, Italy"; Dipartimento di Informatica ed Applicazioni R.M. Capocdelli, Università De Salerno, Fisciano, Salerno, Italy;" Department of Computer Science, University of Massachusetts, Amherst, Amherst, MA, USA"",""IEEE Transactions on Parallel and Distributed Systems"",""4 Jun 2007"",""2007"",""18"",""7"",""973"",""982"",""Techniques are developed for mapping structured data to an ensemble of parallel memory modules in a way that limits the number of conflicts, i.e., simultaneous accesses by distinct processors to the same memory module. The techniques determine, for any given conflict tolerance c, the smallest ensemble that allows one to store any n-node data structure """"of type X"""" in such a way that no more than c nodes of a structure are stored on the same module. This goal is achieved by determining the smallest c-perfect universal graphs for data structures """"of type X."""" Such a graph is the smallest graph that contains a homomorphic image of each n-node structure """"of type X"""" with each node of the image holding < c nodes of the structure. In the current paper, """"type X"""" refers to rooted binary trees and three array-like structures: chaotic arrays, ragged arrays, and rectangular arrays. For each of these families of data structures, the number of memory modules needed to achieve conflict tolerance c is determined to within constant factors."",""1558-2183"","""",""10.1109/TPDS.2007.1024"","""",""https://ieeexplore.ieee.org/stamp/stamp.jsp?arnumber=4218576"",""Parallel memory systems";data structures for parallel systems;bounded-conflict parallel memory access;data mapping;parallel architectures;parallel systems;data structures;"graph labeling."",""Data structures";Simultaneous localization and mapping;Binary trees;Chaos;Application software;Parallel architectures;Labeling;Multiprocessing systems;Algorithm design and analysis;"Delay"","""",""16"","""",""29"",""IEEE"",""4 Jun 2007"","""","""",""IEEE"",""IEEE Journals""";;;;;;;;;
"Building a Scalable Bipartite P2P Overlay Network,""Y. Liu"; L. Xiao;" L. Ni"",""Department of Computer Science and Engineering, Hong Kong University of Science and Technology, Hong Kong, China"; Department of Computer Science and Engineering, Michigan State University, East Lansing, MI, USA;" Department of Computer Science and Engineering, Hong Kong University of Science and Technology, Hong Kong, China"",""IEEE Transactions on Parallel and Distributed Systems"",""13 Aug 2007"",""2007"",""18"",""9"",""1296"",""1306"",""The peer-to-peer (P2P) model, being widely adopted in today's Internet computing, suffers from the problem of topology mismatch between the overlay networks and the underlying physical network. Traditional topology optimization techniques identify physically closer nodes to connect as overlay neighbors, but could significantly shrink the search scope. Efforts have been made to address the mismatch problem without sacrificing the search scope, but they either need time synchronization among peers or have a low convergent speed. In this paper, we propose a scalable bipartite overlay (SBO) scheme to optimize the overlay topology by identifying and replacing the mismatched connections. In SBO, we employ an efficient strategy for distributing optimization tasks in peers with different colors. We conducted comprehensive simulations to evaluate this design. The results show that SBO achieves approximately 85 percent of reduction on traffic cost and about 60 percent of reduction on query response time. Our comparisons with previous approaches to address the topology mismatch problem have shown that SBO can achieve a fast convergent speed, without the need of time synchronization among peers."",""1558-2183"","""",""10.1109/TPDS.2007.1059"","""",""https://ieeexplore.ieee.org/stamp/stamp.jsp?arnumber=4288128"",""Unstructured Peer-to-Peer";topology mismatch;overlay;bipartite;"search efficiency"",""Peer to peer computing";Network topology;Delay;Telecommunication traffic;Traffic control;Internet;IP networks;Computer networks;Physics computing;"Costs"","""",""76"",""3"",""31"",""IEEE"",""13 Aug 2007"","""","""",""IEEE"",""IEEE Journals""";;;;;;;;;;;;
"CMP Support for Large and Dependent Speculative Threads,""C. B. Colohan"; A. Ailamaki; G. Steffan;" T. C. Mowry"",""Google, Inc., Mountain View, CA, USA"; Computer Science Department, Carnegie Mellon University, Pittsburgh, PA, USA; Department of Electrical and Computer Engineering, Computer Engineering Research Group, University of Toronto, Toronto, ONT, Canada;" Computer Science Department, Carnegie Mellon University, Pittsburgh, PA, USA"",""IEEE Transactions on Parallel and Distributed Systems"",""13 Aug 2007"",""2007"",""18"",""8"",""1041"",""1054"",""Thread-level speculation (TLS) has proven to be a promising method of extracting parallelism from both integer and scientific workloads, targeting speculative threads that range in size from hundreds to several thousand dynamic instructions and have minimal dependences between them. However, recent work has shown that TLS can offer compelling performance improvements when targeting much larger speculative threads of more than 50,000 dynamic instructions per thread, with many frequent data dependences between them. To support such large and dependent speculative threads, hardware must be able to buffer the additional speculative state, and must also address the more challenging problem of tolerating the resulting cross-thread data dependences. In this article we present chipmultiprocessor (CMP) support for large speculative threads that integrates several previous proposals for TLS hardware. We also present support for sub-threads: a mechanism for tolerating crossthread data dependences by checkpointing speculative execution. Through an evaluation that exploits the proposed hardware support in the database domain, we find that the transaction response time for three of the five transactions from TPC-C (on a simulated 4-processor chip-multiprocessor) speed up by a factor of 1.9 to 2.9."",""1558-2183"","""",""10.1109/TPDS.2007.1081"","""",""https://ieeexplore.ieee.org/stamp/stamp.jsp?arnumber=4288103"",""Multiprocessor Systems";thread-level speculation;databases;"cache coherence"",""Hardware";Delay;Transaction databases;Parallel processing;Computer Society;Proposals;Checkpointing;Microprocessors;"Computer industry"","""",""8"",""1"",""37"",""IEEE"",""13 Aug 2007"","""","""",""IEEE"",""IEEE Journals""";;;;;;;;;;;;
