"Flexible Robust Group Key Agreement,""S. Jarecki"; J. Kim;" G. Tsudik"",""Department of Computer Science, University of California, Irvine, CA, USA"; ISaC & Department of Mathematical Sciences, Seoul National University, Seoul, South Korea;" Department of Computer Science, University of California, Irvine, CA, USA"",""IEEE Transactions on Parallel and Distributed Systems"",""28 Mar 2011"",""2011"",""22"",""5"",""879"",""886"",""A robust group key agreement protocol (GKA) allows a set of players to establish a shared secret key, regardless of network/node failures. Current constant-round GKA protocols are either efficient and nonrobust or robust but not efficient";" assuming a reliable broadcast communication medium, the standard encryption-based group key agreement protocol can be robust against arbitrary number of node faults, but the size of the messages broadcast by every player is proportional to the number of players. In contrast, nonrobust group key agreement can be achieved with each player broadcasting just constant-sized messages. We propose a novel 2-round group key agreement protocol, which tolerates up to T node failures, using O(T)-sized messages for any T. We show that the new protocol implies a fully-robust group key agreement with logarithmic-sized messages and expected round complexity close to 2, assuming random node faults. The protocol can be extended to withstand malicious insiders at small constant factor increases in bandwidth and computation. The proposed protocol is secure under the (standard) Decisional Square Diffie-Hellman assumption."",""1558-2183"","""",""10.1109/TPDS.2010.128"","""",""https://ieeexplore.ieee.org/stamp/stamp.jsp?arnumber=5492681"",""Group key agreement";fault-tolerance;algorithms;"security."",""Robustness";Protocols;Broadcasting;Application software;Telecommunication network reliability;Communication standards;Cryptography;Bandwidth;Computer security;"Carbon capture and storage"","""",""32"","""",""14"",""IEEE"",""28 Jun 2010"","""","""",""IEEE"",""IEEE Journals""";;;;;;;;;;;;;;;;
"General Maximal Lifetime Sensor-Target Surveillance Problem and Its Solution,""H. Liu"; X. Chu; Y. -W. Leung; X. Jia;" P. -J. Wan"",""Department of Computer Science, Hong Kong Baptist University, Kowloon Tong, Hong Kong, China"; Department of Computer Science, Hong Kong Baptist University, Kowloon Tong, Hong Kong, China; Department of Computer Science, Hong Kong Baptist University, Kowloon Tong, Hong Kong, China; Department of Computer Science, City University of Hong Kong, Kowloon Tong, Hong Kong, China;" Department of Computer Science, Illinois Institute of Technology, Chicago, IL, USA"",""IEEE Transactions on Parallel and Distributed Systems"",""25 Aug 2011"",""2011"",""22"",""10"",""1757"",""1765"",""We address a new and general maximal lifetime problem in sensor-target surveillance. We assume that each sensor can watch at most k targets (k ≥ 1) and each target should be watched by h sensors (h ≥ 1) at any time. The problem is to schedule sensors to watch targets and forward the sensed data to a base station such that the lifetime of the surveillance network is maximized. This general problem includes the existing ones as its special cases (k = 1 and h = 1 in and k = 1 and h ≥ 2 in). It is also important in practice because some sensors can monitor multiple or all targets within their surveillance ranges and multisensor fusion (i.e., watching a target by multiple sensors) gives better surveillance results. The problem involves several subproblems and one of them is a new matching problem called (k, h)-matching. The (k, h)-matching problem is a generalized version of the classic bipartite matching problem (when k = h = 1, (k, h)-matching becomes bipartite matching). We design an efficient (k, h)-matching algorithm to solve the (k, h)-matching problem and then solve the general maximal lifetime problem. As a byproduct of this study, the (k, h)-matching problem and the proposed (k, h)-matching algorithm can potentially be applied to other problems in computer science and operations research."",""1558-2183"","""",""10.1109/TPDS.2011.42"","""",""https://ieeexplore.ieee.org/stamp/stamp.jsp?arnumber=5703082"",""Wireless sensor networks";maximal lifetime;scheduling;matching;"routing."",""Surveillance";Schedules;Watches;Base stations;Bipartite graph;Matrix decomposition;"Linear programming"","""",""9"","""",""19"",""IEEE"",""28 Jan 2011"","""","""",""IEEE"",""IEEE Journals""";;;;;;;;;;;;;;;
"Generalized Probabilistic Flooding in Unstructured Peer-to-Peer Networks,""R. Gaeta";" M. Sereno"",""Dipartimento di Informatica, Università di Torino, Torino, Italy";" Dipartimento di Informatica, Università di Torino, Torino, Italy"",""IEEE Transactions on Parallel and Distributed Systems"",""24 Oct 2011"",""2011"",""22"",""12"",""2055"",""2062"",""In this paper, we propose a generalization of the basic flooding search strategy for decentralized unstructured peer-to-peer (P2P) networks. In our algorithm a peer forwards a query to one of its neighbors using a probability that is a function of the number of connections in the overlay network of both. Moreover, this probability may also depend on the distance from the query originator. To analyze the performance of the proposed search strategy in heterogeneous decentralized unstructured P2P networks, we develop a generalized random graph (GRG)-based model that takes into account the high variability in the number of application level connections that each peer establishes, and the nonuniform distribution of resources among peers. Furthermore, the model includes an analysis of peer availability, i.e., the capability of relaying queries of other peers, as a function of the query generation rate of each peer. Validation of the proposed model is carried out comparing the model predictions with simulations conducted on real overlay topologies obtained from crawling the popular file sharing application Gnutella."",""1558-2183"","""",""10.1109/TPDS.2011.82"","""",""https://ieeexplore.ieee.org/stamp/stamp.jsp?arnumber=5733338"",""Peer-to-peer networks";random graphs;probabilistic flooding;"search strategies."",""Peer to peer computing";Probabilistic logic;Network topology;Analytical models;Probability distribution;Predictive models;"Search methods"","""",""48"","""",""43"",""IEEE"",""17 Mar 2011"","""","""",""IEEE"",""IEEE Journals""";;;;;;;;;;;;;;;;;;;;;;
"Group Strategyproof Multicast in Wireless Networks,""A. Gopinathan"; Z. Li;" B. Li"",""Department of Computer Science, University of Calgary, Canada"; Department of Computer Science, University of Calgary, Canada;" Department of Electrical and Computer Engineering, University of Toronto, Canada"",""IEEE Transactions on Parallel and Distributed Systems"",""28 Mar 2011"",""2011"",""22"",""5"",""708"",""715"",""Abstract-We study the dissemination of common information from a source to multiple nodes within a multihop wireless network, where nodes are equipped with uniform omnidirectional antennas and have a fixed cost per packet transmission. While many nodes may be interested in the dissemination service, their valuation or utility for such a service is usually private information. A desirable routing and charging mechanism encourages truthful utility reports from the nodes. We provide both negative and positive results toward such mechanism design. We show that in order to achieve the group strategyproof property, a compromise in routing optimality or budget-balance is inevitable. In particular, the fraction of optimal routing cost that can be recovered through node charges cannot be significantly higher than 1/2. To answer the question whether constant-ratio cost recovery is possible, we further apply a primal-dual schema to simultaneously build a routing solution and a cost-sharing scheme, and prove that the resulting mechanism is group strategyproof and guarantees 1/4-approximate cost recovery against an optimal routing scheme."",""1558-2183"","""",""10.1109/TPDS.2010.184"","""",""https://ieeexplore.ieee.org/stamp/stamp.jsp?arnumber=5611498"",""Mechanism design";wireless networks;game theory;linear programming;approximation algorithms;"theory."",""Wireless networks";Receivers;Routing;Steiner trees;Games;Algorithm design and analysis;"Upper bound"","""",""5"","""",""18"",""IEEE"",""28 Oct 2010"","""","""",""IEEE"",""IEEE Journals""";;;;;;;;;;;;;;;;;;
"Guest Editor's Introduction: Special Issue on High-Performance Computing with Accelerators,""D. A. Bader"; D. Kaeli;" V. Kindratenko"",""College of Computing, Georgia Institute of Technology, Atlanta, GA"; Department of Electrical and Computer Engineering, Northeastern University, Boston, MA;" National Center for Supercomputing Applications, University of Illinois at Urbana-Champaign, Urbana, IL"",""IEEE Transactions on Parallel and Distributed Systems"",""29 Nov 2010"",""2011"",""22"",""1"",""3"",""6"",""The 12 papers in this special issue on high-performance computing with accelerators discuss a range of different accelerator architectures and applications. "",""1558-2183"","""",""10.1109/TPDS.2011.8"","""",""https://ieeexplore.ieee.org/stamp/stamp.jsp?arnumber=5644743"","""",""Special issues and sections";High performance computing;"Accelerator architectures"","""",""2"","""",""34"",""IEEE"",""29 Nov 2010"","""","""",""IEEE"",""IEEE Journals""";;;;;;;;;;;;;;;;;;;;;;;;;;;
"Guest Editors' Introduction: Special Section on Many-Task Computing,""I. Raicu"; I. T. Foster;" Y. Zhao"",""Illinois Institute of Technology, Argonne, IL"; University of Chicago, Argonne, IL;" University of Electronic Science and Technology of China, Chengdu, China"",""IEEE Transactions on Parallel and Distributed Systems"",""25 Apr 2011"",""2011"",""22"",""6"",""897"",""898"","""",""1558-2183"","""",""10.1109/TPDS.2011.138"","""",""https://ieeexplore.ieee.org/stamp/stamp.jsp?arnumber=5756303"","""",""Special issues and sections";Multitasking;Computer performance;"Computer networks"","""","""","""",""4"",""IEEE"",""25 Apr 2011"","""","""",""IEEE"",""IEEE Journals""";;;;;;;;;;;;;;;;;;;;;;;;;;
"HaRP: Rapid Packet Classification via Hashing Round-Down Prefixes,""F. Pong";" N. -F. Tzeng"",""Broadcom Corporation, Santa Clara, CA, USA";" Center of Advanced Computer Studies, University of Louisiana, Lafayette, LA, USA"",""IEEE Transactions on Parallel and Distributed Systems"",""23 May 2011"",""2011"",""22"",""7"",""1105"",""1119"",""Packet classification is central to a wide array of Internet applications and services, with its approaches mostly involving either hardware support or optimization steps needed by software-oriented techniques (to add precomputed markers and insert rules in the search data structures). Unfortunately, an approach with hardware support is expensive and has limited scalability, whereas one with optimization fails to handle incremental rule updates effectively. This work deals with rapid packet classification, realized by hashing round-down prefixes (HaRP) in a way that the source and the destination IP prefixes specified in a rule are rounded down to “designated prefix lengths” (DPL) for indexing into hash sets. HaRP exhibits superb hash storage utilization, able to not only outperform those earlier software-oriented classification techniques but also well accommodate dynamic creation and deletion of rules. HaRP makes it possible to hold all its search data structures in the local cache of each core within a contemporary processor, dramatically elevating its classification performance. Empirical results measured on an AMD 4-way 2.8 GHz Opteron system (with 1 MB cache for each core) under six filter data sets (each with up to 30 K rules) obtained from a public source unveil that HaRP enjoys up to some 3.6× throughput level achievable by the best known decision tree-based counterpart, HyperCuts (HC)."",""1558-2183"","""",""10.1109/TPDS.2010.195"","""",""https://ieeexplore.ieee.org/stamp/stamp.jsp?arnumber=5629331"",""Classification rules";decision trees;filter data sets;hashing functions;incremental rule updates;IP prefixes;packet classification;routers;set-associative hash tables;"tuple space search."",""Classification algorithms";IP networks;Random access memory;Classification tree analysis;Hardware;"Data structures"","""",""18"",""18"",""25"",""IEEE"",""11 Nov 2010"","""","""",""IEEE"",""IEEE Journals""";;;;;;;;;;;;;;;;;
"Heuristics for Robust Resource Allocation of Satellite Weather Data Processing on a Heterogeneous Parallel System,""L. D. Briceno"; H. J. Siegel; A. A. Maciejewski; M. Oltikar; J. Brateman; J. White; J. Martin;" K. Knapp"",""Department of Electrical and Computer Engineering, Colorado State University, Fort Collins, CO"; Department of Electrical and Computer Engineering, Colorado State University, Fort Collins, CO; Department of Electrical and Computer Engineering, Colorado State University, Fort Collins, CO; Department of Electrical and Computer Engineering, Colorado State University, Fort Collins, CO; Department of Electrical and Computer Engineering, Colorado State University, Fort Collins, CO; Department of Electrical and Computer Engineering, Colorado State University, Fort Collins, CO; Department of Electrical and Computer Engineering, Colorado State University, Fort Collins, CO;" Department of Electrical and Computer Engineering, Colorado State University, Fort Collins, CO"",""IEEE Transactions on Parallel and Distributed Systems"",""26 Sep 2011"",""2011"",""22"",""11"",""1780"",""1787"",""This work considers the satellite data processing portion of a space-based weather monitoring system. It uses a heterogeneous distributed processing platform. There is uncertainty in the arrival time of new data sets to be processed, and resource allocation must be robust with respect to this uncertainty. The tasks to be executed by the platform are classified into two broad categories: high priority (e.g., telemetry, tracking, and control), and revenue generating (e.g., data processing and data research). In this environment, the resource allocation of the high-priority tasks must be done before the resource allocation of the revenue generating tasks. A two-part allocation scheme is presented in this research. The goal of first part is to find a resource allocation that minimizes makespan of the high-priority tasks. The robustness for the first part of the mapping is defined as the difference between this time and the expected arrival of the next data set. For the second part, the robustness of the mapping is the difference between the expected arrival time and the time at which the revenue earned is equal to the operating cost. Thus, the heuristics for the second part find a mapping that minimizes the time for the revenue (gained by completing revenue generating tasks) to be equal to the cost. Different resource allocation heuristics are designed and evaluated using simulations, and their performance is compared to a mathematical bound."",""1558-2183"","""",""10.1109/TPDS.2011.44"","""",""https://ieeexplore.ieee.org/stamp/stamp.jsp?arnumber=5703084"",""Heterogeneous computing";satellite system;robustness;makespan;revenue;"and two-part resource allocation."",""Robustness";Resource management;Satellites;Data processing;Biological cells;Meteorology;"Uncertainty"","""",""20"","""",""32"",""IEEE"",""28 Jan 2011"","""","""",""IEEE"",""IEEE Journals""";;;;;;;;
"hiCUDA: High-Level GPGPU Programming,""T. D. Han";" T. S. Abdelrahman"",""Edward S. Rogers Sr. Department of Electrical and Computer Engineering, University of Toronto, Toronto, ONT, Canada";" Edward S. Rogers Sr. Department of Electrical and Computer Engineering, University of Toronto, Toronto, ONT, Canada"",""IEEE Transactions on Parallel and Distributed Systems"",""29 Nov 2010"",""2011"",""22"",""1"",""78"",""90"",""Graphics Processing Units (GPUs) have become a competitive accelerator for applications outside the graphics domain, mainly driven by the improvements in GPU programmability. Although the Compute Unified Device Architecture (CUDA) is a simple C-like interface for programming NVIDIA GPUs, porting applications to CUDA remains a challenge to average programmers. In particular, CUDA places on the programmer the burden of packaging GPU code in separate functions, of explicitly managing data transfer between the host and GPU memories, and of manually optimizing the utilization of the GPU memory. Practical experience shows that the programmer needs to make significant code changes, often tedious and error-prone, before getting an optimized program. We have designed hiCUDA}, a high-level directive-based language for CUDA programming. It allows programmers to perform these tedious tasks in a simpler manner and directly to the sequential code, thus speeding up the porting process. In this paper, we describe the hiCUDA} directives as well as the design and implementation of a prototype compiler that translates a hiCUDA} program to a CUDA program. Our compiler is able to support real-world applications that span multiple procedures and use dynamically allocated arrays. Experiments using nine CUDA benchmarks show that the simplicity hiCUDA} provides comes at no expense to performance."",""1558-2183"","""",""10.1109/TPDS.2010.62"","""",""https://ieeexplore.ieee.org/stamp/stamp.jsp?arnumber=5445082"",""CUDA";GPGPU;data-parallel programming;directive-based language;"source-to-source compiler."",""Programming profession";Memory management;Computer architecture;Program processors;Packaging;Prototypes;Computer graphics;Computer interfaces;Application software;"Pipelines"","""",""151"",""2"",""25"",""IEEE"",""8 Apr 2010"","""","""",""IEEE"",""IEEE Journals""";;;;;;;;;;;;;;;;;;
"Hybrid Core Acceleration of UWB SIRE Radar Signal Processing,""S. J. Park"; J. Ross; D. Shires; D. Richie; B. Henz;" L. Nguyen"",""US Army Research Laboratory, MD, USA"; High Performance Technologies, Inc., MD, USA; US Army Research Laboratory, MD, USA; Brown Deer Technology, Forest Hill, MD, USA; US Army Research Laboratory, MD, USA;" US Army Research Laboratory, MD, USA"",""IEEE Transactions on Parallel and Distributed Systems"",""29 Nov 2010"",""2011"",""22"",""1"",""46"",""57"",""To move High-Performance Computing (HPC) closer to forward operating environments and missions, the Army Research Laboratory is developing approaches using hybrid, asymmetric core computing. By blending capabilities found in Graphics Processing Units (GPUs) and traditional von Neumann multicore Central Processing Units (CPUs), approaches are being developed and optimized to provide at or near real-time processing speeds for research project applications. Algorithms are designed to partition work to resources best designed to handle the processing load. The use of commodity resources allows the design to be flexible throughout the life cycle without the costly and time-consuming delays associated with Application-Specific Integrated Circuit (ASIC) development. This paradigm allows for rapid technology transfer to end users. In this paper, we describe a synchronous impulse reconstruction radar imaging algorithm that has been designed for hybrid CPU-GPU processing. We discuss various optimizations such as asynchronous task partitioning between the CPU and GPU as well as data movement reduction. We also discuss analysis and design of the algorithms within the context of two programming models: NVIDIA's CUDA and AMD's ATI Brook+. Finally, we report on the speedup achieved by this approach that allowed us to take a code once restricted to postprocessing and transform it into one that exceeds real-time performance requirements."",""1558-2183"","""",""10.1109/TPDS.2010.117"","""",""https://ieeexplore.ieee.org/stamp/stamp.jsp?arnumber=5477419"",""Heterogeneous (hybrid) systems";emerging technologies;signal processing systems;"computers in other systems—military."",""Acceleration";Radar signal processing;Algorithm design and analysis;Partitioning algorithms;Signal processing algorithms;High performance computing;Central Processing Unit;Application specific integrated circuits;Military computing;"Graphics"","""",""15"","""",""22"",""IEEE"",""3 Jun 2010"","""","""",""IEEE"",""IEEE Journals""";;;;;;;;;;;
"Impact of Traffic Influxes: Revealing Exponential Intercontact Time in Urban VANETs,""H. Zhu"; M. Li; L. Fu; G. Xue; Y. Zhu;" L. M. Ni"",""Department of Computer Science and Engineering, Shanghai Jiaotong University, Shanghai, China"; Department of Computer Science and Engineering, Shanghai Jiaotong University, Shanghai, China; Department of Electronic Engineering, Shanghai Jiaotong University, Shanghai, China; Department of Computer Science and Engineering, Shanghai Jiaotong University, Shanghai, China; Department of Computer Science and Engineering, Shanghai Jiaotong University, Shanghai, China;" Department of Computer Science and Engineering, Hong Kong University of Science and Technology, Hong Kong, China"",""IEEE Transactions on Parallel and Distributed Systems"",""23 Jun 2011"",""2011"",""22"",""8"",""1258"",""1266"",""Intercontact time between moving vehicles is one of the key metrics in vehicular ad hoc networks (VANETs) and central to forwarding algorithms and the end-to-end delay. Due to prohibitive costs, little work has conducted experimental study on intercontact time in urban vehicular environments. In this paper, we carry out an extensive experiment involving thousands of operational taxies in Shanghai city. Studying the taxi trace data on the frequency and duration of transfer opportunities between taxies, we observe that the tail distribution of the intercontact time, that is, the time gap separating two contacts of the same pair of taxies, exhibits an exponential decay, over a large range of timescale. This observation is in sharp contrast to recent empirical data studies based on human mobility, in which the distribution of the intercontact time obeys a power law. By analyzing a simplified mobility model that captures the effect of hot areas in the city, we rigorously prove that common traffic influxes, where large volume of traffic converges, play a major role in generating the exponential tail of the intercontact time. Our results thus provide fundamental guidelines on design of new vehicular mobility models in urban scenarios, new data forwarding protocols and their performance analysis."",""1558-2183"","""",""10.1109/TPDS.2010.176"","""",""https://ieeexplore.ieee.org/stamp/stamp.jsp?arnumber=5601713"",""Vehicular ad hoc networks";intercontact time;exponential tail;mobility model;traffic influx;"empirical data analysis."",""Vehicle ad hoc networks";Urban areas;Global Positioning System;Analytical models;Data analysis;"Roads"","""",""83"","""",""20"",""IEEE"",""14 Oct 2010"","""","""",""IEEE"",""IEEE Journals""";;;;;;;;;;;;;
"Improving Authentication Performance of Distributed SIP Proxies,""I. Dacosta"; V. Balasubramaniyan; M. Ahamad;" P. Traynor"",""Converging Infrastructure Security (CISEC) Laboratory, Georgia Institute of Technology, Atlanta, GA"; Converging Infrastructure Security (CISEC) Laboratory, Georgia Institute of Technology, Atlanta, GA; Converging Infrastructure Security (CISEC) Laboratory, Georgia Institute of Technology, Atlanta, GA;" Converging Infrastructure Security (CISEC) Laboratory, Georgia Institute of Technology, Atlanta, GA"",""IEEE Transactions on Parallel and Distributed Systems"",""26 Sep 2011"",""2011"",""22"",""11"",""1804"",""1812"",""The performance of SIP proxies is critical for the robust operation of many applications. However, the use of even light-weight authentication schemes can significantly degrade throughput in these systems. In particular, systems in which multiple proxies share a remote authentication database can experience reduced performance due to latency. In this paper, we investigate how the application of parallel execution and batching can be used to maximize throughput while carefully balancing demands for bandwidth and call failure rates. Through the use of a modified version of OpenSER, a high-performance SIP proxy, we demonstrate that the traditional recommendation of simply launching a large number of parallel processes not only incurs substantial overhead and increases dropped calls, but can actually decrease call throughput. An alternative technique that we implement, request batching, similarly fails to achieve high proxy throughput. Through a carefully selected mix of batching and parallelization, we reduce the bandwidth required to maximize authenticated signaling throughput by the proxy by more than 75 percent. This mix also keeps the call loss rates below 1 percent at peak performance. In addition, we demonstrate that the delay introduced by batching is acceptable for VoIP applications. As a result, our technique significantly reduce the cost and increase the throughput of authentication for large-scale networks supporting SIP applications."",""1558-2183"","""",""10.1109/TPDS.2011.62"","""",""https://ieeexplore.ieee.org/stamp/stamp.jsp?arnumber=5710899"",""SIP";VoIP;digest authentication;"SIP proxy performance."",""Authentication";Throughput;Databases;Bandwidth;Servers;Delay;"Scalability"","""",""1"","""",""26"",""IEEE"",""10 Feb 2011"","""","""",""IEEE"",""IEEE Journals""";;;;;;;;;;;;;;;;;;
