"2002 reviewers list,"""",,""IEEE Transactions on Parallel and Distributed Systems"",""29 Jan 2003"",""2003"",""14"",""1"",""94"",""96"",""The publication offers a note of thanks and lists its reviewers."",""1558-2183"","""",""10.1109/TPDS.2003.1167374"","""",""https://ieeexplore.ieee.org/stamp/stamp.jsp?arnumber=1167374"","""",""IEEE"","""","""","""","""",""IEEE"",""29 Jan 2003"","""","""",""IEEE"",""IEEE Journals""";;;;;;;;;;;;;;;;;;;;;;;;;;;;;;;;;;;;;
"An O(1) time algorithm for the 3D Euclidean distance transform on the CRCW PRAM model,""Yuh-Rau Wang";" Shi-Jinn Horng"",""Department of Computer Science and Information Engineering, SI. John''s and St. Mary''s Institute of Technology, Taipei, Taiwan";" Department of Electrical Engineering, National Taiwan University of Science and Technology, Taipei, Taiwan"",""IEEE Transactions on Parallel and Distributed Systems"",""27 Oct 2003"",""2003"",""14"",""10"",""973"",""982"",""We develop a parallel algorithm for the 2D Euclidean distance transform (2D/spl I.bar/EDT, for short) of a binary image of size N /spl times/ N in O(1) time using N/sup 2+/spl delta/+/spl epsi// CRCW processors and a parallel algorithm for the 3D Euclidean distance transform (3D/spl I.bar/EDT, for short) of a binary image of size N /spl times/ N /spl times/ N in O(1) time using N/sup 3+/spl delta/+/spl epsi// CRCW processors, where /spl delta/=1/, /spl epsi/=1/(2/sup c+1/-1), h, and are constants and positive integers. Our 2D/spl I.bar/EDT (3D/spl I.bar/EDT) parallel algorithm can be used to build up Voronoi diagram and Voronoi polygons (polyhedra) in a 2D (3D) binary image also. All of these parallel algorithms can be performed in O(1) time using N/sup 2+/spl delta/+/spl epsi// (N/sup 3+/spl delta/+/spl epsi//) CRCW processors. To the best of our knowledge, all results derived above are the best O(1) time algorithms known."",""1558-2183"","""",""10.1109/TPDS.2003.1239866"","""",""https://ieeexplore.ieee.org/stamp/stamp.jsp?arnumber=1239866"","""",""Euclidean distance";Phase change random access memory;Parallel algorithms;Concurrent computing;Image processing;Digital images;Pixel;Computer vision;Data mining;"Image converters"","""",""13"","""",""33"",""IEEE"",""27 Oct 2003"","""","""",""IEEE"",""IEEE Journals""";;;;;;;;;;;;;;;;;;;;;;;;;;
"Analysis on a mobile agent-based algorithm for network routing and management,""J. Sum"; Hong Shen; Chi-sing Leung;" G. Young"",""Department of Computing, Hong Kong Polytechnic University, Hung Hom, China"; Japan Advanced Institute of Science and Technology, Graduate School of Information Science, Tatsunokuchi, Ishikawa, Japan; Department of Electronic Engineering, City University of Hong Kong, Kowloon, Hong Kong, China;" Department of Computer Science, California Poly Pomona, CA, USA"",""IEEE Transactions on Parallel and Distributed Systems"",""26 Mar 2003"",""2003"",""14"",""3"",""193"",""202"",""Ant routing is a method for network routing in agent technology. Although its effectiveness and efficiency have been demonstrated and reported in the literature, its properties have not yet been well studied. This paper presents some preliminary analysis on an ant algorithm in regard to its population growing property and jumping behavior. Results conclude that as long as the value max, {i/spl Omega//sub j/|} is known, the practitioner is able to design the algorithm parameters, such as the number of agents being created for each request, k, and the maximum allowable number of jumps of an agent, in order to meet the network constraint."",""1558-2183"","""",""10.1109/TPDS.2003.1189578"","""",""https://ieeexplore.ieee.org/stamp/stamp.jsp?arnumber=1189578"","""",""Algorithm design and analysis";Routing;Mobile agents;Network servers;Technology management;Telecommunication traffic;Computer network management;Intelligent agent;Mobile communication;"Mobile computing"","""",""15"","""",""34"",""IEEE"",""26 Mar 2003"","""","""",""IEEE"",""IEEE Journals""";;;;;;;;;;;;;;;;;;;;;;
"Analytic evaluation of shared-memory architectures,""D. J. Sorin"; J. L. Lemon; D. L. Eager;" M. K. Vernon"",""Department of Electrical and Computer Engineering, Duke University, Durham, NC, USA"; NA; University of Saskatchewan, Saskatoon, SAS, Canada;" NA"",""IEEE Transactions on Parallel and Distributed Systems"",""19 Feb 2003"",""2003"",""14"",""2"",""166"",""180"",""This paper develops and validates an efficient analytical model for evaluating the performance of shared memory architectures with ILP processors. First, we instrument the SimOS simulator to measure the parameters for such a model and we find a surprisingly high degree of processor memory request heterogeneity in the workloads. Examining the model parameters provides insight into application behaviors and how they interact with the system. Second, we create a model that captures such heterogeneous processor behavior, which is important for analyzing memory system design tradeoffs. Highly bursty memory request traffic and lock contention are also modeled in a significantly more robust way than in previous work. With these features, the model is applicable to a wide range of architectures and applications. Although the features increase the model complexity, it is a useful design tool because the size of the model input parameter set remains manageable, and the model is still several orders of magnitude quicker to solve than detailed simulation. Validation results show that the model is highly accurate, producing heterogeneous per processor throughputs that are generally within 5 percent and, for the workloads validated, always within 13 percent of the values measured by detailed simulation with SimOS. Several examples illustrate applications of the model to studying architectural design issues and the interactions between the architecture and the application workloads."",""1558-2183"","""",""10.1109/TPDS.2003.1178880"","""",""https://ieeexplore.ieee.org/stamp/stamp.jsp?arnumber=1178880"","""",""Memory architecture";Analytical models;Computer architecture;Computational modeling;Throughput;Computer Society;Instruments;Traffic control;Robustness;"Performance analysis"","""",""6"","""",""23"",""IEEE"",""19 Feb 2003"","""","""",""IEEE"",""IEEE Journals""";;;;;;;;;;;;;;;;;;;;;;
"Author index,"""",,""IEEE Transactions on Parallel and Distributed Systems"",""7 Jan 2004"",""2003"",""14"",""12"",""1286"",""1289"",""This index covers all technical items - papers, correspondence, reviews, etc. - that appeared in this periodical during the year, and items from previous years that were commented upon or corrected in this year. Departments and other items may also be covered if they have been judged to have archival value. The Author Index contains the primary entry for each item, listed under the first author's name. The primary entry includes the coauthors' names, the title of the paper or other item, and its location, specified by the publication abbreviation, year, month, and inclusive pagination. The Subject Index contains entries describing the item under all appropriate subject headings, plus the first author's name, the publication abbreviation, month, and year, and inclusive pages. Note that the item title is found only under he primary entry in the Author Index."",""1558-2183"","""",""10.1109/TPDS.2003.1255640"","""",""https://ieeexplore.ieee.org/stamp/stamp.jsp?arnumber=1255640"","""","""","""","""","""","""",""IEEE"",""7 Jan 2004"","""","""",""IEEE"",""IEEE Journals""";;;;;;;;;;;;;;;;;;;;;;;;;;;;;;;;;;;;;
"Channel assignment with separation for interference avoidance in wireless networks,""A. A. Bertossi"; C. M. Pinotti;" R. B. Tan"",""Dept. of Comput. Sci., Bologna Univ., Italy"; NA;" NA"",""IEEE Transactions on Parallel and Distributed Systems"",""26 Mar 2003"",""2003"",""14"",""3"",""222"",""235"",""Given an integer /spl sigma/>1, a vector (/spl delta//sub 1/, /spl delta//sub 2/,..., /spl delta//sub /spl sigma/-1/), of nonnegative integers, and an undirected graph G=(V, E), an L(/spl delta//sub 1/, /spl delta//sub 2/,..., /spl delta//sub /spl sigma/-1/)-coloring of G is a function f from the vertex set V to a set of nonnegative integers, such that |f(u)-f(v)|/spl ges//spl delta//sub i/, if d(u,v)=i, for 1<i<(/spl sigma/-1), where d(u, v) is the distance (i.e., the minimum number of edges) between the vertices u and v. An optimal L(/spl delta//sub 1/, /spl delta//sub 2/,..., /spl delta//sub /spl sigma/-1/)-coloring for G is one using the smallest range /spl lambda/ of integers over all such colorings. This problem has relevant application in channel assignment for interference avoidance in wireless networks, where channels (i.e., colors) assigned to interfering stations (i.e., vertices) at distance i must be at least /spl delta//sub i/ apart, while the same channel can be reused in vertices whose distance is at least /spl sigma/. In particular, two versions of the coloring problem - L(2, 1, 1) and L(/spl delta//sub 1/, 1,..., 1) - are considered. Since these versions of the problem are NP-hard for general graphs, efficient algorithms for finding optimal colorings are provided for specific graphs modeling realistic wireless networks, including rings, bidimensional grids, and cellular grids."",""1558-2183"","""",""10.1109/TPDS.2003.1189581"","""",""https://ieeexplore.ieee.org/stamp/stamp.jsp?arnumber=1189581"","""",""Interference";Intelligent networks;Wireless networks;Frequency;Cellular networks;Costs;Partitioning algorithms;Computer Society;"Wireless communication"","""",""47"","""",""20"",""IEEE"",""26 Mar 2003"","""","""",""IEEE"",""IEEE Journals""";;;;;;;;;;;;;;;;;;;;;;;;;
"Clustering support and replication management for scalable network services,""K. Shen"; T. Yang;" L. Chu"",""Department of Computer Science, University of Rochester, NY, USA"; Department of Computer Science, University of California, Santa Barbara, CA, USA;" Department of Computer Science, University of California, Santa Barbara, CA, USA"",""IEEE Transactions on Parallel and Distributed Systems"",""24 Nov 2003"",""2003"",""14"",""11"",""1168"",""1179"",""The ubiquity of the Internet and various intranets has brought about widespread availability of online services and applications accessible through the network. Cluster-based network services have been rapidly emerging due to their cost-effectiveness in achieving high availability and incremental scalability. We present the design and implementation of the Neptune middleware system that provides clustering support and replication management for scalable network services. Neptune employs a loosely connected and functionally symmetric clustering architecture to achieve high scalability and robustness. It shields the clustering complexities from application developers through simple programming interfaces. In addition, Neptune provides replication management with flexible replication consistency support at the clustering middleware level. Such support can be easily applied to a large number of applications with different underlying data management mechanisms or service semantics. The system has been implemented on Linux and Solaris clusters, where a number of applications have been successfully deployed. Our evaluations demonstrate the system performance and smooth failure recovery achieved by proposed techniques."",""1558-2183"","""",""10.1109/TPDS.2003.1247676"","""",""https://ieeexplore.ieee.org/stamp/stamp.jsp?arnumber=1247676"","""",""Availability";Middleware;Scalability;Large-scale systems;Robustness;Load management;IP networks;Web and internet services;Linux;"System performance"","""",""11"",""1"",""36"",""IEEE"",""24 Nov 2003"","""","""",""IEEE"",""IEEE Journals""";;;;;;;;;;;;;;;;;;;;;;;;
"Communication adaptive self-stabilizing group membership service,""S. Dolev";" E. Schiller"",""Department of Computer Science, Ben-Gurion University of the Negev, Beersheba, Israel";" Department of Computer Science, Ben-Gurion University of the Negev, Beersheba, Israel"",""IEEE Transactions on Parallel and Distributed Systems"",""22 Jul 2003"",""2003"",""14"",""7"",""709"",""720"",""This paper presents the first (randomized) algorithm for implementing self-stabilizing group communication services in an asynchronous system. Our algorithm converges rapidly to legal behavior and is communication adaptive, namely, the communication volume is high when the system recovers from the occurrence of faults and is low once a legal state is reached. Communication adaptability is achieved by a new technique that combines transient fault detectors."",""1558-2183"","""",""10.1109/TPDS.2003.1214322"","""",""https://ieeexplore.ieee.org/stamp/stamp.jsp?arnumber=1214322"","""",""Fault tolerant systems";Robustness;Law;Legal factors;Computer crashes;Intersymbol interference;Fault detection;Middleware;Communication networks;"Distributed computing"","""",""14"","""",""32"",""IEEE"",""22 Jul 2003"","""","""",""IEEE"",""IEEE Journals""";;;;;;;;;;;;;;;;;;;;;;;;;;
"Comparing latency-tolerance techniques for software DSM systems,""R. Pinto"; R. Bianchini;" C. L. Amorim"",""Universidade Estacio de Sa, Rio de Janeiro, Brazil"; Department of Computer Science, Rutgers University, Piscataway, NJ, USA;" Programa de Engenharia de Sistemas e Computacao, COPPE, Universidade Federal do Rio de Janeiro, Rio de Janeiro, Brazil"",""IEEE Transactions on Parallel and Distributed Systems"",""24 Nov 2003"",""2003"",""14"",""11"",""1180"",""1190"",""We study the isolated and combined effects of several latency-tolerance techniques for software-based distributed shared-memory systems (software DSMs). More specifically, we focus on data prefetching, update-based coherence, and single-writer optimizations for page-based software DSMs. Our experimental results with six parallel applications show that, when these techniques are carefully combined, they can provide running time and speedup improvements of up to 54 percent and 110 percent, respectively, on a cluster of eight PCs."",""1558-2183"","""",""10.1109/TPDS.2003.1247677"","""",""https://ieeexplore.ieee.org/stamp/stamp.jsp?arnumber=1247677"","""",""Software systems";Prefetching;Hardware;Delay;Access protocols;Application software;System software;Computer Society;Personal communication networks;"Parallel programming"","""",""5"","""",""23"",""IEEE"",""24 Nov 2003"","""","""",""IEEE"",""IEEE Journals""";;;;;;;;;;;;;;;;;;;;;;;;
"Compiler techniques for the distribution of data and computation,""A. Navarro"; E. Zapata;" D. Padua"",""Department of Computer Architecture, Complejo Tecnológico, University of Màlaga, Malaga, Spain"; Department of Computer Architecture, Complejo Tecnológico, University of Màlaga, Malaga, Spain;" Department of Computer Science, 3318 Digital Computer Laboratory, University of Illinois, Urbana-Champaign, Urbana-Champaign, IL, USA"",""IEEE Transactions on Parallel and Distributed Systems"",""20 Jun 2003"",""2003"",""14"",""6"",""545"",""562"",""This paper presents a new method that can be applied by a parallelizing compiler to find, without user intervention, the iteration and data decompositions that minimize communication and load imbalance overheads in parallel programs targeted at NUMA architectures. One of the key ingredients in our approach is the representation of locality as a locality-communication graph (ICG) and the formulation of the compiler technique as a mixed integer nonlinear programming (MINLP) optimization problem on this graph. The objective function and constraints of the optimization problem model communication costs and load imbalance. The solution to this optimization problem is a decomposition that minimizes the parallel execution overhead. This paper summarizes the process of how the compiler extracts the locality information from a nonannotated code and focuses on how this compiler can derive the optimization problem, solve it, and generate the parallel code with the automatically selected iteration and data distributions. In addition, we include a discussion about our model and the solutions - the decompositions - that it provides. The approach presented in the paper is evaluated using several benchmarks. The experimental results demonstrate that the MINLP formulation does not increase compilation time significantly and that our framework generates very efficient iteration/data distributions for a variety of NUMA machines."",""1558-2183"","""",""10.1109/TPDS.2003.1206503"","""",""https://ieeexplore.ieee.org/stamp/stamp.jsp?arnumber=1206503"","""",""Distributed computing";Operating systems;Program processors;Optimizing compilers;Control systems;Concurrent computing;Computer architecture;Constraint optimization;Cost function;"Data mining"","""",""14"","""",""26"",""IEEE"",""20 Jun 2003"","""","""",""IEEE"",""IEEE Journals""";;;;;;;;;;;;;;;;;;;;;;;;
"Constructing edge-disjoint spanning trees in product networks,""Shan-Chyun Ku"; Biing-Feng Wang;" Ting-Kai Hung"",""Department of Computer Science, National Tsing Hua University, Hsinchu, Taiwan"; Department of Computer Science, National Tsing Hua University, Hsinchu, Taiwan;" Department of Computer Science, National Tsing Hua University, Hsinchu, Taiwan"",""IEEE Transactions on Parallel and Distributed Systems"",""26 Mar 2003"",""2003"",""14"",""3"",""213"",""221"",""A Cartesian product network is obtained by applying the cross operation on two graphs. We study the problem of constructing the maximum number of edge-disjoint spanning trees (abbreviated to EDSTs) in Cartesian product networks. Let G=(V/sub G/, E/sub G/) be a graph having n/sub 1/ EDSTs and F=(V/sub F/, E/sub F/) be a graph having n/sub 2/ EDSTs. Two methods are proposed for constructing EDSTs in the Cartesian product of G and F, denoted by G/spl times/F. The graph G has t/sub 1/=|E/sub G/|/spl middot/n/sub 1/(|V/sub G/|-1) more edges than that are necessary for constructing n/sub 1/ EDSTs in it, and the graph F has t2=|E/sub F/'-n/sub 2/(|V/sub F/|-1) more edges than that are necessary for constructing n/sub 2/ EDSTs in it. By assuming that t/sub 1//spl ges/n/sub 1/ and t/sub 2//spl ges/n/sub 2/, our first construction shows that n/sub 1/+n/sub 2/ EDSTS can be constructed in G/spl times/F. Our second construction does not need any assumption and it constructs n/sub 1/+n/sub 2/-1 EDSTs in G/spl times/F. By applying the proposed methods, it is easy to construct the maximum numbers of EDSTs in many important Cartesian product networks, such as hypercubes, tori, generalized hypercubes, mesh connected trees, and hyper Petersen networks."",""1558-2183"","""",""10.1109/TPDS.2003.1189580"","""",""https://ieeexplore.ieee.org/stamp/stamp.jsp?arnumber=1189580"","""",""Intelligent networks";Tree graphs;Hypercubes;Multiprocessor interconnection networks;Computer Society;Fault tolerance;Broadcasting;Application software;Concurrent computing;"Distributed computing"","""",""34"","""",""21"",""IEEE"",""26 Mar 2003"","""","""",""IEEE"",""IEEE Journals""";;;;;;;;;;;;;;;;;;;;;;;;
"Correlation prefetching with a user-level memory thread,""Y. Solihin"; J. Lee;" J. Torrellas"",""Department of Electrical and Computer Engineering, North Carolina State University, NC, USA"; School of Computer Science and Engineering, Seoul National University, Seoul, South Korea;" Department of Computer Science, University of Illinois, Urbana-Champaign, Urbana-Champaign, IL, USA"",""IEEE Transactions on Parallel and Distributed Systems"",""20 Jun 2003"",""2003"",""14"",""6"",""563"",""580"",""This paper proposes using a user-level memory thread (ULMT) for correlation prefetching. In this approach, a user thread runs on a general-purpose processor in main memory, either in the memory controller chip or in a DRAM chip. The thread performs correlation prefetching in software, sending the prefetched data into the L2 cache of the main processor. This approach requires minimal hardware beyond the memory processor: The correlation table is a software data structure that resides in main memory, while the main processor only needs a few modifications to its L2 cache so that it can accept incoming prefetches. In addition, the approach has wide applicability, as it can effectively prefetch even for irregular applications. Finally, it is very flexible, as the prefetching algorithm can be customized by the user on an application basis. Our simulation results show that, through a new design of the correlation table and prefetching algorithm, our scheme delivers good results. Specifically, nine mostly-irregular applications show an average speedup of 1.32. Furthermore, our scheme works well in combination with a conventional processor-side sequential prefetcher, in which case the average speedup increases to 1.46. Finally, by exploiting the customization of the prefetching algorithm, we increase the average speedup to 1.53."",""1558-2183"","""",""10.1109/TPDS.2003.1206504"","""",""https://ieeexplore.ieee.org/stamp/stamp.jsp?arnumber=1206504"","""",""Prefetching";Engines;Hardware;Data structures;Graphics;Proposals;Software performance;Application software;"Algorithm design and analysis"","""",""14"","""",""36"",""IEEE"",""20 Jun 2003"","""","""",""IEEE"",""IEEE Journals""";;;;;;;;;;;;;;;;;;;;;;;;;
"Deadlock-free dynamic reconfiguration schemes for increased network dependability,""T. M. Pinkston"; R. Pang;" J. Duato"",""SMART Interconnects Group, EE-Systems Department, University of Southern California, Los Angeles, CA, USA"; Computer Science Department, Princeton University, Princeton, NJ, USA;" Grupo Arquitectural Paralelas (GAP), Facultad de Informatica, Universidad Politecnica de Valencia, Valencia, Spain"",""IEEE Transactions on Parallel and Distributed Systems"",""26 Aug 2003"",""2003"",""14"",""8"",""780"",""794"",""Network-based parallel computing systems often require the ability to reconfigure the routing algorithm to reflect changes in network topology if and when voluntary or involuntary changes occur. The process of reconfiguring a network's routing capabilities may be very inefficient and/or deadlock-prone if not handled properly. We propose efficient and deadlock-free dynamic reconfiguration schemes that are applicable to routing algorithms and networks which use wormhole, virtual cut-through, or store-and-forward switching, combined with hard link-level flow control. One requirement is that the network architecture use virtual channels or duplicate physical channels for deadlock-handling as well as performance purposes. The proposed schemes do not impede the injection, transmission, or delivery of user packets during the reconfiguration process. Instead, they provide uninterrupted service, increased availability/reliability, and improved overall quality-of-service support as compared to traditional techniques based on static reconfiguration."",""1558-2183"","""",""10.1109/TPDS.2003.1225057"","""",""https://ieeexplore.ieee.org/stamp/stamp.jsp?arnumber=1225057"","""",""System recovery";Routing;Availability;Parallel processing;Telecommunication network reliability;Control systems;Multiprocessor interconnection networks;Switches;Network topology;"Impedance"","""",""52"",""1"",""30"",""IEEE"",""26 Aug 2003"","""","""",""IEEE"",""IEEE Journals""";;;;;;;;;;;;;;;;;;;;;;;;
"Distributed initialization algorithms for single-hop ad hoc networks with minislotted carrier sensing,""Zhijun Cai"; Mi Lu;" Xiaodong Wang"",""Motorola Research Laboratories, Fort Worth, TX, USA"; Electrical Engineering Department, Texas A and M University, College Station, TX, USA;" Electrical Engineering Department, Columbia University, New York, NY, USA"",""IEEE Transactions on Parallel and Distributed Systems"",""21 May 2003"",""2003"",""14"",""5"",""516"",""528"",""An ad hoc network is a self-organized and distributed entity, consisting of n mobile stations (MSs) without the coordination of any centralized access point. Initialization is one of the fundamental tasks to set up an ad hoc network, which involves assigning each of the n MSs a distinct ID number from 1 to n, distributedly. In Nakano et al. (2000), randomized initialization protocols are developed for single-hop ad hoc networks under different conditions. However, carrier sensing has not been utilized and suitable acknowledgment schemes for the algorithms are not developed. Moreover, the assumption taken by Nakano et al. about MSs being able to listen while transmitting is not valid for ad hoc networks. In this context, we describe two algorithms for initializing an ad hoc network with carrier sensing capability. First, a novel acknowledgment scheme is proposed for notifying a transmitting MS whether its transmission is successful during the initialization. Then, two distributed and randomized initialization algorithms are developed and analyzed, under the assumptions of a known and unknown number of users in the network, respectively. Both algorithms are obtained based on optimizing some key parameters to minimize the total time required to complete the initialization. Both theoretical analysis and simulations indicate that the proposed initialization algorithms outperform the existing methods, in the sense that they take much less time to complete the initialization and the average number of transmission attempts before success is much smaller."",""1558-2183"","""",""10.1109/TPDS.2003.1199068"","""",""https://ieeexplore.ieee.org/stamp/stamp.jsp?arnumber=1199068"","""",""Ad hoc networks";Access protocols;Algorithm design and analysis;Analytical models;Network topology;Centralized control;Communication system control;Wireless communication;Media Access Protocol;"Routing"","""",""17"","""",""19"",""IEEE"",""21 May 2003"","""","""",""IEEE"",""IEEE Journals""";;;;;;;;;;;;;;;;;;;;;;;;
