"2002 reviewers list,"""",,""IEEE Transactions on Parallel and Distributed Systems"",""29 Jan 2003"",""2003"",""14"",""1"",""94"",""96"",""The publication offers a note of thanks and lists its reviewers."",""1558-2183"","""",""10.1109/TPDS.2003.1167374"","""",""https://ieeexplore.ieee.org/stamp/stamp.jsp?arnumber=1167374"","""",""IEEE"","""","""","""","""",""IEEE"",""29 Jan 2003"","""","""",""IEEE"",""IEEE Journals""";;;;;;;;;;;;;;;;;;;;;;;;;;;;;;;;;;;;;
"Out-of-core divisible load processing,""M. Drozdowski";" P. Wolniewicz"",""Institute of Computing Science, Poznań University of Technology, Poznan, Poland";" Poznań Supercomputing and Networking Center, Poznan, Poland"",""IEEE Transactions on Parallel and Distributed Systems"",""27 Oct 2003"",""2003"",""14"",""10"",""1048"",""1056"",""In this paper, we analyze processing divisible loads in systems with a memory hierarchy. Divisible loads are computations that can be divided into parts of arbitrary sizes and these parts can be independently processed in a distributed system. The problem is to partition the load so that the total processing time, including communications and computations, is the shortest possible. Earlier works in the divisible load theory assumed distributed systems with a flat memory model. The dependence of the processing time on the size of the assigned load was assumed to be linear. A new mathematical model relaxing the above two assumptions is proposed in this article. We study distributed systems-which have both the hierarchical memory model and a piecewise linear dependence of the processing time on the size of the assigned load. Performance of such systems is modeled and evaluated. Finally, we compare the efficiency of distributed processing divisible loads in multiinstallment and out-of-core modes. Multiinstallment processing consists in sending multiple small chunks of the load to processors instead of a single chunk which needs external memory. It turns out that multiinstallment is an advantageous strategy for reasonably selected load chunks sizes."",""1558-2183"","""",""10.1109/TPDS.2003.1239872"","""",""https://ieeexplore.ieee.org/stamp/stamp.jsp?arnumber=1239872"","""",""Distributed computing";Delay;Load modeling;Topology;Computer Society;Mathematical model;Piecewise linear techniques;Distributed processing;"Processor scheduling"","""",""32"","""",""23"",""IEEE"",""27 Oct 2003"","""","""",""IEEE"",""IEEE Journals""";;;;;;;;;;;;;;;;;;;;;;;;;;;
"Paired gang scheduling,""Y. Wiseman";" D. G. Feitelson"",""Computer Science Department, Bar-llan University, Ramat-Gan, Israel";" School of Computer Science and Engineering, Hebrew University, Jerusalem, Israel"",""IEEE Transactions on Parallel and Distributed Systems"",""20 Jun 2003"",""2003"",""14"",""6"",""581"",""592"",""Conventional gang scheduling has the disadvantage that when processes perform I/O or blocking communication, their processors remain idle because alternative processes cannot be run independently of their own gangs. To alleviate this problem, we suggest a slight relaxation of this rule: match gangs that make heavy use of the CPU with gangs that make light use of the CPU (presumably due to I/O or communication activity), and schedule such pairs together, allowing the local scheduler on each node to select either of the two processes at any instant. As I/O-intensive gangs make light use of the CPU, this only causes a minor degradation in the service to compute-bound jobs. This degradation is more than offset by the overall improvement in system performance due to the better utilization of the resources."",""1558-2183"","""",""10.1109/TPDS.2003.1206505"","""",""https://ieeexplore.ieee.org/stamp/stamp.jsp?arnumber=1206505"","""",""Processor scheduling";Degradation;System performance;Resource management;Out of order;"Delay"","""",""97"",""4"",""24"",""IEEE"",""20 Jun 2003"","""","""",""IEEE"",""IEEE Journals""";;;;;;;;;;;;;;;;;;;;;;;;;;;;;;
"Parallel computation of the Euclidean distance transform on a three-dimensional image array,""Yu-Hua Lee"; Shi-Jinn Horng;" J. Seltzer"",""Information and Communication Research Division, Chung-Shan Institute of Science and Technology, Tao-Yuan, Taiwan, Republic of China"; Department of Electrical Engineering, National Taiwan University of Science and Technology, Taipei, Taiwan, Republic of China;" NA"",""IEEE Transactions on Parallel and Distributed Systems"",""26 Mar 2003"",""2003"",""14"",""3"",""203"",""212"",""In a two- or three-dimensional image array, the computation of Euclidean distance transform (EDT) is an important task. With the increasing application of 3D voxel images, it is useful to consider the distance transform of a 3D digital image array. Because the EDT computation is a global operation, it is prohibitively time consuming when performing the EDT for image processing. In order to provide the efficient transform computations, parallelism is employed. We first derive several important geometry relations and properties among parallel planes. We then, develop a parallel algorithm for the three-dimensional Euclidean distance transform (3D-EDT) on the EREW PRAM computation model. The time complexity of our parallel algorithm is O(log/sup 2/ N) for an N/spl times/N/spl times/N image array and this is currently the best known result. A generalized parallel algorithm for the 3D-EDT is also proposed. We implement the proposed algorithms sequentially, the performance of which exceeds the existing algorithms (proposed by Yamada, 1984). Finally, we develop the corresponding parallel programs on both the emulated EREW PRAM model computer and the IBM SP2 to verify the speed-up properties of the proposed algorithms."",""1558-2183"","""",""10.1109/TPDS.2003.1189579"","""",""https://ieeexplore.ieee.org/stamp/stamp.jsp?arnumber=1189579"","""",""Concurrent computing";Euclidean distance;Pixel;Parallel algorithms;Image processing;Phase change random access memory;Image converters;Digital images;Parallel processing;"Geometry"","""",""19"",""1"",""38"",""IEEE"",""26 Mar 2003"","""","""",""IEEE"",""IEEE Journals""";;;;;;;;;;;;;;;;;;;;;;;;
"Parallel processing applied to the planning of hydrothermal systems,""E. L. da Silva";" E. C. Finardi"",""Laboratório de Planejamento de Sistemas de Energia Elétrica (Labplan), Programa de Pós-Graduação em Engenharia Elétrica (PPGEEL), Florianopolis, Santa Catarina, Brazil";" Laboratório de Planejamento de Sistemas de Energia Elétrica (Labplan), Programa de Pós-Graduação em Engenharia Elétrica (PPGEEL), Florianopolis, Santa Catarina, Brazil"",""IEEE Transactions on Parallel and Distributed Systems"",""26 Aug 2003"",""2003"",""14"",""8"",""721"",""729"",""The objective of the long-term operating planning problem is to determine the optimum strategy for the generation of electricity, aiming toward the minimization of total operating cost over the planning period. In a competitive electricity market, with the participation of a significant number of hydroplants, such as in Brazil, precision modelling for operating planning is required so that a better use of hydraulic resources can be obtained. We present a long-term operating planning model based on an individual power plant representation. In order to support the high computational burden, a suitable parallel processing algorithm is proposed."",""1558-2183"","""",""10.1109/TPDS.2003.1225052"","""",""https://ieeexplore.ieee.org/stamp/stamp.jsp?arnumber=1225052"","""",""Parallel processing";Process planning;Costs;Power system planning;Thermal loading;Power generation;Power generation economics;Capacity planning;Reservoirs;"Strategic planning"","""",""33"","""",""23"",""IEEE"",""26 Aug 2003"","""","""",""IEEE"",""IEEE Journals""";;;;;;;;;;;;;;;;;;;;;;;;;;
"Performance evaluation of a hierarchical cellular system with mobile velocity-based bidirectional call-overflow scheme,""Wenhao Shan"; Pingzhi Fan;" Yi Pan"",""Institute of Mobile Communications, Southwest Jiaotong University, Chengdu, China"; Institute of Mobile Communications, Southwest Jiaotong University, Chengdu, China;" Department of Computer Science, Georgia State University, Atlanta, GA, USA"",""IEEE Transactions on Parallel and Distributed Systems"",""29 Jan 2003"",""2003"",""14"",""1"",""72"",""83"",""With the increase of teletraffic demands in mobile cellular system, hierarchical cellular systems (HCSs) have been adopted extensively for more efficient channel utilization and better GoS (Grade of Services). A practical issue related to HCS is to design a scheme for controlling and allocating call traffic to different layers. There are several strategies to deal with this problem, such as no call-overflow scheme, unidirectional call-overflow scheme and bidirectional call-overflow scheme. The objective of this paper is to investigate a bidirectional call-overflow scheme, based on the velocity of the mobile making the calls. To ensure that hand off calls are given higher priorities, it is assumed that guard channels are assigned in both macrocells and microcells. In order to evaluate the performance of the new scheme and compare the performance of several related schemes, two now models based on a one-dimensional Markov process are developed and analytical results are derived. Theoretical analysis and numerical evaluation show that the proposed scheme outperforms others in terms of average hew call blocking and hand off failure probability of the system. In addition, when the teletraffic to the HCS reaches a certain grade, the GoS is insensitive to the maximum velocity and the velocity threshold which is used to assign calls to different layers in our scheme."",""1558-2183"","""",""10.1109/TPDS.2003.1167372"","""",""https://ieeexplore.ieee.org/stamp/stamp.jsp?arnumber=1167372"","""",""Microcell networks";Macrocell networks;Communication system security;Frequency;Markov processes;Land mobile radio cellular systems;Computer network management;Energy management;Power system management;"Satellite broadcasting"","""",""17"","""",""23"",""IEEE"",""29 Jan 2003"","""","""",""IEEE"",""IEEE Journals""";;;;;;;;;;;;;;;;;;;;;;;;
"Probabilistic reliable dissemination in large-scale systems,""A. . -M. Kermarrec"; L. Massoulie;" A. J. Ganesh"",""Microsoft Research Limited, Cambridge, UK"; Microsoft Research Limited, Cambridge, UK;" Microsoft Research Limited, Cambridge, UK"",""IEEE Transactions on Parallel and Distributed Systems"",""26 Mar 2003"",""2003"",""14"",""3"",""248"",""258"",""The growth of the Internet raises new challenges for the design of distributed systems and applications. In the context of group communication protocols, gossip-based schemes have attracted interest as they are scalable, easy to deploy, and resilient to network and process failures. However, traditional gossip-based protocols have two major drawbacks: 1) they rely on each peer having knowledge of the global membership"; and 2) being oblivious to the network topology, they can impose a high load on network links when applied to wide-area settings. In this paper, we provide a theoretical analysis of gossip-based protocols which relates their reliability to key system parameters (the system size, failure rates, and number of gossip targets). The results provide guidelines for the design of practical protocols. In particular, they show how reliability can be maintained while alleviating drawback by: 1) providing each peer with only a small subset of the total membership information and drawback;" and 2) organizing members into a hierarchical structure that reflects their proximity according to some network-related metric. We validate the analytical results by simulations and verify that the hierarchical gossip protocol considerably reduces the load on the network compared to the original, non-hierarchical protocol."",""1558-2183"","""",""10.1109/TPDS.2003.1189583"","""",""https://ieeexplore.ieee.org/stamp/stamp.jsp?arnumber=1189583"","""",""Large-scale systems";Protocols;Telecommunication network reliability;Internet;Context;Network topology;Failure analysis;Reliability theory;Guidelines;"Maintenance"","""",""230"",""3"",""27"",""IEEE"",""26 Mar 2003"","""","""",""IEEE"",""IEEE Journals""";;;;;;;;;;;;;;;;;;;;;;
"Processor allocation and task scheduling of matrix chain products on parallel systems,""H. Lee"; J. Kim; S. J. Hong;" S. Lee"",""AhnLab, Inc., Seoul, South Korea"; Department of Computer Science and Engineering, Pohang University of Science and Technology, Pohang, South Korea; Department of Computer Science and Engineering, Pohang University of Science and Technology, Pohang, South Korea;" Department of Electrical Engineering, Pohang University of Science and Technology, Pohang, South Korea"",""IEEE Transactions on Parallel and Distributed Systems"",""22 Apr 2003"",""2003"",""14"",""4"",""394"",""407"",""The problem of finding an optimal product sequence for sequential multiplication of a chain of matrices (the matrix chain ordering problem, MCOP) is well-known. We consider the problem of finding an optimal product schedule for evaluating a chain of matrix products on a parallel computer (the matrix chain scheduling problem, MCSP). The difference between MCSP and MCOP is that MCOP pertains to a product sequence for single processor systems and MCSP pertains to a sequence of concurrent matrix products for parallel systems. The approach of parallelizing each matrix product after finding an optimal product sequence for single processor systems does not always guarantee minimum evaluation time on parallel systems since each parallelized matrix product may use processors inefficiently. We introduce a new processor scheduling algorithm for MCSP which reduces the evaluation time of a chain of matrix products on a parallel computer, even at the expense of a slight increase in the total number of operations. Given a chain of n matrices and a matrix product utilizing at most P/k processors in a P-processor system, the proposed algorithm approaches k(n-1)/(n+klog(k)-k) times the performance of parallel evaluation using the optimal sequence found for MCOP. Experiments performed on a Fujitsu AP1000 multicomputer also show that the proposed algorithm significantly decreases the time required to evaluate a chain of matrix products in parallel systems."",""1558-2183"","""",""10.1109/TPDS.2003.1195411"","""",""https://ieeexplore.ieee.org/stamp/stamp.jsp?arnumber=1195411"","""",""Processor scheduling";Concurrent computing;Parallel algorithms;Scheduling algorithm;Performance evaluation;Scientific computing;Kernel;Dynamic programming;Approximation algorithms;"Phase change random access memory"","""",""18"","""",""33"",""IEEE"",""22 Apr 2003"","""","""",""IEEE"",""IEEE Journals""";;;;;;;;;;;;;;;;;;;;;;
"Processor allocation in mesh multiprocessors using the leapfrog method,""Fan Wu"; Ching-Chi Hsu;" Li-Ping Chou"",""Department of Management of Information System, National Chung Cheng University, Chiayi, Taiwan"; Department of Computer Science and Information Engineering, Yuan-Ze University, Taoyuan, Taiwan;" Department of Computer Science and Information Engineering, National Taiwan University, Taipei, Taiwan"",""IEEE Transactions on Parallel and Distributed Systems"",""26 Mar 2003"",""2003"",""14"",""3"",""276"",""289"",""The mesh-connected multiprocessor has become popular because of its simple and regular structure. A new data structure, the R-array, is proposed to represent the mesh at first. The element in the R-array stores statistical information about occupied conditions of the mesh. Statistical information of the R-array can direct the allocation process to jump to the processes that can serve as a base of a free submesh. Based on a simple and reasonable assumption, we develop a stochastic process to analyze behaviors of the proposed scheme. The proposed scheme is the first whose probabilities of locating free submeshes under different workloads are precisely computed. These results can be applied to each full-recognition scheme. In addition, the execution costs of the proposed scheme can also be accurately calculated. Finally, simulations are performed which show that the proposed schemes are faster than most."",""1558-2183"","""",""10.1109/TPDS.2003.1189585"","""",""https://ieeexplore.ieee.org/stamp/stamp.jsp?arnumber=1189585"","""",""Computational modeling";Computer Society;Data structures;Stochastic processes;Costs;Multiprocessing systems;Supercomputers;Image processing;Partial differential equations;"Topology"","""",""17"","""",""19"",""IEEE"",""26 Mar 2003"","""","""",""IEEE"",""IEEE Journals""";;;;;;;;;;;;;;;;;;;;;;;;
"Protecting BGP routes to top-level DNS servers,""Lan Wang"; Xiaoliang Zhao; Dan Pei; R. Bush; D. Massey;" Lixia Zhang"",""Computer Science Department, University of California, Los Angeles, CA, USA"; Information Science Institute, University of Southern California, Arlington, VA, USA; Computer Science Department, University of California, Los Angeles, CA, USA; IIJ, Crystal Springs, WA, USA; Information Science Institute, University of Southern California, Arlington, VA, USA;" Computer Science Department, University of California, Los Angeles, CA, USA"",""IEEE Transactions on Parallel and Distributed Systems"",""29 Sep 2003"",""2003"",""14"",""9"",""851"",""860"",""The Domain Name System (DNS) is an essential part of the Internet infrastructure and provides fundamental services, such as translating host names into IP addresses for Internet communication. The DNS is vulnerable to a number of potential faults and attacks. In particular, false routing announcements can deny access to the DNS service or redirect DNS queries to a malicious impostor. Due to the hierarchical DNS design, a single fault or attack against the routes to any of the top-level DNS servers can disrupt Internet services to millions of users. We propose a path-filtering approach to protect the routes to the critical top-level DNS servers. Our approach exploits both the high degree of redundancy in top-level DNS servers and the observation that popular destinations, including top-level DNS servers, are well-connected via stable routes. Our path-filter restricts the potential top-level DNS server route changes to be within a set of established paths. Heuristics derived from routing operations are used to adjust the potential routes over time. We tested our path-filtering design against BGP routing logs and the results show that the design can effectively ensure correct routes to top-level DNS servers without impacting DNS service availability."",""1558-2183"","""",""10.1109/TPDS.2003.1233708"","""",""https://ieeexplore.ieee.org/stamp/stamp.jsp?arnumber=1233708"","""",""Protection";Web server;Network servers;Routing;Web and internet services;Domain Name System;IEEE news;Current measurement;Redundancy;"Testing"","""",""13"","""",""21"",""IEEE"",""29 Sep 2003"","""","""",""IEEE"",""IEEE Journals""";;;;;;;;;;;;;;;;;;
"Quorum-based algorithms for group mutual exclusion,""Yuh-Jzer Joung"",""Department of Information Management, National Taiwan University, Taipei, Taiwan"",""IEEE Transactions on Parallel and Distributed Systems"",""21 May 2003"",""2003"",""14"",""5"",""463"",""476"",""We propose a quorum system, which we referred to as the surficial quorum system, for group mutual exclusion. The surficial quorum system is geometrically evident and is easy to construct. It also has a nice structure based on which a truly distributed algorithm for group mutual exclusion can be obtained and processed loads can be minimized. When used with Maekawa's algorithm, the surficial quorum system allows up to /spl radic/2n/m(m-l) processes to access a resource simultaneously, where n is the total number of processes and m is the total number of groups. We also present two modifications of Maekawa's algorithm so that the number of processes that can access a resource at a time is not limited to the structure of the underlying quorum system, but to the number that the problem definition allows."",""1558-2183"","""",""10.1109/TPDS.2003.1199064"","""",""https://ieeexplore.ieee.org/stamp/stamp.jsp?arnumber=1199064"","""",""Distributed algorithms";Resource management;Network servers;Message passing;Network topology;Frequency synchronization;Delay;"Broadcasting"","""",""27"",""2"",""45"",""IEEE"",""21 May 2003"","""","""",""IEEE"",""IEEE Journals""";;;;;;;;;;;;;;;;;;;;;;;;;;;;;;
"Real-time digital signal processing of phased array radars,""Chin-Fu Kuo"; Tei-Wei Kuo;" Cheng Chang"",""Department of Computer Science and Information Engineering, National Taiwan University, Taipei, Taiwan"; Department of Computer Science and Information Engineering, National Taiwan University, Taipei, Taiwan;" System Development Center, Chung Shang Institute of Science and Technology, TaoYuan, Taiwan"",""IEEE Transactions on Parallel and Distributed Systems"",""21 May 2003"",""2003"",""14"",""5"",""433"",""446"",""With the advance of hardware and software technology, modern phased array radars are now built with commercial-off-the-shelf (COTS) components, and it opens up a new era in real-time resource scheduling of digital signal processing. This paper targets the essential issues in building a component-oriented signal processor (SP), which is one of the two major modules in modern phased array radars. We propose a simple but effective task allocation policy and a real-time scheduling algorithm to address the design objectives of SPs. We are able to bound the number of processing units needed for a component-oriented SP in the design time, while everything was done empirically in the past. A series of experiments was done to demonstrate the strength of our methodology."",""1558-2183"","""",""10.1109/TPDS.2003.1199062"","""",""https://ieeexplore.ieee.org/stamp/stamp.jsp?arnumber=1199062"","""",""Phased arrays";Digital signal processing;Radar signal processing;Processor scheduling;Signal processing;Radar tracking;Scheduling algorithm;Spaceborne radar;Real time systems;"Hardware"","""",""3"","""",""32"",""IEEE"",""21 May 2003"","""","""",""IEEE"",""IEEE Journals""";;;;;;;;;;;;;;;;;;;;;;;;
"Reducing false sharing and improving spatial locality in a unified compilation framework,""M. Kandemir"; A. Choudhary; J. Ramanujam;" P. Banerjee"",""Department of Computer Science and Engineering, Pennsylvania State University, University Park, PA, USA"; Department of Electrical and Computer Engineering, Northwestern University, Evanston, IL, USA; Department of Electrical and Computer Engineering, Louisiana State University, Baton Rouge, LA, USA;" Department of Electrical and Computer Engineering, Northwestern University, Evanston, IL, USA"",""IEEE Transactions on Parallel and Distributed Systems"",""22 Apr 2003"",""2003"",""14"",""4"",""337"",""354"",""The performance of applications on large shared-memory multiprocessors with coherent caches depends on the interaction between the granularity of data sharing, the size of the coherence unit, and the spatial locality exhibited by the applications, in addition to the amount of parallelism in the applications. Large coherence units are helpful in exploiting spatial locality, but worsen the effects of false sharing. A mathematical framework that allows a clean description of the relationship between spatial locality and false sharing is derived in this paper. First, a technique to identify a severe form of multiple-writer false sharing is presented. The importance of the interaction between optimization techniques aimed at enhancing locality and the techniques oriented toward reducing false sharing is then demonstrated. Given the conflicting requirements, a compiler-based approach to this problem holds promise. This paper investigates the use of data transformations in addressing spatial locality and false sharing, and derives an approach that balances the impact of the two. Experimental results demonstrate that such a balanced approach outperforms those approaches that consider only one of these two issues. On an eight-processor SGI/Cray Origin 2000 multiprocessor, our approach brings an additional 9 percent improvement over a powerful locality optimization technique that uses both loop and data transformations. The presented approach also obtains an additional 19 percent improvement over an optimization technique that is oriented specifically toward reducing false sharing. This study also reveals that, in addition to reducing synchronization costs and improving the memory subsystem performance, obtaining large granularity parallelism is helpful in balancing the effects of enhancing locality and reducing false sharing, rendering them compatible."",""1558-2183"","""",""10.1109/TPDS.2003.1195407"","""",""https://ieeexplore.ieee.org/stamp/stamp.jsp?arnumber=1195407"","""",""Application software";Optimizing compilers;Parallel machines;Computer Society;Parallel processing;Costs;Multiprocessing systems;Program processors;Data structures;"Multidimensional systems"","""",""4"",""4"",""51"",""IEEE"",""22 Apr 2003"","""","""",""IEEE"",""IEEE Journals""";;;;;;;;;;;;;;;;;;;;;;
