"2002 reviewers list,"""",,""IEEE Transactions on Parallel and Distributed Systems"",""29 Jan 2003"",""2003"",""14"",""1"",""94"",""96"",""The publication offers a note of thanks and lists its reviewers."",""1558-2183"","""",""10.1109/TPDS.2003.1167374"","""",""https://ieeexplore.ieee.org/stamp/stamp.jsp?arnumber=1167374"","""",""IEEE"","""","""","""","""",""IEEE"",""29 Jan 2003"","""","""",""IEEE"",""IEEE Journals""";;;;;;;;;;;;;;;;;;;;;;;;;;;;;;;;;;;;;
"Information-flow models for shared memory with an application to the PowerPC architecture,""A. Adir"; H. Attiya;" G. Shurek"",""IBM Laboratories, Haifa University, Haifa, Israel"; Department of Computer Science, Technion-Israel Institute of Technology, Haifa, Israel;" IBM Laboratories, Haifa University, Haifa, Israel"",""IEEE Transactions on Parallel and Distributed Systems"",""21 May 2003"",""2003"",""14"",""5"",""502"",""515"",""This paper introduces a generic framework for defining instructions, programs, and the semantics of their instantiation by operations in a multiprocessor environment. The framework captures information flow between operations in a multiprocessor program by means of a reads-from mapping from read operations to write operations. Two fundamental relations are defined on the operations: a program order between operations which instantiate the program of some processor and view orders which are specific to each shared memory model. An operation cannot read from the """"hidden"""" pastor from the future"; the future and the past causality can be examined either relative to the program order or relative to the view orders. A shared memory model specifies, for a given program, the permissible transformation of resource states. The memory model should reflect the programmer's view by citing the guaranteed behavior of the multiprocessor in the interface visible to the programmer. The model should retrain from dictating the design practices that should be followed by the implementation. Our framework allows an architect to reveal the programming view induced by a shared-memory architecture;" it serves programmers exploring the limits of the programming interface and guides architecture-level verification. The framework is applicable for complex, commercial architectures as it can capture subtle programming-interface details, exposing the underlying aggressive microarchitecture mechanisms. As an illustration, we define the shared memory model supported by the PowerPC architecture, within our framework."",""1558-2183"","""",""10.1109/TPDS.2003.1199067"","""",""https://ieeexplore.ieee.org/stamp/stamp.jsp?arnumber=1199067"","""",""Programming profession";Power system modeling;Microarchitecture;Out of order;Gas insulated transmission lines;Multiprocessing systems;Degradation;Performance gain;"Electric breakdown"","""",""25"",""1"",""21"",""IEEE"",""21 May 2003"","""","""",""IEEE"",""IEEE Journals""";;;;;;;;;;;;;;;;;;;;;;;
"Integrated access control and intrusion detection for Web servers,""T. Ryutov"; C. Neuman; K. Dongho;" Z. Li"",""USC Information Sciences Institute, Marina del Rey, CA"; USC Information Sciences Institute, Marina del Rey, CA; NA;" NA"",""IEEE Transactions on Parallel and Distributed Systems"",""29 Sep 2003"",""2003"",""14"",""9"",""841"",""850"",""Current intrusion detection systems work in isolation from access control for the application the systems aim to protect. The lack of coordination and interoperation between these components prevents detecting and responding to ongoing attacks in real-time before they cause damage. To address this, we apply dynamic authorization techniques to support fine-grained access control and application level intrusion detection and response capabilities. This paper describes our experience with integration of the Generic Authorization and Access Control API (GAA-API) to provide dynamic intrusion detection and response for the Apache Web server. The GAA-API is a generic interface which may be used to enable such dynamic authorization and intrusion response capabilities for many applications."",""1558-2183"","""",""10.1109/TPDS.2003.1233707"","""",""https://ieeexplore.ieee.org/stamp/stamp.jsp?arnumber=1233707"","""",""Access control";Intrusion detection;Web server;Protection;Authorization;Computer crime;Data security;Clocks;Buffer overflow;"Writing"","""",""34"",""17"",""7"",""IEEE"",""29 Sep 2003"","""","""",""IEEE"",""IEEE Journals""";;;;;;;;;;;;;;;;;;;;;;
"Interagent communication and synchronization support in the DaAgent mobile agent-based computing system,""S. Mishra";" P. Xie"",""Department of Computer Science, University of Colorado, Boulder, CO, USA";" Department of Computer Science, Boston University, Boston, MA, USA"",""IEEE Transactions on Parallel and Distributed Systems"",""26 Mar 2003"",""2003"",""14"",""3"",""290"",""306"",""This paper describes the design, implementation, and evaluation of interagent communication and synchronization models in the DaAgent mobile-agent based computing system. Based on the requirements of some sample Internet computing applications, eight system-level models of interagent communication and synchronization are proposed. A new synchronization mechanism called location synchronization that is relevant for interacting mobile agents is also proposed. This paper evaluates the eight models based on their utility, performance, level of communication and synchronization support, and applicability in the Internet computing environment. A prototype implementation and detailed performance evaluation of these models based on two interacting, multiagent applications are also presented."",""1558-2183"","""",""10.1109/TPDS.2003.1189586"","""",""https://ieeexplore.ieee.org/stamp/stamp.jsp?arnumber=1189586"","""",""Mobile communication";Mobile computing;Internet;Mobile agents;Distributed computing;Operating systems;Power system modeling;Computer science;Computer applications;"Prototypes"","""",""15"","""",""41"",""IEEE"",""26 Mar 2003"","""","""",""IEEE"",""IEEE Journals""";;;;;;;;;;;;;;;;;;;;;;;;;;
"IP traceback-based intelligent packet filtering: a novel technique for defending against Internet DDoS attacks,""Minho Sung";" Jun Xu"",""College of Computing, Georgia Institute of Technology, Atlanta, GA, USA";" College of Computing, Georgia Institute of Technology, Atlanta, GA, USA"",""IEEE Transactions on Parallel and Distributed Systems"",""29 Sep 2003"",""2003"",""14"",""9"",""861"",""872"",""Distributed Denial of Service (DDoS) is one of the most difficult security problems to address. While many existing techniques (e.g., IP traceback) focus on tracking the location of the attackers after-the-fact, little is done to mitigate the effect of an attack while it is raging on. We present a novel technique that can effectively filter out the majority of DDoS traffic, thus improving the overall throughput of the legitimate traffic. The proposed scheme leverages on and generalizes the IP traceback schemes to obtain the information concerning whether a network edge is on the attacking path of an attacker (""""infected"""") or not (""""clean""""). We observe that, while an attacker will have all the edges on its path marked as """"infected,"""" edges on the path of a legitimate client will mostly be """"clean"""". By preferentially filtering out packets that are inscribed with the marks of """"infected"""" edges, the proposed scheme removes most of the DDoS traffic while affecting legitimate traffic only slightly. Simulation results based on real-world network topologies all demonstrate that the proposed technique can improve the throughput of legitimate traffic by three to seven times during DDoS attacks."",""1558-2183"","""",""10.1109/TPDS.2003.1233709"","""",""https://ieeexplore.ieee.org/stamp/stamp.jsp?arnumber=1233709"","""",""Information filtering";Information filters;Telecommunication traffic;Computer crime;Throughput;Traffic control;Web and internet services;Security;Network topology;"Cellular neural networks"","""",""77"",""1"",""25"",""IEEE"",""29 Sep 2003"","""","""",""IEEE"",""IEEE Journals""";;;;;;;;;;;;;;;;;;;;;;;;;;
"Localized Delaunay triangulation with application in ad hoc wireless networks,""Xiang-Yang Li"; G. Calinescu; Peng-Jun Wan;" Yu Wang"",""Department of Computer Science, Illinois, Institute of Technology, Chicago, IL, USA"; Department of Computer Science, Illinois, Institute of Technology, Chicago, IL, USA; Department of Computer Science, Illinois, Institute of Technology, Chicago, IL, USA;" Department of Computer Science, Illinois, Institute of Technology, Chicago, IL, USA"",""IEEE Transactions on Parallel and Distributed Systems"",""27 Oct 2003"",""2003"",""14"",""10"",""1035"",""1047"",""Several localized routing protocols guarantee the delivery of the packets when the underlying network topology is a planar graph. Typically, relative neighborhood graph (RING) or Gabriel graph (GG) is used as such planar structure. However, it is well-known that the spanning ratios of these two graphs are not bounded by any constant (even for uniform randomly distributed points). Bose et al. (1999) recently developed a localized routing protocol that guarantees that the distance traveled by the packets is within a constant factor of the minimum if Delaunay triangulation of all wireless nodes is used, in addition, to guarantee the delivery of the packets. However, it is expensive to construct the Delaunay triangulation in a distributed manner. Given a set of wireless nodes, we model the network as a unit-disk graph (UDG), in which a link uv exists only if the distance /spl par/uv/spl par/ is at most the maximum transmission range. In this paper, we present a novel localized networking protocol that constructs a planar 2 5-spanner of UDG, called the localized Delaunay triangulation (LDEL), as network topology. It contains all edges that are both in the unit-disk graph and the Delaunay triangulation of all nodes. The total communication cost of our networking protocol is O(n log n) bits, which is within a constant factor of the optimum to construct any structure in a distributed manner. Our experiments show that the delivery rates of some of the existing localized routing protocols are increased when localized Delaunay triangulation is used instead of several previously proposed topologies. Our simulations also show that the traveled distance of the packets is significantly less when the FACE routing algorithm is applied on LDEL, rather than applied on GG."",""1558-2183"","""",""10.1109/TPDS.2003.1239871"","""",""https://ieeexplore.ieee.org/stamp/stamp.jsp?arnumber=1239871"","""",""Intelligent networks";Wireless networks;Routing protocols;Network topology;Wireless sensor networks;Mobile ad hoc networks;Cost function;Global Positioning System;Broadcasting;"Euclidean distance"","""",""146"","""",""40"",""IEEE"",""27 Oct 2003"","""","""",""IEEE"",""IEEE Journals""";;;;;;;;;;;;;;;;;;;;;;
"Low-cost and reliable mutual anonymity protocols in peer-to-peer networks,""Li Xiao"; Zhichen Xu;" Xiaodong Zhang"",""Department of Computer Science and Engineering, Michigan State University, East Lansing, MI, USA"; Hewlett-Packard Laboratories, Hewlett Packard Company, CA, USA;" Department of Computer Science, College of William and Mary, Williamsburg, VA, USA"",""IEEE Transactions on Parallel and Distributed Systems"",""29 Sep 2003"",""2003"",""14"",""9"",""829"",""840"",""We present several protocols to achieve mutual communication anonymity between an information requester and a provider in a P2P information-sharing environment, such that neither the requester nor the provider can identify each other, and no other peers can identify the two communicating parties with certainty. Most existing solutions achieve mutual anonymity in pure P2P systems without any trusted central controls. Compared with two such representative ones, our protocols improve efficiency in two different ways. First, utilizing trusted third parties and aiming at both reliability and low-cost, we propose a group of mutual anonymity protocols. We show that with some limited central support, our protocols can accomplish the goals of anonymity, efficiency, and reliability. Second, we propose a mutual anonymity protocol which relies solely on self-organizations among peers without any trusted central controls. In this protocol, the returning path can be shorter than the requesting path. This protocol does not need to broadcast the requested file back to the requester so that the bandwidth is saved and efficiency is improved. In addition, this protocol does not need special nodes to keep indices of sharing files, thus eliminating the index maintenance overhead and the potential for inconsistency between index records and peer file contents. We have evaluated our techniques in a browser-sharing environment. We show that the average increase in response time caused by our protocols is negligible, and these protocols show advantages over existing protocols in a P2P system."",""1558-2183"","""",""10.1109/TPDS.2003.1233706"","""",""https://ieeexplore.ieee.org/stamp/stamp.jsp?arnumber=1233706"","""",""Protocols";Intelligent networks;Peer to peer computing;Centralized control;Resists;Indexing;Telecommunication network reliability;Control systems;Broadcasting;"Bandwidth"","""",""26"","""",""29"",""IEEE"",""29 Sep 2003"","""","""",""IEEE"",""IEEE Journals""";;;;;;;;;;;;;;;;;;;;;;;;
"Measurement-based characterization and classification of QoS-enhanced systems,""A. Kuzmanovic";" E. W. Knightly"",""Department of Electrical and Computer Engineering, Rice University, Houston, TX, USA";" Department of Electrical and Computer Engineering, Rice University, Houston, TX, USA"",""IEEE Transactions on Parallel and Distributed Systems"",""22 Jul 2003"",""2003"",""14"",""7"",""671"",""685"",""Quality-of-service mechanisms and differentiated service classes are increasingly available in networks and Web servers. While network and Web server clients can assess their service by measuring basic performance parameters such as packet loss and delay, such measurements do not expose the system's core QoS functionality such as multiclass service discipline. In this paper, we develop a framework and methodology for enabling network and Web server clients to assess system's multiclass mechanisms and parameters. Using hypothesis testing, maximum likelihood estimation, and empirical arrival and service rates measured across multiple time scales, we devise techniques for clients to: 1) determine the most likely service discipline among earliest deadline first, class-based weighted fair queuing, and strict priority"; 2) estimate the system's parameters with high confidence;" and (3) detect and parameterize non work-conserving elements such as rate limiters. We describe the important role of time scales in such a framework and identify the conditions necessary for obtaining accurate and high confidence inferences."",""1558-2183"","""",""10.1109/TPDS.2003.1214319"","""",""https://ieeexplore.ieee.org/stamp/stamp.jsp?arnumber=1214319"","""",""Web server";Traffic control;Loss measurement;System testing;Quality of service;Telecommunication traffic;Scheduling algorithm;Bandwidth;Monitoring;"Performance loss"","""",""2"","""",""28"",""IEEE"",""22 Jul 2003"","""","""",""IEEE"",""IEEE Journals""";;;;;;;;;;;;;;;;;;;;;;;;
"Middleware infrastructure for parallel and distributed programming models in heterogeneous systems,""J. Al-Jaroodi"; N. Mohamed; H. Jiang;" D. Swanson"",""Department of Computer Science and Engineering, University of Nebraska, Lincoln, Lincolnshire, NE, USA"; Department of Computer Science and Engineering, University of Nebraska, Lincoln, Lincolnshire, NE, USA; Department of Computer Science and Engineering, University of Nebraska, Lincoln, Lincolnshire, NE, USA;" Department of Computer Science and Engineering, University of Nebraska, Lincoln, Lincolnshire, NE, USA"",""IEEE Transactions on Parallel and Distributed Systems"",""24 Nov 2003"",""2003"",""14"",""11"",""1100"",""1111"",""We introduce a middleware infrastructure that provides software services for developing and deploying high-performance parallel programming models and distributed applications on clusters and networked heterogeneous systems. This middleware infrastructure utilizes distributed agents residing on the participating machines and communicating with one another to perform the required functions. An intensive study of the parallel programming models in Java has helped identify the common requirements for a runtime support environment, which we used to define the middleware functionality. A Java-based prototype, based on this architecture, has been developed along with a Java object-passing interface (JOPI) class library. Since this system is written completely in Java, it is portable and allows executing programs in parallel across multiple heterogeneous platforms. With the middleware infrastructure, users need not deal with the mechanisms of deploying and loading user classes on the heterogeneous system. Moreover, details of scheduling, controlling, monitoring, and executing user jobs are hidden, while the management of system resources is made transparent to the user. Such uniform services are essential for facilitating the development and deployment of scalable high-performance Java applications on clusters and heterogeneous systems. An initial deployment of a parallel Java programming model over a heterogeneous, distributed system shows good performance results. In addition, a framework for the agents' startup mechanism and organization is introduced to provide scalable deployment and communication among the agents."",""1558-2183"","""",""10.1109/TPDS.2003.1247671"","""",""https://ieeexplore.ieee.org/stamp/stamp.jsp?arnumber=1247671"","""",""Middleware";Parallel programming;Java;Application software;Runtime environment;Prototypes;Libraries;Scheduling;Control systems;"Monitoring"","""",""40"",""10"",""30"",""IEEE"",""24 Nov 2003"","""","""",""IEEE"",""IEEE Journals""";;;;;;;;;;;;;;;;;;;;;;
"Multihop all-to-all broadcast on WDM optical networks,""Qian-Ping Gu";" Shietung Peng"",""School of Computing Science, Simon Fraser University, Burnaby, BC, Canada";" Faculty of Computer and Information Science, Hosei University, Tokyo, Japan"",""IEEE Transactions on Parallel and Distributed Systems"",""21 May 2003"",""2003"",""14"",""5"",""477"",""486"",""Wavelength-division multiplexing (WDM) optical networks provide huge bandwidth by allowing multiple data streams transmitted simultaneously along the same optical fiber, with each stream assigned a distinct wavelength. A key issue on WDM optical networks is to minimize the number of wavelengths for communications. All-to-all broadcast (gossiping) is a fundamental communication application on computer/communication networks. It is known that the minimum numbers of wavelengths for realizing gossiping in one-hop of optical routing on the ring and the two-dimensional torus of N nodes are cN/sup 2/ and cN/sup 3/2/, c /spl ap/ 1/8, respectively. These numbers can be too large even for moderate values of N. One approach to reduce the number of wavelengths is to realize gossiping in multihops of routing. We give routing algorithms which realize gossiping in k-hops (k /spl ges/ 2) by O(N/sup 1+1/k/) wavelengths on the ring, O(N/sup 1+1/(2k)/) wavelengths on the 2D torus, and O(N/sup 1+1/(3k)/) wavelengths on the 3D torus on a simple multihop routing model. We also discuss the multihop routing for gossiping on a merge model. We give the upper bounds on the numbers of wavelengths for gossiping in two-hops and three-hops for the ring, 2D torus, and 3D torus on the merge model."",""1558-2183"","""",""10.1109/TPDS.2003.1199065"","""",""https://ieeexplore.ieee.org/stamp/stamp.jsp?arnumber=1199065"","""",""Spread spectrum communication";Broadcasting;Wavelength division multiplexing;WDM networks;Optical fiber networks;Wavelength routing;Bandwidth;Optical fibers;Application software;"Computer applications"","""",""17"","""",""20"",""IEEE"",""21 May 2003"","""","""",""IEEE"",""IEEE Journals""";;;;;;;;;;;;;;;;;;;;;;;;;;
"MVSS: an active storage architecture,""Xiaonan Ma";" A. L. N. Reddy"",""Almaden Research Cente, IBM, San Jose, CA, USA";" Department of Electrical Engineering, Texas A and M University, College Station, TX, USA"",""IEEE Transactions on Parallel and Distributed Systems"",""27 Oct 2003"",""2003"",""14"",""10"",""993"",""1005"",""This paper presents MVSS, a storage system for active storage devices MVSS offers a single framework for supporting various services at the device level. It provides a flexible interface for associating services to a file through multiple views of the file Similar to views of a database in a multiview database system, views in MVSS are generated dynamically and are not stored on physical storage devices. MVSS represents each view of an underlying file through a separate entry in the file system namespace. MVSS separates the deployment of services from file system implementations and, thus, allows services to be migrated to storage devices. The paper presents the design of MVSS and how different services can be supported in MVSS at the device level. To illustrate our approach, we implemented a prototype system on PCs running Linux. We present results from example applications implemented on the prototype and discuss a variety of architectural issues including mixed workloads."",""1558-2183"","""",""10.1109/TPDS.2003.1239868"","""",""https://ieeexplore.ieee.org/stamp/stamp.jsp?arnumber=1239868"","""",""File systems";Operating systems;Computer Society;Prototypes;Bandwidth;Power system interconnection;Computer architecture;Database systems;Personal communication networks;"Linux"","""",""22"","""",""31"",""IEEE"",""27 Oct 2003"","""","""",""IEEE"",""IEEE Journals""";;;;;;;;;;;;;;;;;;;;;;;;;;
"Nonblocking checkpointing for optimistic parallel simulation: description and an implementation,""F. Quaglia";" A. Santoro"",""Dipartimento di Informatica e Sistemistica, Università di Roma La Sapienza, Rome, Italy";" Dipartimento di Informatica e Sistemistica, Università di Roma La Sapienza, Rome, Italy"",""IEEE Transactions on Parallel and Distributed Systems"",""20 Jun 2003"",""2003"",""14"",""6"",""593"",""610"",""Describes a nonblocking checkpointing mode in support of optimistic parallel discrete event simulation. This mode allows real concurrency in the execution of state saving and other simulation specific operations (e.g, event list update, event execution) with the aim of removing the cost of recording state information from the completion time of the parallel simulation application. We present an implementation of a C library supporting nonblocking checkpointing on a myrinet based cluster, which demonstrates the practical viability of this checkpointing mode on standard off-the-shelf hardware. By the results of an empirical study on classical parameterized synthetic benchmarks, we show that, except for the case of minimal state granularity applications, nonblocking checkpointing allows improvement of the speed of the parallel execution, as compared to commonly adopted, optimized checkpointing methods based on the classical blocking mode. A performance study for the case of a personal communication system (PCS) simulation is additionally reported to point out the benefits from nonblocking checkpointing for a real world application."",""1558-2183"","""",""10.1109/TPDS.2003.1206506"","""",""https://ieeexplore.ieee.org/stamp/stamp.jsp?arnumber=1206506"","""",""Checkpointing";Discrete event simulation;Context modeling;Costs;Circuit simulation;Central Processing Unit;Concurrent computing;Libraries;Hardware;"Personal communication networks"","""",""42"","""",""43"",""IEEE"",""20 Jun 2003"","""","""",""IEEE"",""IEEE Journals""";;;;;;;;;;;;;;;;;;;;;;;;;;
"Nonblocking k-fold multicast networks,""Yuanyuan Yang";" Jianchao Wang"",""Department of Electrical and Computer Engineering, State University of New York, Stony Brook, Stony Brook, NY, USA";" NA"",""IEEE Transactions on Parallel and Distributed Systems"",""19 Feb 2003"",""2003"",""14"",""2"",""131"",""141"",""Multicast communication involves transmitting information from a single source to multiple destinations and is a requirement in high-performance networks. Current trends in networking applications indicate an increasing demand in future networks for multicast capability. Many multicast applications require not only multicast capability, but also predictable communication performance such as guaranteed multicast latency and bandwidth. In this paper, we present a design for a nonblocking k-fold multicast network, in which any destination node can be involved in up to k simultaneous multicast connections in a nonblocking manner. We also develop an efficient routing algorithm for the network. As can be seen, a k-fold multicast network has significantly lower network cost than that of k copies of ordinary 1-fold multicast networks and is a cost effective choice for supporting arbitrary multicast communication."",""1558-2183"","""",""10.1109/TPDS.2003.1178877"","""",""https://ieeexplore.ieee.org/stamp/stamp.jsp?arnumber=1178877"","""",""Communication switching";Delay;Routing;Hardware;Multicast communication;Multicast algorithms;System recovery;Switches;Application software;"Bandwidth"","""",""14"","""",""25"",""IEEE"",""19 Feb 2003"","""","""",""IEEE"",""IEEE Journals""";;;;;;;;;;;;;;;;;;;;;;;;;;
